id,title,synopsis
5198,Grand Canyon,grand canyon revolved around six residents from different backgrounds whose lives intertwine in modern-day los angeles. at the center of the film is the unlikely friendship of two men from different races and classes brought together when one finds himself in jeopardy in the other's rough neighborhood.
5219,Melody Time,"in the grand tradition of disney's great musical classics, melody time features seven timeless stories, each enhanced with high-spirited music and unforgettable characters. disney favorite donald duck puts on a display of jazzy antics as the star of ""blame it on the samba."" music becomes a real adventure for a busy bumble bee in ""bumble boogie."" cheer on the mischievous young tugboat in ""little toot"" and root for the heroes of legend and myth in ""johnny appleseed"" and ""pecos bill."" you'll tap your toes and clap your hands in this witty feast for the eyes and ears."
5221,The Nutcracker,"the nutcracker is mikhail baryshnikov's breathtaking and critcally acclaimed emmy nominated production. the thisspectacular performance is danced by the magnificent team of baryshnikov, one of the greatest classical dancers of the century, and gelsey kirkland, both chowcased at the peak of the their careers, with members of the american ballet theatre."
5245,Big Rig,"big rig (2008) is a documentary film by doug pray about long-haul truck drivers. the film consists of a series of interviews with different drivers, focusing on both their personal life stories and also the life and culture of truck drivers in the united states."
5257,Disaster Movie,"the filmmaking team behind the hits ""scary movie,"" ""date movie,"" ""epic movie"" and ""meet the spartans"" this time puts its unique, inimitable stamp on one of the biggest and most bloated movie genres of all time -- the disaster film."
5295,Baby Einstein: Baby Bach - Musical Adventure,"this unique video introduces babies and toddlers to musical experiences that will stimulate and delight them through charming puppetry, timeless art, live-action footage, classical music and child-friendly poetry."
5298,Baby Einstein: Baby Galileo - Discovering the Sky,"baby galileo, brain stimulating classical music accompanies vibrant images of the planets and the universe. designed for infants between the ages of approximately one and 36 months"
5300,Baby Einstein: Baby Neptune - Discovering Water,"from the same company that produces baby einstein comes baby neptune. baby neptune is an educational and imaginative look at the world of water, from the beach to the bath. featuring baby friendly images like puppets and toys as well as music by handel and other classical composers, baby neptune is sure to stimulate and delight the mind of any young child."
5305,Baby Einstein: Baby Van Gogh - World of Colors,"this unique video, starring ""vincent van goat,"" introduces babies and toddlers to basic colors through charming puppetry, timeless art, live-action footage, classical music and child-friendly poetry. includes images of van gogh's most famous ... full descriptionpaintings. featuring child-friendly arrangements of music by brahms, ravel, strauss, tchaikovsky and others."
5309,Baby Einstein: My First Signs - See and Sign with Baby,"as babies grow, their eye-hand coordination begins to improve as their ability to interact with their surroundings blossoms. it is the perfect time for my first signs, a playful introduction to 20 common words and phrases from baby's world -- including ""mommy"", ""daddy"" and ""i love you"" -- both spoken and in sign language. join special guest marlee matlin as she demonstrates this exciting way for babies to express themselves even before they have master verbal communication. featuring fun puppet shows, real-world images and beautiful classical music, this delightful program presents fun ways for you and your baby to interact on a whole new level!"
5310,Baby Einstein: Neighborhood Animals,"as babies continue to explore the world around them, they soon encounter many creatures, both large and small, that are extremely intriguing. whether furry or feathered, winged or wiggly, bumpy or smooth, each holds a special fascination. neighborhood animals exposes little ones to animals most likely to be found close to home or in easily recognized environments. with a captivating combination of live-action footage, stimulating, colorful images and engaging puppet shows accompanied by beautiful classical music, this wonderful introduction to familiar animal life will provide you and your baby with countless opportunities to discover a world of engaging creatures together in and near your own backyard!"
5313,Baby Einstein: World Animals - A Musical Safari,"on world animals, classical music arrangements are combined with colorful puppetry to teach young viewers about both music and animals. frisky host jane, a monkey puppet, leads a journey around the globe to introduce babies to delightful wild animals while child-friendly classical music plays in the background"
5316,Citizen Ruth,"""citizen ruth"" is the story of ruth stoops, a woman who nobody even noticed -- until she got pregnant. now, everyone wants a piece of her. the film is a comedy about one woman caught in the ultimate tug-of-war: a clash of wild, noisy, ridiculous people that rapidly dissolves into a media circus."
5324,Kurt & Courtney,"after rocker kurt cobain's death, ruled a suicide, a film crew arrives in seattle to make a documentary. director nick broomfield talks to lots of people. portraits emerge: a shy, slight kurt, weary of touring, embarrassed by fame, hooked on heroin; an out-going courtney, dramatic, controlling, moving from groupie to star."
5327,Death Defying Acts,"on a tour of britain in 1926, harry houdini enters into a passionate affair with a psychic out to con the famous magician."
5333,The King,"the king is the story of graham kennedy, australia's first and greatest home grown tv superstar. it traces his rise from working class balaclava kid, through radio, tv, film, and back to tv again. it also tracks kennedy's personal tragedies - the loneliness, the unrealised ambitions and the terrible pressures of being australia's first homegrown superstar in the 1950s and 60s."
5371,The Last Waltz,"martin scorsese's documentary intertwines footage from ""the band's"" incredible farewell tour with probing backstage interviews and featured performances by eric clapton, bob dylan, joni mitchell, van morrison, and other rock legends."
5380,In the Electric Mist,"lt. dave robicheaux, a detective in new iberia, louisiana, is trying to link the murder of a local hooker to new orleans mobster julie (baby feet) balboni, who is co-producer of a civil war film. at the same time, after elrod sykes, the star of the film, reports finding another corpse in the atchafalaya swamp near the movie set, robicheaux starts another investigation, believing the corpse to be the remains of a black man who he saw being murdered 35 years before."
5381,Dylan Moran: Monster,"irish comedian dylan moran live at vicar street, dublin."
5384,Finishing the Game: The Search for a New Bruce Lee,"in 1973, martial arts great bruce lee died, his final film, game of death, left unfinished. with the public hungry for more lee, movie execs decide to find a replacement. this outrageous satire looks at the entire process, from the oddball candidates to the greed and racial motivations that drive the final decision. there's big business in the movies, and finishing the game skewers it with an eye for '70s detail."
5416,Johan Cruijff - En un momento dado,johan cruijff - en un momento dado is a 2004 documentary film by ramon gieling on the life of dutch footballer johan cruijff.
5419,Razzle Dazzle: A Journey into Dance,"razzle dazzle follows the eager members of ""mr. jonathon's dance academy"" who, with their unique dance routines, compete for grand final success at australia's most prestigious competition. amidst parental politics, petty rivalry, creative controversy and the hysterics of pushy stage mothers, the film takes you behind the glamor and the glitter to a world where, sometimes, winning is everything!"
5425,Slap Shot 3: The Junior League,get ready for a rough-and-tumble comedy that knows how to kick some serious puck!
5437,Teen Spirit: The Tribute to Kurt Cobain,"a music documentary about kurt cobain and his music - told by the people who were inspired by his extraordinary genius. bringing together his peers, his friends, those close to the band and not forgetting the loyal fans who keep his memory alive."
5440,New World Disorder 1,"the start of a legacy. the first of the new world disorder series which stopped at the 10th film. the movie was one of only a few documenting the mountain bike disciplines of free riding, trails and downhill. the filming is incredible for the time while the music is hard rock of the late 90's. added bonuses include the most impressive unicyclist you'll ever have seen and a pair of mountain boardera. also included is fourwheel mountain biking with trevair sending it big and stacy kohut seding it stylie. the most iconic part of this film is the ""jah drop"" that josh bender attempts. the jah drop is a 55ft. cliff located in kamloops, canada."
5441,New World Disorder 3: Freewheel Burning,"freewheel burning is on fire! like the first two chapters in the disorder series, freewheel burning puts you on the edge of your seat and takes it up a notch with the biggest and baddest stunts freeriding has ever seen! freewheel burning sizzles with huge road gaps, bad ass bikercross, over the top dirt jumping and silly-fast single track that smokes the competition! freewheel burning is another fantastic entry. street riding makes an appearance. the new hell track is insane. we miss out on the unicycling and the handicap cycling, but its more than made up for by the rest of the film."
5442,New World Disorder 4: Ride the Lightning,"disorderly conduct features a fresh crop of new young rippers. strap in and hold on for the continuing evolution of the sport with monster park and crankworx slopestyle competitions, more bc stunt riding than you can throw a stick at and huge air time and big booters that we're renowned for!!! journey to new zealand, australia, whistler, europe, alaska, bc and utah. for me, this is the pinnacle of the disordeer series. the riding is so varied, the music is so appropriate and it amazes me every time i see it. the best moment is the tour de france gap. sadly, he got arrested for it and put in french prison for 2 days! oh well, its an awesome scene!"
5444,New World Disorder 6: Unchained,"unchained, features badass riding by the best in the biz. once again, our cinees have scoured the earth, hitting the most exotic locales and competitions worldwide. tune into over 2 hours of riding and extras featuring footage from adidas slopestyle, crankworx, monsterpark, bolivia, utah, bc canada and mexico on this special double dvd."
5445,New World Disorder 7: Flying High Again,"freeride entertainment is back and traveling the globe to capture the best riding on the planet! filmed in hd and 16 mm, flying high again presents a visual landscape that feels weightless one moment and powerfully raw the next. your heart will race as you witness in vibrant clarity the hugest airs, sickest stunts, and gnarliest urban assaults ever performed on a mountain bike! hard-hitting tunes and loads of bonus features juice up this visually tasty movie, making it a must see!"
5446,Christmas on Mars,"the film tells the story of the experiences of major syrtis during the first christmas on a newly-colonized mars. coyne has described the film as ""maybe eraserhead or dead man crossed with some kind of fantasy and space aspects, like the wizard of oz and maybe a space odyssey, and set at christmas-time. the story that unfolds is intended to hint at childlike magic within a tragic and realistic situation."""
5452,Allan Quatermain and the Temple of Skulls,"filmed on location in south africa, a retelling of h. rider haggard's classic novel ""king solomon's mines,"" featuring the adventurer who was the inspiration for indiana jones."
5464,Bratz,"the popular bratz dolls come to life in their first live-action feature film. finding themselves being pulled further and further apart, the fashionable four band together to fight peer pressure, learn what it means to stand up for your friends, be true to oneself and live out your dreams."
5506,Cecil B. Demented,an insane independent film director and his renegade group of teenage film makers kidnap an a-list hollywood actress and force her to star in their underground film.
5530,Film Noir,private detective sam ruben's clever plan falls apart with the onset of amnesia. everyone is trying to kill him and he doesn't know why. the classic film noir milieu now comes to you in the form of an animated feature.
5537,American Movie,"american movie is the story of filmmaker mark borchardt, his mission, and his dream. spanning over two years of intense struggle with his film, his family, financial decline, and spiritual crisis, american movie is a portrayal of ambition, obsession, excess, and one man's quest for the american dream."
5551,Infamy,a feature-length documentary about graffiti culture as told through the experiences of six well-known graffiti writers and a graffiti buffer.
5555,Beyond the Mat,"beyond the mat is a 1999 professional wrestling documentary, directed by barry w. blaustein. the movie focuses on the lives of professional wrestlers outside of the ring, especially mick foley, terry funk, and jake roberts. the film heavily focuses on the world wrestling federation (wwf), often criticizing it and its chairman vince mcmahon. it also follows extreme championship wrestling, it's rise in popularity, and many other independent wrestlers and organisations."
5561,Loose Change,"what if...september 11th was not a surprise attack on america, but rather, a cold and calculated genocide by our own government?we were told that the twin towers were hit by commercial jetliners and subsequently brought down by jet fuel. we were told that the pentagon was hit by a boeing 757. we were told that flight 93 crashed in shanksville, pennsylvania. we were told that nineteen arabs from halfway across the globe, acting under orders from osama bin laden, were responsible. what you will see here will prove without a shadow of a doubt that everything you know about 9/11 is a complete fabrication. conspiracy theory? it's not a theory if you can prove it.written and narrated by dylan avery, this film presents a rebuttal to the official version of the september 11, 2001 terrorist attacks and the 9/11 commission report."
5565,In the Shadow of the Moon,"archival material from the original nasa film footage – much of it seen for the first time – plus interviews with the surviving astronauts, including jim lovell, dave scott, john young, gene cernan, mike collins, buzz aldrin, alan bean, edgar mitchell, charlie duke and harrison schmitt."
5576,Of Penguins and Men,"a behind-the-scenes look at the making of ""march of the penguins""."
5579,Cadillac Records,"the story of sex, violence, race and rock and roll in 1950s chicago, and the exciting but turbulent lives of some of america's musical legends, including muddy waters, leonard chess, little walter, howlin' wolf, etta james and chuck berry."
5583,I Am Trying to Break Your Heart: A Film About Wilco,"a documentary by photographer sam jones documenting american rock band wilco recording their fourth album yankee hotel foxtrot. originally intended as a showcase of the band's creative process, the film crew catches unexpected complications between the band and its record label and problems among the band members themselves."
5594,ABBA: The Movie,a radio dj in pursuit of an exclusive interview follows abba during their mega-successful tour of australia.
5662,Alone in the Wilderness,"dick proenneke retired at age 50 in 1967 and decided to build his own cabin in the wilderness at the base of the aleutian peninsula, in what is now lake clark national park. using color footage he shot himself, proenneke traces how he came to this remote area, selected a homestead site and built his log cabin completely by himself. the documentary covers his first year in-country, showing his day-to-day activities and the passing of the seasons as he sought to scratch out a living alone in the wilderness."
5676,Lisa Lampanelli: The Queen of Mean,"hilarious, raunchy. adult comedy. in clubs and theaters across the country, lisa lampanelli calls audience members colored, queer, bald, fat, and old. do they get offended? angry? no! they laugh uncontrollably and demand to know when she'll be back in town. after watching this hour-long concert--filmed live at rascal's comedy club in west orange, new jersey--you'll see why! a cross between don rickles, archie bunker, and a vial of estrogen, lisa lives up to her three favorite f-words: ""fierce, funny, and fearless""! she's got a bawdy personality, all-out honesty, and the insult comic's most essential quality--undeniable likability. all this adds up to one important 4-letter word: star."
5690,Jeff Dunham: Spark of Insanity,"combining his amazing talent and his unorthodox sense of humor, jeff dunham returns, yet again, with a hilarious stand-up comedy and ventriloquist performance. starting off with the infamously known walter, scrutinizing every bit of today's american society. followed by two new characters, achmed the dead terrorist, who continuously threatens the crowd with silence and death, and melvin the superhero."
5691,Jeff Dunham's Very Special Christmas Special,the multi-platinum selling comedian performs his first holiday-themed stand-up special with his friends.
5692,Jeff Dunham: Arguing with Myself,"a recorded live performance of ventriloquist jeff dunham portrays a comedian whose revival of an old-fashioned art has made ventriloquism more relevant to modern societal concerns. starring his six main characters, from bubba jay, a nascar-obsessed hick, to peanut, a flamboyant gay monkey, dunham’s puppets have dirty but inoffensive senses of humor that mock the american dream."
5693,The Matrix Revisited,the film goes behind the scenes of the 1999 sci-fi movie the matrix.
5705,Rings,"julia becomes worried about her boyfriend, holt when he explores the dark urban legend of a mysterious videotape said to kill the watcher seven days after viewing. she sacrifices herself to save her boyfriend and in doing so makes a horrifying discovery: there is a ""movie within the movie"" that no one has ever seen before."
5766,Circle One,"with a fast-paced soundtrack and some of the greatest names in surfing, circle one is sure to entertain. check out ben bourgeois, kelly slater and danny fuller as they catch one big wave after another, showing off the moves that have made them famous. filmed at various locations around the globe, this film delivers some of the best surfing footage around and has been hailed as one of the best surf"
5785,Midnight Movie,"a rarely seen slasher flick gets a midnight screening at a run-down movie theater. the film's director was supposedly driven insane by it, but that doesn't deter horror fans, including bridget and her boyfriend, josh, from attending the showing. when the lights dim and the movie starts, they'd better prepare themselves for the scare of their lives. that's because they're not just going to be watching this bloodbath -- they're going to be starring in it."
5799,Getaway in Stockholm 3,a honda nsx is in the hands of one of the world's most famous traffic violators. once again mr x challenges the swedish police department in this favorite movie for speed freaks when he sets a new record racing through stockholm.
5809,Bill Hicks: Sane Man,"sane man was filmed before bill recorded ‘dangerous’, his first comedy album, and is a turning point in hicks’ career. it was the first complete hicks show ever filmed and bill pulled out all the stops for the cameras. completely focused, a newly-sober hicks paces the stage like a wild animal riffing effortless."
5812,The Goodbye Girl,"paula knows that, in romance, all actors follow the same stage instruction: exit. without warning, her actor boyfriend splits for a movie role, and sublets their manhattan apartment to elliot, another actor."
5819,Silk,"based on the best-selling novel by alessandro baricco, this visually stunning film tells the story of a french trader who finds unexpected love far away from home."
5826,Redemption: A Mile from Hell,"can one act justify a lifetime of wickedness? explore the darkest confines of the soul from robert conway's film, ""redemption."" a genre busting western where there is no law, no good guys; only the bad and worse. frank harden is no stranger to the unlawful west, he is a killer. however, because of a tragic event he must battle his own worst enemy, himself."
5827,Festival Express,"the filmed account of a large canadian rock festival train tour boasting major acts.  in the summer of 1970, a chartered train crossed canada carrying some of the world's greatest rock bands. the grateful dead, janis joplin, the band, buddy guy, and others lived (and partied) together for five days, stopping in major cities along the way to play live concerts. their journey was filmed."
5828,The Onion Movie,"venerable newscaster norm archer reports the latest news in politics, health, culture and entertainment - such as an automotive recall of decapitation-inducing ""neckbelts"" and a study finding that ""depression hits losers hardest"". this compilation of bogus news stories, celebrity profiles, movie trailers and skits come courtesy of the ace satirists at the onion."
5830,10 MPH,"two guys quit stodgy corporate jobs, scrounged up all the savings they could, collected credit cards, and stepped - or better yet - scooted forward to follow their biggest dream: to become filmmakers. josh caldwell rode a segway from seattle to boston, while his buddy hunter weeks directed a film they both shot about the experience and about the moments leading up to this crazy twist on the americ"
5841,Michael McIntyre: Live & Laughing,acclaimed stand-up comedian michael mcintyre delivers a hilarious performance to a receptive crowd at london's hammersmith apollo.
5842,George Lucas in Love,"1967 film student george lucas has writer's block trying to finish his ""space wheat"" script, until a beautiful fellow student with a familiar hairstyle teaches him that the best stories are in plain sight."
5843,Heima,"ethereal post-rock pioneers sigur rós play a string of impromptu gigs in their native iceland after finishing a world tour in 2006. as they travel through the country, the band visits a wide variety of venues, from a large outdoor festival to a coffee shop."
5846,For Your Consideration,"three actors learn that their respective performances in the film ""home for purim,"" a drama set in the mid-1940s american south, are generating award-season buzz."
5854,Mickey's Christmas Carol,"it is an adaptation of the charles dickens classic a christmas carol, featuring scrooge mcduck as his namesake and inspiration ebenezer scrooge and mickey mouse as bob cratchit. this film was based on a 1972 audio musical entitled disney's a christmas carol. it is a twenty-four minute animated short film produced by walt disney productions as an accompaniment to a re-release of the rescuers."
5901,September Dawn,"a story set against the mountain meadows massacre, the film is based upon the tragedy which occurred in utah in 1857. a group of settlers, traveling on wagons, was murdered by the native mormons. all together, about 140 souls of men, women and children, were taken."
5910,Dirty Sanchez: The Movie,"the welsh nutters, dirty sanchez are making a movie: the concept of the film is that the devil has heard about the dare devil nature of the sanchez boys so he's set them the ultimate challenge, to complete stunts based on the 7 deadly sins or be damned to the gutter forever."
5912,Roskilde,"documentary about one of europe's major music festivals, the roskilde festival."
5915,1776,"the film focuses on the representatives of the thirteen original colonies who participated in the second continental congress. 1776 depicts the three months of deliberation (and, oftentimes, acrimonious debate) that led up to the signing of one of the most important documents in the history of the united states, the declaration of independence."
5916,Pooh's Grand Adventure: The Search for Christopher Robin,"a full length animated film for all the family to enjoy. pooh gets confused when christopher robin leaves him a note to say that he has gone back to school after the holidays. so pooh, piglet, tigger, eeyore and rabbit go in search of christopher robin which leads to a big adventure."
5919,Saludos Amigos,"live-action segments show members of the disney staff touring south america and recording their impressions in sketches. these segue into four animated sections: ""lake titicaca"" depicts tourist donald duck's troubles with a stubborn llama; and in ""aquarela do brasil,"" jose carioca shows donald the sights and sound of rio de janeiro."
5927,Dark Reel,"murder, mystery and mayhem as b movie fan, adam waltz, wins walk on role in a film featuring scream queen, cassie blue (tiffany shepis). thinking his luck had changed for the better he steps into chaos with a killer loose and no one on the production safe."
5949,Moog,"documentary about robert moog who was an american pioneer of electronic music, best known as the inventor of the moog synthesizer."
