id,title,synopsis
6544,Christopher Titus: Norman Rockwell is Bleeding,"a stand-up comic, chris titus, special."
6558,Tromeo & Juliet,"a modern, punk adaptation of shakespeare's classic. told irreverently, this film attempts to impact the viewer in the same way theatre-goers were effected in shakespeare's time. bawdy, violent, humorous, and romantic."
6563,Will Ferrell: You're Welcome America - A Final Night with George W. Bush,"will ferrell stars in a stand-up comedy as george w. bush in this take on the former president of the united states. after playing george w. bush on saturday night live for many years, funny man will ferrell brings his impression to broadway to send up the 43rd president of the united states of america."
6567,Festival,"black and white footage of performances, interviews, and conversations at the newport folk festival, from 1963 to 1966. the headliners are peter, paul and mary, joan baez, pete seeger, and bob dylan, who's acoustic and electric. son house and mike bloomfield talk about the blues; john hurt, howlin' wolf, and sonny terry and brownie mcghee show its range. the osborne brothers perform bluegrass. donovan, johnny cash, judy collins, mimi and dick farina, and others less well known also perform. several talk musical philosophy, and there's a running commentary about the nature and appeal of folk music. the crowd looks clean cut."
6583,13 Hours in a Warehouse,"as five underworld heavies settle in for an all night stay at an abandoned warehouse and former film studio, a series of bizarre and unsettling occurrences quickly lead them to believe they are not alone. it was supposed to be a simple night of babysitting a single hostage, but when a series of numbers began to appear on the walls things soon took a dark turn. later, after the hostage escapes, the perplexed thugs not only learn that there is a rat in the ranks, but also discover the unsettling nature of the films that were shot in the warehouse. now, as terror takes hold, the thieves are about to discover that they are being stalked from the shadows and that their odds of living to see daybreak are shrinking with each passing minute.written by jason buchanan, all movie guide"
6588,Armin Only: The Next Level,"more than 12,000 clubbers packed rotterdam's ahoy stadium for this epic set by dj armin van buuren, in which the dutch trance superstar electrified audiences for nine hours. highlights from the unforgettable evening in november 2005 include many of armin's own tracks -- including ""zocalo,"" ""hymne"" and ""sail"" -- as well as beats by arctic quest, inertia and others."
6589,Jackass 3D,"jackass 3d is a 3-d film and the third movie of the jackass series. it follows the same premise as the first two movies, as well as the tv series. it is a compilation of various pranks, stunts and skits. before the movie begins, a brief introduction is made by beavis and butt-head explaining the 3d technology behind the movie. the intro features the cast lining up and then being attacked by various objects in slow-motion. the movie marks the 10th anniversary of the franchise, started in 2000."
6596,End of the Century: The Story of the Ramones,"a years-in-the-making documentary on the legendary punk band the ramones. through a mixture of archival footage, archival and new interviews with all members of the band's various lineups, and new interviews with a number of their contemporaries, the film traces the peaks and valleys the band experienced over the course of its 20-plus year career before disbanding in 1995."
6599,Sullivan's Travels,"successful movie director john l. sullivan, convinced he won't be able to film his ambitious masterpiece until he has suffered, dons a hobo disguise and sets off on a journey, aiming to ""know trouble"" first-hand. when all he finds is a train ride back to hollywood and a beautiful blonde companion, he redoubles his efforts, managing to land himself in more trouble than he bargained for when he loses his memory and ends up a prisoner on a chain gang."
6601,Monster,"two women, aspiring documentary filmmakers, find themselves trapped in a monster-plagued toyko in 2003."
6606,Tiësto In Concert²,"once again, tiësto has left his mark on the history of dance music when he returns with a new installment of tiësto in concert. this time he has outdone himself by doing 2 shows in arnhem, holland (october 29th and 30th, 2004) and a show in hasselt, belgium (november 6th, 2004), sharing his music and vision with over 70,000 fans!"
6612,Hercules Returns,"when brad gets fired from his job, he goes to reopen an old cinema, he enlists his frends to help him show the last film the cinema aired before it closed... only they don't know, the film is in italian. with everyone sitting ready they begin to dub the movie... on the fly!"
6624,Vinyan,"six months after losing her only child in the southeast asia tsunami, jeanne is convinced she sees him in a film about orphans living in the jungles."
6625,Ararat,"a variety of characters, some close relatives, others distant strangers, are each affected by the making of a film about the armenian genocide of 1915."
6627,Riverworld,"a movie for the sci fi channel based on the book series by philip josé farmer. the location is riverworld, a mysterious and treacherous land where every human who died between the years 99,000 bc and 2,200 ad has been resurrected on the banks of a huge river."
6642,Jeff Wayne's Musical Version of The War of the Worlds: Live on Stage!,"in 1978 jeff wayne composed and produced one of the most groundbreaking and best-selling musical works of all time. in 2006, after much anticipation, jeff wayne's musical version of the war of the worlds was brought to the stage for the first time, playing to sold-out arenas.  this version filmed at wembley arena (uk) on 25th april 2006."
6647,Pride,"in this uplifting film based on a true story, coach jim ellis (terrence howard) shocks the community and changes lives when, aided by a local janitor (bernie mac), he sets out to form philadelphia's first black swim team. but the odds are against them as they battle rigid rules, racism and more."
6661,Panic Mechanic,"when hanky pranky (alias schucks), star of a candid camera tv show, loses his job to affirmative action, he applies for a job at a stress academy. it´s not long before schucks discovers his new boss, jack paddaman, is as crooked as they come, but it´s too late: the employment contract is signed and sealed.a year passes, and schucks is no better off. however, his candid camera videos, which poke fun at all sectors of post-1994 south africa, prove a big hit with stressed-out government ministers. when the president asks paddaman to make a movie to benefit street children, schucks and his pals do all the hard work while paddaman plans how he can get hold of the profits from the video sales. add a scatterbrained secretary, a lovelorn traffic cop and a cunning street child and you have a roll-in-the aisles comedy with a distinctly south african flavour."
6662,Oh Schucks.... It's Schuster!,"in a series of short skits, leon schuster uses candid camera and several disguises to stitch up the general public of south africa"
6668,Othello,the evil iago pretends to be friend of othello in order to manipulate him to serve his own end in the film version of this shakespeare classic.
6674,Brothers of the Head,"in the 1970s a music promoter plucks siamese twins from obscurity and grooms them into a freakish rock'n'roll act. a dark tale of sex, strangeness and rock music."
6687,The Comedians of Comedy,"the comedians of comedy is an occasional stand-up comedy tour featuring patton oswalt, zach galifianakis, brian posehn and maria bamford that was documented in a 2005 film and 2005 comedy central television series of the same name, both directed by michael blieden."
6689,Zach Galifianakis: Look Who it Isn't,"self-released dvd showcasing a variety of zach galifianakis' comedy routines. includes clips from vh-1's ""late world with zach"" and some of zach's stand-up appearances."
6692,Little Britain Live,the many hilarious characters of little britain are taken to the stage in this brilliant live performance by matt lucas and david walliams.
6700,To Hell and Back,"the true wwii story of audie murphy, the most decorated soldier in u.s. history. based on the autobiography of audie murphy who stars as himself in the film."
6719,The Sunshine Boys,"lewis and clark, aka the sunshine boys, were famous comedians during the vaudeville era, but off-stage they couldn't stand each other and haven't spoken in over 20 years of retirement. willy clark's nephew is the producer of a tv variety show that wants to feature a reunion of this classic duo. it is up to him to try to get the sunshine boys back together again."
6731,The Clown and His Dogs,short film of 300 individually painted images.
6740,Spellbound,this documentary follows 8 teens and pre-teens as they work their way toward the finals of the scripps howard national spelling bee championship in washington d.c.
6741,El Cid,"epic film of the legendary spanish hero, rodrigo diaz (""el cid"" to his followers), who, without compromising his strict sense of honour, still succeeds in taking the initiative and driving the moors from spain."
6750,John Mayer: Any Given Thursday,"any given thursday is a live cd/dvd by john mayer, recorded in birmingham, alabama at the oak mountain amphitheater on september 12, 2002, during the room for squares tour. the album quickly peaked at #17 on the billboard 200 chart. it features mostly songs from room for squares."
6765,The Telling,"in this horror anthology film, three girls pledge the most popular - and cruelest - sorority on campus. for their final task, they must tell the scariest story they know. containing three distinct stories - one featuring a murderous doll, one a has-been actress and her run in with a film crew of the undead and, finally, a hunt-and-kill fright-fest."
6773,Bukowski: Born Into This,"director john dullaghan’s biographical documentary about infamous poet charles bukowski, bukowski: born into this, is as much a touching portrait of the author as it is an exposé of his sordid lifestyle.  interspersed between ample vintage footage of bukowski’s poetry readings are interviews with the poet’s fans including such legendary figures such as lawrence ferlinghetti, joyce fante (wife of john), bono, and harry dean stanton.  filmed in grainy black and white by bukowski’s friend, taylor hackford, due to lack of funding, the old films edited into this movie paint bukowski’s life of boozing and brawling romantically, securing bukowski’s legendary status."
6780,National Lampoon Presents Electric Apricot: Quest for Festeroo,"electric apricot is a spoof of jam bands centered around the band, electric apricot, in the style of ""this is spinal tap"""
6795,Nine Inch Nails: Closure,"closure is the 12th official nine inch nails release. it consists of  music videos interspersed with snippets from educational films, as well as exclusive footage shot by peter christopherson including antics by nine inch nails and their tour guests: marilyn manson, jim rose circus and david bowie.  originally scheduled to be released on dvd in 2004, the disc appeared on internet torrent sites in 2006,  including behind-the-scenes footage of the ""closer"" video with commentary by mark romanek.  fans speculate that reznor may have been the source of this leak."
6801,Meet the Raisins!,"meet the raisins! spoofs musical documentaries with its use of anthropomorphic food characters. through its historical perspective, the special also provided an opportunity to elaborate on the personalities and introduce names of the simple yet popular characters. it follows the california raisins' humble beginnings, rise to musical success, fall from stardom, and eventual comeback. this includes ""home movie"" clips, scenes of the group's early days as the vine-yls, concert footage, and interviews with the people behind the success of the california raisins including manager rudy begaman. the group is also shown performing various hit songs"
6819,Truth In 24,"it's 24 hours of pure exhilaration, complete exhaustion, and it's not for the faint of heart or the ill-prepared. it is the legendary 24 hours of le mans. but before you win it, you have to master finishing it. this film chronicles the dedication, the determination and the spirit required to not just survive 3,000 grueling miles, but to be in a position to win one of the greatest races in history."
6828,Global Metal,"in global metal, directors scot mcfadyen and sam dunn set out to discover how the west's most maligned musical genre - heavy metal - has impacted the world's cultures beyond europe and north america. the film follows metal fan and anthropologist sam dunn on a whirlwind journey through asia, south america and the middle east as he explores the underbelly of the world's emerging extreme music scenes; from indonesian death metal to chinese black metal to iranian thrash metal. global metal reveals a worldwide community of metalheads who aren't just absorbing metal from the west - they're transforming it - creating a new form of cultural expression in societies dominated by conflict, corruption and mass-consumerism."
6844,The Meerkats,"a coming of age story following a young meerkat pup, kolo, growing up in the kalahari desert; and an inspiring look at how one family's connection to each other and their surroundings is a model of resilience and fortitude for us all. shot using ground-breaking techniques, this dramatised documentary is a one-of-a-kind presentation from the weinstein company and the bbc, featuring narration by paul newman."
6852,The Obama Deception,"who obama works for, what lies he has told, and his real agenda. if you want to know the facts and cut through all the hype, this is the film for you."
6861,Coldplay: Live 2003,"features coldplay in a 90 minute live dvd shoot taken from their performances at the horden pavilion in sydney, australia, in july 21st and 22nd, 2003. tracks include the hits ""politik"", ""yellow"", ""trouble"", ""clocks"" and many more. also features 2 previously unreleased live tracks: ""the one i love"" and ""moses"".  tracklist: 01. politik 02. god put a smile upon your face 03. a rush of blood to the head 04. daylight 05. trouble 06. one i love 07. don't panic 08. shiver 09. see you soon 10. everything's not lost 11. moses 12. yellow 13. the scientist 14. clocks 15. in my place 16. amsterdam 17. life is for living"
6870,Café de los maestros,"coffee masters is a documentary by miguel kohan, produced by lita stantic, gustavo santaolalla and walter salles. it tells the story of great tango of the old guard who, summoned by a rock musician, proposing a record to demonstrate its validity. this adventure, full of memories, humor and poignant moments, culminating with a presentation of the masters at the teatro colon."
6872,Adam & Steve,"adam and steve are two gay youths who have a one-night stand that ends embarrassingly. nearly two decades later, adam, now a manhattan tour guide, and steve, a psychiatrist, meet again -- but neither remembers the other from years before. the two begin dating, even playing matchmaker for their friends michael and rhonda, but their promising relationship hits a major snag when adam and steve finally recall their past connection."
6874,Billy Joel: Live from the River of Dreams,"previously only available in the ""billy joel: my lives"" box set, this dvd features one of billy's best concerts: billy joel live in frankfurt, germany in 1994 on the ""river of dreams"" tour."
6902,After Sex,"sex is a background to examine intimacy and vulnerability. looks at the complexity of modern day relationships told through eight separate couples. through dialogue and compromising situations, the film takes us from the beginning of a relationship to the aftermath of one, and examines every stage in between seeing humor within the drama, heartache and confusion of it all."
6906,Rush: Exit... Stage Left,"exit...stage left was filmed in montreal canada during rush's 1981 world tour that encompassed canada, the united states and europe  and reached a total audience in excess of one million people. the footage incorporated the output of five separate 16mm cameras, both hand-held and stationary, which operated in front of the stage behind a barricade, and in various strategic onstage locations. during the performance at the montreal forum, the audio was recorded by le mobile, with terry brown and guy charbonneau at the controls. the audio was then digitally mixed at le studio in morin heights, quebec, where moving pictures, permanent waves, and signals  were recorded and mixed. the result, the exit...stage left movie (a different performance than that found on the live exit...stage left album), represents one hour of highlights from rush's two hour stage show, visualizing material from their albums moving pictures, permanent waves, hemispheres, and a farewell to kings."
6908,Rush: Chronicles,"whilst rush have always been considered one of rock's greatest hidden treasures, with complex, intricate musicianship, it can never be said that music video was their forté. with this collection of 'hit' videos from rush we can see why. almost befittingly, rush's best videos appear to be those that simply demonstrate their playing. studio footage of rush is rare and welcomed on this dvd."
6910,Rush: A Show of Hands,"for a band with high standards, a perfect show is impossible, and an excellent show is rare. you hope that the norm is ""good"". to deliver a really exceptional, comfortable performance before a recording truck or film crew has been our unfulfilled dream of many years. always it seemed that as soon as the machines started rolling, we forgot how to play and our equipment forgot how to work.  but for these two nights, the gods smile.  and the film becomes not just a concert, but a symbol - for the band a scrapbook, an autobiography, an era frozen in glacial clarity. for the audience, it can be an enduring souvenir, and if it can't quite capture what it was like to be there, it is a way of seeing through many pairs of eyes, of shifting one's vantage-point around and above the players in a way no mortal could.  hands perform, and hands respond. hands gesture, and hands respond. a show of ears and eyes, a show of hearts and minds. a show of hands.  - neil peart"
6911,Rush: R30,"r30 captures the band's $21-million grossing, sell-out 30th anniversary world tour and was filmed with 14 hi-definition cameras in 16x9 widescreen format at the festhalle, frankfurt germany on september 24, 2004.  the set list spans the band's diverse 30-year career, and includes fan favorites ""xanadu,"" ""the spirit of radio,"" ""working man,"" ""tom sawyer,"" ""subdivisions,"" ""earthshine,"" ""2112,"" ""limelight,"" ""between the wheels,"" which hasn't been performed live in 20 years as well as tracks from 2004's covers ep feedback, including ""summertime blues"" and ""crossroads."" most of all eighteen studio albums are well represented through a non-stop energetic set of 22 electrifying songs."
6912,Rush: Grace Under Pressure Tour 1984,"by 1984, rush were becoming the world's most popular 'underground' band. the world was also in a sombre mood, perhaps reflecting on george orwell's 1984 thoughts. rush's music from the grace under pressure album captured this mood well, and their footage of the maple leaf gardens concert in their home town toronto on 21 september 1984 covers many of the stunning tracks from that album."
6929,Freebird,a rock and roll road movie comedy set in wales
6930,Fast Track: No Limits,an action movie centered around a group of street racers.
6940,WWE: Greatest Wrestling Stars of the '90s,"this retrospective program takes a look back on the most dramatic and memorable professional wrestling moments of the 1990s, with profiles on some of the greatest wrestling stars of the decade, and an account of the feud between wcw and the wwe."
6957,In The Womb,in the womb is a 2005 national geographic channel documentary that focus on studying and showing the development of the embryo in the uterus. the show makes extensive use of computer-generated imagery to recreate the real stages of the process.
6960,The Mating Habits of the Earthbound Human,"david hyde pierce, playing an alien (credited as infinity-cubed in the opening credits), narrates a courtship in a late-20th century american city as an extraterrestrial nature documentary. the relationship ""footage"" is played straight, while the voice-over (with its most often wildly inaccurate theories) and elaborate visual metaphors add comedy."
6962,Why Did I Get Married?,"the film is about the difficulty of maintaining a solid relationship in modern times. eight married college friends plus one other non-friend (all of whom have achieved middle to upper class economic status) go to colorado for their annual week-long reunion, but the mood shifts when one couple's infidelity comes to light. secrets are revealed and each couple begins to question their own marriage"
6969,National Geographic: Journey to the Edge of the Universe,"in one single, epic camera move we journey from earth's surface to the outermost reaches of the universe on a grand tour of the cosmos, to explore newborn stars, distant planets, black holes and beyond."
6975,Bill Maher: The Decider,"superstar comedian/writer bill maher, one of the most highly credited comic minds today, is back in an all-new solo hbo comedy special performed live. maher, known for his sharp wit, offers his candid and hilarious opinions on a wide range of social and political issues including sex, drugs, iraq, immigration, president bush, and much more in this can't miss special. live show from berklee performance center, boston, massachusetts"
6976,Wham! in China: Foreign Skies,"best known for their radio staples ""wake me up before you go-go"" and ""careless whisper,"" the seminal 80s pop group wham! (george michael and andrew ridgeley) shot wham! in china: foreign skies circa 1985. in the resulting film, the group performs 12 numbers, including the aforementioned hits, ""ray of sunshine,"" ""blue,"" and ""young guns (go for it!)""."
6984,Lee Evans: Big,"lee evans returns to the stage with another hilarious stand-up routine, this time at london's 02 arena."
6985,Behind the Planet of the Apes,"roddy mcdowall takes you, film by film, from production meetings to make-up sessions, then right onto the movie set to see the actual filming of the science fiction masterpiece. the most comprehensive history of planet of the apes ever created, this fascinating 127-minute documentary explores one of the most imaginative and influential series in movie history."
6993,Ali G: Bling Bling,"bling bling is an assortment of ali g's interviews; a couple of them with possibly the last people in britain who didn't realise that someone was pulling their leg and several with american grandees of various sorts, including economist jk galbraith and former cia director admiral stansfield turner. the real selling point, however, is ali g's undeniably spectacular comic relief interview"
6996,The Fall of the Roman Empire,"drawn from the same events that later inspired gladiator, the film charts the power-hungry greed and father-son betrayal that led to rome's collapse at the bloody hands of the barbarians."
7003,The Art of Football from A to Z,"funnyman john cleese leads viewers through an exhaustive -- and hilarious -- tour of the world of soccer, complete with the sport's most memorable goals, kicks, saves, goofs and penalties. also included are reflections on soccer's impact on culture, including the monty python sketch ""philosophy football,"" and interviews with celebrities dave stewart, dennis hopper and henry kissinger, as well as soccer icons pelé, mia hamm and thierry henry."
7007,Flavors,"flavors is a 2003 romantic comedy film concerning indian immigrants in america. it was written and directed by raj nidimoru.the film tracks the love lives of several people that have immigrated from india to america. principally, it focuses on the wedding of a wasp jenni (played by vicky schnee) and rad (anupam mittal)."
7036,Kylie Minogue: Showgirl: The Greatest Hits Tour,"showgirl: the greatest hits tour is the eighth concert tour by australian singer kylie minogue. it was launched in support of her second major greatest hits compilation, ultimate kylie and visited europe."
7037,Zappa Plays Zappa,"zappa plays zappa is the name of a concert tour and band led by dweezil zappa, the oldest son of the late composer and musician frank zappa. the show is a collection of frank zappa's rock-oriented compositions from 1960s to 1980s. features dweezil on lead guitar, napoleon murphy brock (sax, flute, vocals), drummer/singer terry bozzio and electric guitarist steve vai."
7038,Avril Lavigne: The Best Damn Tour - Live in Toronto,"pop-punk princess avril lavigne plays the hits that earned her legions of screaming fans (and launched a thousand ringtones) on the best damn tour, a full-length presentation of her 2008 concert in toronto. opening with monster hit ""girlfriend,"" lavigne rocks through every one of her major singles, including ""complicated,"" ""my happy ending,"" and the ubiquitous ""sk8r boi.""  01. girlfriend 02. i can do better 03. complicated 04. my happy ending 05. i’m with you 06. i always get what i want (linkin park instrumental — dancers only) 07. when you’re gone 08. innocence 09. don’t tell me 10. hot 11. losing grip (joan jett cover, “bad reputation”) 12. eeverything back but you 13. runaway / mickey (toni basil song - partial) 14. the best damn thing 15. i don’t have to try 16. he wasn’t 17. sk8r boi"
