id,title,synopsis
2,Life in Loops (A Megacities RMX),"timo novotny labels his new project an experimental music documentary film, in a remix of the celebrated film megacities (1997), a visually refined essay on the hidden faces of several world ""megacities"" by leading austrian documentarist michael glawogger. novotny complements 30 % of material taken straight from the film (and re-edited) with 70 % as yet unseen footage in which he blends original shots unused by glawogger with his own sequences (shot by megacities cameraman wolfgang thaler) from tokyo. alongside the japanese metropolis, life in loops takes us right into the atmosphere of mexico city, new york, moscow and bombay. this electrifying combination of fascinating film images and an equally compelling soundtrack from sofa surfers sets us off on a stunning audiovisual adventure across the continents. the film also makes an original contribution to the discussion on new trends in documentary filmmaking. written by karlovy vary iff 2006"
12,The Endless Summer,"bruce brown's the endless summer is one of the first and most influential surf movies of all time. the film documents american surfers mike hynson and robert august as they travel the world during california’s winter (which, back in 1965 was off-season for surfing) in search of the perfect wave and ultimately, an endless summer."
16,9 Songs,"matt, a young glaciologist, soars across the vast, silent, icebound immensities of the south pole as he recalls his love affair with lisa. they meet at a mobbed rock concert in a vast music hall - london's brixton academy. they are in bed at night's end. together, over a period of several months, they pursue a mutual sexual passion whose inevitable stages unfold in counterpoint to nine live-concert songs."
46,Megacities,megacities is a documentary about the slums of five different metropolitan cities.
48,Kunstgriff,kunstgriff is a brilliantly filmed black and white short film. andre f. nebe gives proof of his storytelling abilities in this 6 minute film.
61,The Big Lebowski,"jeffrey 'the dude' lebowski, a los angeles slacker who only wants to bowl and drink white russians, is mistaken for another jeffrey lebowski, a wheelchair-bound millionaire, and finds himself dragged into a strange series of events involving nihilists, adult film producers, ferrets, errant toes, and large sums of money."
69,Gimme Shelter,"the landmark documentary about the tragically ill-fated rolling stones free concert at altamont speedway on december 6, 1969. only four months earlier, woodstock defined the love generation; now it lay in ruins on a desolate racetrack six miles outside of san francisco."
70,Primary,primary is a documentary film about the primary elections between john f. kennedy and hubert humphrey in 1960. primary is the first documentary to use light equipment in order to follow their subjects in a more intimate filmmaking style. this unconventional way of filming created a new look for documentary films where the camera’s lens was right in the middle of what ever drama was occuring.
120,Hotel Rwanda,"inspired by true events, this film takes place in rwanda in the 1990s when more than a million tutsis were killed in a genocide that went mostly unnoticed by the rest of the world. hotel owner paul rusesabagina houses over a thousand refuges in his hotel in attempt to save their lives."
184,Swimming Pool,"in the middle of this amusing thriller is a relationship between two different types of females, one is a well know british author and the other is a sex-crazed french teen. the two get into some relationship trouble while living together in this film of psychological imagery and an erotic exploration of the female body."
222,Lisbon Story,lisbon story is wim wenders' homage to lisbon and films. a sound engineer obtains a mysterious postcard from a friend who at the moment is filming a film in lisbon. he sets out across europe to find him and help him.
248,Cube 2: Hypercube,the sequel to the low budget first film cube. this time the prisoners find them selves in a more advanced cube environment that they must escape from before they are killed. a science fiction film where space and time have more than one path.
249,Cube Zero,cube zero is the third film in the trilogy yet this time instead of a film about people trapped in a deadly cube trying to get out we see it from the eyes of someone who is controlling the cube and the torture of the victims inside. when the nerd can’t stand to see a woman suffer he himself enters the cube to try and save her.
254,Romeo + Juliet,"in director baz luhrmann's contemporary take on william shakespeare's classic tragedy, the montagues and capulets have moved their ongoing feud to the sweltering suburb of verona beach, where romeo and juliet fall in love and secretly wed. though the film is visually modern, the bard's dialogue remains."
262,Bandyta,bastard depicts the distress of needy children and the love of a nurse and a hard boiled criminal. a film from polish director maciej dejczer and actor til schweiger’s first international film.
263,Pi,the debut film from darren aronofsky in which a mathematical genius maximilian cohen discovers a link in the connection between numbers and reality and thus believes he can predict the future.
274,Borat: Cultural Learnings of America for Make Benefit Glorious Nation of Kazakhstan,"kazakh journalist borat sagdiyev travels to america to make a documentary. as he zigzags across the nation, borat meets real people in real situations with hysterical consequences. his backwards behavior generates strong reactions around him exposing prejudices and hypocrisies in american culture."
290,Ed Wood,"the mostly true story of the legendary ""worst director of all time"", who, with the help of his strange friends, filmed countless b-movies without ever becoming famous or successful."
348,Sunset Boulevard,a hack screenwriter writes a screenplay for a former silent film star who has faded into hollywood obscurity.
386,Dr. No,"in the film that launched the james bond saga, agent 007 battles mysterious dr. no, a scientific genius bent on destroying the u.s. space program. as the countdown to disaster begins, bond must go to jamaica, where he encounters beautiful honey ryder, to confront a megalomaniacal villain in his massive island headquarters."
387,Boyz n the Hood,boyz n the hood is the popular and successful film and social criticism from john singleton about the conditions in south central los angeles where teenagers are involved in gun fights and drug dealing on a daily basis.
400,Nanook of the North,"this pioneering documentary film depicts the lives of the indigenous inuit people of canada's northern quebec region. although the production contains some fictional elements, it vividly shows how its resourceful subjects survive in such a harsh climate, revealing how they construct their igloo homes and find food by hunting and fishing. the film also captures the beautiful, if unforgiving, frozen landscape of the great white north, far removed from conventional civilization."
404,Harry Potter and the Goblet of Fire,"when harry potter's name emerges from the goblet of fire, he becomes a competitor in a grueling battle for glory among three wizarding schools — the triwizard tournament. but since harry never submitted his name for the tournament, who did? now harry must confront a deadly dragon, fierce water demons and an enchanted maze only to find himself in the cruel grasp of he who must not be named. in this fourth film adaptation of j.k. rowling's harry potter series, everything changes as harry, ron and hermione leave childhood forever and take on challenges greater than anything they could have imagined."
405,Harry Potter and the Order of the Phoenix,"the rebellion begins! lord voldemort has returned, but the ministry of magic is doing everything it can to keep the wizarding world from knowing the truth – including appointing ministry official dolores umbridge as the new defence against the dark arts professor at hogwarts. when umbridge refuses to teach practical defensive magic, ron and hermione convince harry to secretly train a select group of students for the wizarding war that lies ahead. a terrifying showdown between good and evil awaits in this enthralling film version of the fifth novel in j.k. rowling’s harry potter series. prepare for battle!"
412,Contact,"contact is a science fiction film about an encounter with alien intelligence. based on the novel by carl sagan the film starred jodie foster as the one chosen scientist who must make some difficult decisions between her beliefs, the truth, and reality."
449,Murder Ahoy,"during an annual board of trustees meeting, one of the trustees dies. miss marple thinks he’s been poisoned after finding a chemical on him. she sets off to investigate at the ship where he had just come from. the fourth and final film from the miss marple series starring margaret rutherford as the quirky amateur detective."
479,The Omen,a diplomatic couple adopts the son of the devil without knowing it. a remake of the classic horror film of the same name from 1976.
486,Airplane!,"the persons and events in this film are fictitious - fortunately! a masterpiece of off-the-wall comedy, airplane! features robert hays as an ex-fighter pilot forced to take over the controls of an airliner when the flight crew succumbs to food poisoning; julie hagerty as his girlfriend/stewardess/co-pilot; and a cast of all-stars including robert stack, lloyd bridges, peter graves, leslie nielsen, kareem abdul-jabbar... and more. their hilarious high jinks spoof airplane disaster flicks, religious zealots, television commercials, romantic love... the list whirls by in rapid succession. and the story races from one moment of zany fun to the next."
488,Animal Farm,an animated film from 1999 based on the famous novel by george orwell. animals on a farm lead a revolution against the farmers to put their destiny in their own hands. however this revolution eats their own children and they cannot avoid corruption.
533,Singin' in the Rain,"in 1927 hollywood, a silent film production company and cast make a difficult transition to sound."
540,Coffee and Cigarettes,coffee and cigarettes is a collection of eleven films from cult director jim jarmusch. each film hosts star studded cast of extremely unique individuals who all share the common activities of conversing while drinking coffee and smoking cigarettes.
576,The Jazz Singer,"a young jewish man is torn between tradition and individuality when his old-fashioned family objects to his career as a jazz singer. this is the first full length feature film to use synchronized sound, and is the original film musical."
617,Sherlock Jr.,"a film projectionist longs to be a detective, and puts his meagre skills to work when he is framed by a rival for stealing his girlfriend's father's pocketwatch."
626,Blow-Up,"a successful mod photographer in london whose world is bounded by fashion, pop music, marijuana, and easy sex, feels his life is boring and despairing. but in the course of a single day he accidentally captures on film the commission of a murder. the fact that he has photographed a murder does not occur to him until he studies and then blows up his negatives, uncovering details, blowing up smaller and smaller elements, and finally putting the puzzle together."
666,Dogtown and Z-Boys,"this award-winning, thrilling story is about a group of discarded kids who revolutionized skateboarding and shaped the attitude and culture of modern day extreme sports. featuring old skool skating footage, exclusive interviews and a blistering rock soundtrack, dogtown and z-boys captures the rise of the zephyr skateboarding team from venice's dogtown, a tough ""locals only"" beach with a legacy of outlaw surfing."
690,Superstar: The Karen Carpenter Story,"the final 17 years of american singer and musician karen carpenter, performed almost entirely by modified barbie dolls. the first film from todd haynes (velvet goldmine, i'm not there), superstar is a hauntingly beautiful biopic that garnered immediate praise among the local film community but quickly received 2 cease-and-desist letters from mattel, the maker of barbie, and karen carpenter's family. to this day, this movie has not seen further release."
691,The Way Things Go,"artists peter fischli and david weiss create the ultimate rube goldberg machine with a complex imaginative devices that trigger each other for 30 minutes in a domino effect. the film was creating in an empty warehouse and with objects probably found at a junkyard as the creative contraptions fly, burn, roll, walk, melt, pop, push and fall in an endless science project that will mesmerize the mind."
707,Flying Saucer Rock 'N' Roll,flying saucer rock n roll is the debut feature film from the father-son duo eric and joe callero. the year is 1957 as a group of rockabilly and beatnik teens are visited by weed smoking martian zombies who have come to take their earth women. filmed with respect for classic horror films and full of laughs as the viewer is taken on an adventure like no other.
772,The Boys from County Clare,"in ireland in the mid 1960s, two feuding brothers and their respective ceilidh bands compete at a music festival."
776,A Shot in the Dark,a shot in the dark is the second and more successful film from the pink panther film series where both animated and real life sequences are mixed. a cult classic from blake edwards based on the play l’idiot by marcel achard and harry kurnitz.
787,Still Crazy,"in the seventies strange fruit were it. they lived the rock lifestyle to the max, groupies, drugs, internal tension and an ex front man dead from an overdose. even their demise was glamorous; when lightning struck the stage during an outdoor festival. 20 years on and these former rock gods they have now sunk deep into obscurity when the idea of a reunion tour is lodged in the head of tony, former keyboard player of the fruits. tony sets out to find his former bandmates with the help of former manager karen to see if they can recapture the magic and give themselves a second chance."
793,The People vs. Larry Flynt,"larry flynt is the hedonistically obnoxious, but indomitable, publisher of hustler magazine. the film recounts his struggle to make an honest living publishing his girlie magazine and how it changes into a battle to protect the freedom of speech for all people."
814,The Bridge,the bridge is a controversial documentary that shows people jumping to their death from the golden gate bridge in san francisco - the world's most popular suicide destination. interviews with the victims' loved ones describe their lives and mental health.
820,Prinzessinnenbad,"a film about three teenagers - klara, mina and tanutscha - from the berlin district of kreuzberg. the trio have known each other since kindergarten and have plenty in common. the three 15-year-olds are the best of friends; they are spending the summer at prinzenbad, a large open-air swimming pool at the heart of the district where they live. they're feeling pretty grown up, and are convinced they've now left their childhood behind."
860,The Big One,"the big one is an investigative documentary from director michael moore who goes around the country asking why big american corporations produce their product abroad where labor is cheaper while so many americans are unemployed, losing their jobs, and would happily be hired by such companies as nike."
864,The Backyard,"lightbulbs, fire, barbed wire, mousetraps, staple guns, thumbtacks and glass are weapons of choice in the backyard. this undercover documentary takes you deep into the controversial arena of backyard wrestling where the limits are constantly being tested...and broken. the backyard follows several backyard wrestlers in different countries as they pursue their dream to become professional wrestlers."
865,Roger & Me,"a documentary about the closure of general motors' plant at flint, michigan, which resulted in the loss of 30,000 jobs. details the attempts of filmmaker michael moore to get an interview with gm ceo roger smith."
866,An Inconvenient Truth,a documentary on al gore's campaign to make the issue of global warming a recognized problem worldwide.
882,The Big Sleep,"private eye philip marlowe (robert mitchum) investigates a case of blackmail involving the two wild daughters of a rich general, a pornographer and a gangster. this neo-noir remake of the iconic 1946 bogart film transfers the setting of raymond chandler's novel from 1940s california to 1970s london."
883,A Chorus Line,"a group of dancers congregate on the stage of a broadway theatre to audition for a new musical production directed by zach. after the initial eliminations, seventeen hopefuls remain, among them cassie, who once had a tempestuous romantic relationship with zach. she is desperate enough for work to humble herself and audition for him; whether he's willing to let professionalism overcome his personal feelings about their past remains to be seen."
893,"Farewell, My Lovely","la private eye philip marlowe (robert mitchum) is hired by ex-con moose malloy to find his girlfriend. while also investigating the murder of a client and the theft of a jade necklace, marlowe becomes entangled with seductress helen grayle (charlotte rampling) and discovers a web of dark secrets that are better left hidden. soaked in 1940s period detail, farewell, my lovely is a neo noir remake of the 1944 film but it follows the original raymond chandler's novel more closely."
896,The Legend of Boggy Creek,"a documentary-style drama based on true accounts of the fouke monster in arkansas, boggy creek focuses on the lives of back country people and their culture while chronicling sightings of the monster."
897,Dig!,"a documentary on the once promising american rock bands the brian jonestown massacre and the dandy warhols. the friendship between respective founders, anton newcombe and courtney taylor, escalated into bitter rivalry as the dandy warhols garnered major international success while the brian jonestown massacre imploded in a haze of drugs."
912,Take The Bridge,take the bridge is a 2007 independent film from sergio m. castilla about four young adults who all try to commit suicide on the same day and how they meet up and become friends. the film premiering at the 2007 tribeca film festival.
963,Rosebud,in a bold coup a palestinian terrorist group captures the yacht rosebud and kidnaps the millionaires five daughters on it. at first they demand film clips to be shown on major european tv stations. undercover agent martin is hired to hunt the terrorists down.
988,Bra Boys,a film about the cultural evolution of the sydney beach side suburb of maroubra and the social struggle faced by it's youth - the notorious surf gang known as the bra boys.
1091,The Flickering Flame,"documentary following dockers of liverpool sacked in a labour dispute and their supporters’ group, women of the waterfront, as they receive support from around the world and seek solidarity at the tuc conference."
1094,Man with the Screaming Brain,in 2005 bruce campbell directed his first ever feature film. the film stars bruce campbell as a wealthy ceo who travels to bulgaria after the fall of communism. his plan was to do business for his u.s. drug company yet he is shortly caught up in some dirty situations and ends up with a brain transplant after his brain is severely damaged. slapstick b-movie science fiction on a low budget.
1095,Dixie Chicks: Shut Up and Sing,"shut up and sing is a documentary about the country band from texas called the dixie chicks and how one tiny comment against president bush dropped their number one hit off the charts and caused fans to hate them, destroy their cd’s, and protest at their concerts. a film about freedom of speech gone out of control and the three girls lives that were forever changed by a small anti-bush comment"
1112,Tenacious D in The Pick of Destiny,"in venice beach, naive midwesterner jb bonds with local slacker kg and they form the rock band tenacious d. setting out to become the world's greatest band is no easy feat, so they set out to steal what could be the answer to their prayers... a magical guitar pick housed in a rock-and-roll museum some 300 miles away."
1113,Attack of the Killer Tomatoes!,"attack of the killer tomatoes is a 1978 comedy film directed by john de bello and starring david miller. the film is a spoof of b-movies. made on a budget of less than usd $100,000, the story involves tomatoes becoming sentient by unknown means and revolting against humanity."
1115,Within the Woods,the low budget film starring the young bruce campbell that influenced the evil dead films.
1129,The Shadows: The Final Tour,"the shadows long and influential career has spanned 6 decades, with hit singles or albums in every one of them. hank marvin's guitar playing has been an inspiration to hordes of guitarists down the years, including the likes of brian may, eric clapton and pete townshend. over a decade since their last tour, hank marvin, bruce welch and brian bennett"
1137,Wattstax,wattstax is the 1973 documentary film about the afro-american woodstock concert held in los angeles seven years after the watts riots. director mel stuart mixes footage from the concert with footage of the living conditions in the current day watts neighborhood. the film won the golden globe for best documentary film.
1148,Rize,"a documentary film that highlights two street derived dance styles, clowning and krumping, that came out of the low income neighborhoods of l.a.. director david lachapelle interviews each dance crew about how their unique dances evolved. a new and positive activity away from the drugs, guns, and gangs that ruled their neighborhood. a raw film about a growing sub-culture movements in america."
1155,Jay and Silent Bob Strike Back,"when jay and silent bob learn that their comic-book alter egos, bluntman and chronic, have been sold to hollywood as part of a big-screen movie that leaves them out of any royalties, the pair travels to tinseltown to sabotage the production."
1159,Avalon,"avalon is the third in levinson's semi-autobiographical series of four ""baltimore films"": diner (1982), tin men (1987), avalon (1990), and liberty heights (1999). the film is set in baltimore in the early 1950s and explores the themes of jewish assimilation into american life."
1175,Jesus,"the film is notable for presenting a more human jesus, compared to more solemn portrayals in earlier films; here jesus laughs and cries like anyone else. among other things, he weeps at joseph’s funeral, throws stones in lake galilee when meeting simon peter and james son of zebedee for the first time, dances at the wedding at cana, and starts a water-splashing fight with his disciples as well. satan is portrayed as a man in modern dress (and as a woman in red). during his temptation of jesus, he shows him the earth from the vantage point of space. satan also shows jesus images of wars and destruction carried out in his name. the film adds an apocryphal roman historian named “livio” who watches and comments as events unfold; he is presumably named after livy."
1180,Sicko,"sicko is a michael moore documentary about the corrupt health care system in the united states who's main goal is to make profit even if it means losing peoples lives. ""the more people you deny health insurance the more money we make"" is the business model for health care providers in america."
1191,The Spider Woman,"sherlock holmes investigates a series of so-called ""pajama suicides"". he knows the female villain behind them is as cunning as moriarty and as venomous as a spider. based on ""the sign of four"" and the short stories ""the dying detective"", ""the final problem"", ""the speckled band"" and ""the adventure of the devil's foot""."
1280,Jongens van de Landbouwschool,documentary about the dutch punkband 'de klojos'. and it sucks bigtime
1291,Around the World in Eighty Days,"based on the famous book by jules verne the movie follows phileas fogg on his journey around the world. which has to be completed within 80 days, a very short period for those days."
1309,The Lost World,the first film adaptation of sir arthur conan doyle's classic novel about a land where prehistoric creatures still roam.
1320,The Lost World,"arthur conan doyle's ""lost world"" performed live as a filmed audio drama."
1365,Mystery Science Theater 3000: The Movie,"the mad and evil scientist, dr. clayton forrester, has created an evil little scheme that is bound to give him world global domination but first things first. he plans to torment mike nelson and the robots by sending them a real stinker of a film to watch called, ""this island earth."" he is convinced that this movie will drive them insane. will this be the ultimate cheese that breaks the boys' spirits?"
1369,Frankenstein,"frankenstein is a 2007 british television film produced by impossible pictures for itv. it was written and directed by jed mercurio, adapted from mary shelley's original novel to a present-day setting. dr. victoria frankenstein, a female geneticist, accidentally creates a monster while growing her son's clone from stem cells as an organ donor in an effort to prevent his imminent death."
1409,Nashville,"the intersecting stories of twenty-four characters—from country star to wannabe to reporter to waitress— connect to the music business in nashville, tennessee."
1419,The Frankenstein Files: How Hollywood Made a Monster,the history of frankenstein's journey from novel to stage to screen to icon
1424,Making Frankensense of Young Frankenstein,"via reminiscences from writer/actor gene wilder and others, this documentary recalls the making of the 1974 film young frankenstein."
