id,title,synopsis
5847,Colossus: The Forbin Project,"forbin is the designer of an incredibly sophisticated computer that will run all of america's nuclear defenses. shortly after being turned on, it detects the existence of guardian, the soviet counterpart, previously unknown to us planners. both computers insist that they be linked, and after taking safeguards to preserve confidential material, each side agrees to allow it. as soon as the link is established the two become a new super computer and threaten the world with the immediate launch of nuclear weapons if they are detached. colossus begins to give its plans for the management of the world under its guidance. forbin and the other scientists form a technological resistance to colossus which must operate underground."
5870,Coraline,"when coraline moves to an old house, she feels bored and neglected by her parents. she finds a hidden door with a bricked up passage. during the night, she crosses the passage and finds a parallel world where everybody has buttons instead of eyes, with caring parents and all her dreams coming true. when the other mother invites coraline to stay in her world forever, the girl refuses and finds that the alternate reality where she is trapped is only a trick to lure her."
5888,Personal Effects,walter is a rising star in the ncaa wrestling world until his life is ripped apart by the brutal murder of his sister. returning home to console his mother gloria he seeks vengeance on the man who is accused of the crime. a chance meeting with a beautiful mature woman gives him solace to the situation. will this unlikely pairing bloom into a romance and heal a wound the world cannot see or will the loss of his sister push him over the edge?
5896,G.I. Joe: The Rise of Cobra,"from the egyptian desert to deep below the polar ice caps, the elite g.i. joe team uses the latest in next-generation spy and military equipment to fight the corrupt arms dealer destro and the growing threat of the mysterious cobra organization to prevent them from plunging the world into chaos."
5921,McHale's Navy,"retired lieutenant commander quinton mchale spends his days puttering around the caribbean in the old pt-73 selling homebrew, ice cream, and swimsuit calendars. he's brought out of retirement when his old nemesis turned the second best terrorist in the world, major vladikov, takes over the island of san moreno and starts building a nuclear launch silo on it. with help from his old crew and hindrances from captain wallace b. binghampton, who sank a cruise liner a while back, mchale tries to put vladikov out of business."
5951,Welcome to Macintosh,"""welcome to macintosh"" is a documentary that mixes history, criticism and an unapologetic revelry of all things apple. whether a long time mac fanatic or new to computers, welcome to macintosh explores the many ways apple computer (now apple, inc.) has changed the world, from the early days of the apple-i to the latest the company has to offer."
5957,The Flying Scotsman,"based on the incredible true story of amateur cyclist graeme obree, who breaks the world one-hour record on a bike he made out of washing machine parts."
5962,Barbie as Rapunzel,"long, long ago, in a time of magic and dragons, there lived a girl named rapunzel who had the most beautiful radiant hair the world had ever seen. but rapunzel's life was far from wonderful. she lived as a servant to gothel, a jealous, scheming witch who kept her hidden deep in a forbidding forest, guarded by the enormous dragon hugo and surrounded by an enchanted glass wall. however, in a twist of fate, rapunzel's discovery of a magic paintbrush leads her on a journey that will unravel a web of deception, bring peace to two feuding kingdoms, and ultimately lead her to love with the help of penelope(tm), the least intimidating of dragons!"
5970,Clockstoppers,"until now, zak gibbs' greatest challenge has been to find a way to buy a car. but when he discovers an odd wristwatch amidst his father's various inventions and slips it on -- something very strange happens. the world around him seems to come to a stop, everything and everybody frozen in time. zak quickly learns how to manipulate the device and he and his quick-witted and beautiful new friend, francesca, start to have some real fun."
5972,Deep Water,"deep water is the stunning true story of the fateful voyage of donald crowhurst, an amateur yachtsman who enters the most daring nautical challenge ever – the very first solo, non-stop, round-the-world boat race."
5983,Fat Albert,"animated character fat albert emerges from his tv universe into the real world, accompanied by his friends rudy, mushmouth, old weird harold and dumb donald. though the gang is flabbergasted by the modern world, they make new friends, and albert attempts to help young doris become popular. but things get complicated when albert falls for her older sister, lauri, and must turn to creator bill cosby for advice."
5990,The Curse of King Tut's Tomb,"thousands of years ago, the great child king tutankhamen ruled. few know the details of his life -- no one knows the secrets of his death. all that is about to change.free -spirited archaeologist danny fremont (casper van dien, sleepy hollow) is certain that if found, king tut's emerald tablet would hold the power to control the world. unfortunately, the only one who believes fremont is his nemesis archaeologist morgan sinclair (jonathan hyde, titanic), a member of a secret society who wants the tablet to harness unspeakable evil on the world and will stop at nothing to get it."
6009,Fighter Pilot: Operation Red Flag,"fighter pilot: operation red flag follows american f-15 eagle pilot john stratton as he trains with some of the world’s best pilots. the movie depicts stratton’s progression through the challenging and dangerous exercises of operation red flag, the international training program for air forces of allied countries."
6015,Manic,"follows the fate of lyle, a violent adolescent who, in lieu of prison, is placed in a juvenile mental institution where he encounters a group of equally troubled teens. this motley crew - abused, sexually confused, violent, and yet hanging on by their grit and anger - becomes lyle's last lifeline as he fights to find meaning in a world that seems to defy understanding."
6024,It's Always Snowing Somewhere,"the burton global team has traveled year round to get to the best snow on earth and during the process of documenting their travels they have created a natural story line that links them together as a team and shows you their season`s journey. over the course of the 2007-2008 snowboard seasons burton`s filmmakers and photographers will embark on a project that will provide a unique and imaginative look inside the lives of the world`s most influential riders. this multi-media project will explore the elite men`s burton global team and a handful of top up-and-comers, delving into their lifestyles and personalities. these riders are the face of snowboarding, setting trends and inspiring millions of kids worldwide with the way they ride and the lives they lead both on snow and off."
6036,Little Monsters,a young boy is scared of the monster under his bed. he asks his 6th grade brother to swap rooms for the night as a bet that the monster really exists. soon the brother becomes friends with the monster and discovers a whole new world of fun and games under his bed where pulling pranks on kids and other monsters is the main attraction.
6037,The Pagemaster,"tyler knows a lot about accidents. so much so, he is scared to do anything that might endanger him, like riding his bike, or climbing into his treehouse. while in an old library, he is mystically transported into the unknown world of books, and he has to try and get home again."
6049,The Pink Panther 2,"when legendary treasures from around the world are stolen, including the priceless pink panther diamond, chief inspector dreyfus is forced to assign inspector clouseau to a team of international detectives and experts charged with catching the thief and retrieving the stolen artifacts."
6050,Alice Through the Looking Glass,"a modern adaptation of the classic children's story 'alice through the looking glass', which continued on from the popular 'alice in wonderland' story. this time alice is played by the mother, who falls asleep while reading the the bedtime story to her daughter. walking through the looking glass, alice finds herself in chessland, a magical and fun world. there she meets the red and white queens, as well as many other amusing friends on her journey across the chessboard countryside onto become a crowned queen."
6054,The Gene Generation,"in a futuristic world, michelle lives everyday battling with dna hackers who use their skills to hack into people's bodies and kill them. she is an assassin, trying to keep her younger brother, jackie, out of trouble. when jackie gets involved in a petty crime of robbery, he propels himself into the world of dna hackers, shylocks (loan sharks) and gangs"
6075,Everyone's Hero,a boy begins a grand journey to return babe ruth's baseball bat before the deciding game of the 1932 world series comes to a close.
6082,The Ipcress File,"sly and dry intelligence agent, harry palmer is tasked with investigating british intelligence security, and is soon enmeshed in a world of double-dealing, kidnap and murder when he finds a traitor operating at the heart of the secret service."
6099,Bright Young Things,"in the 1930s, a social set known to the press – who follow their every move – as the “bright young things” are adam and his friends who are eccentric, wild and entirely shocking to the older generation. amidst the madness, adam, who is well connected but totally broke, is desperately trying to get enough money to marry the beautiful nina. while his attempts to raise cash are constantly thwarted, their friends seem to self-destruct, one-by-one, in an endless search for newer and faster sensations. finally, when world events out of their control come crashing around them, they are forced to reassess their lives and what they value most."
6106,Growing Op,"the story of a teenage boy coming of age in a suburban grow-operation, where every day is paradise or fresh hell. but it's always a trip. sheltered all his life and home-schooled by loving parents who are also committed criminals, quinn dawson yearns to experience the normalcy of the suburban world which surrounds him."
6109,Step Into Liquid,no special effects. no stuntmen. no stereotypes. no other feeling comes close. surfers and secret spots from around the world are profiled in this documentary.
6112,WordWorld: Welcome to Word World,word world is a show that is designed to help children to learn their letters. the entire animated world of wordworld is made out of letters and the characters work through challenges to form words.
6141,The Grand,"the grand is in the tradition of improvisational comedies like best in show and this is spinal tap. the story is set in the world of professional poker and follows six players who reach the final table of the world’s second most famous high stakes tournament, the grand championship of poker."
6170,The BFG,"sophie is snatched from her orphanage early one morning by the bfg (big friendly giant), whom she witnesses engaged in mysterious activities. she is soon put at ease, as she learns that bfg's job is to collect, catalog and deliver pleasant dreams to children. she joins him that night, but a mean giants follow them, planning to eat the children of the world."
6217,Cirque du Soleil: Quidam,"a young girl has already seen everything there is to see and her world has lost all meaning. her anger shatters her world and she finds herself in the universe of quidam, where she is joined by a playful companion, as well as another mysterious character who attempts to seduce her with the marvelous, the unsettling and the terrifying."
6220,Cirque du Soleil: Varekai,"icarus (anton chelnokov) is the main character of varekai, who falls to the ground, breaking his legs as he does. he is suddenly in a strange, new world full of creatures he has never seen before. ""parachuted into the shadows of a magical forest, a kaleidoscopic world populated by fantastical creatures, this young man sets off on an adventure both absurd and extraordinary."
6237,Crossing Over,"immigrants from around the world enter los angeles every day, with hopeful visions of a better life, but little notion of what that life may cost. their desperate scenarios test the humanity of immigration enforcement officers. in crossing over, writer-director wayne kramer explores the allure of the american dream, and the reality that immigrants find – and create -- in 21st century l.a."
6243,The Barry Sheene Story,"life story - made with his authorization and full participation, barry shares his memories throughout with motor racing legend and friend murray walker. with further anecdotes from family and many celebrities from the world of racing."
6294,WEC 9: Cold Blooded,"world extreme cagefighting returned to the palace indian gaming center in lemoore, california for the ninth installment of promoters scott adams' and reed harris' emerging event. with a few big name guys and a packed stable of home grown talent, the wec has started to make a push towards the top of the pack when it comes to regional events."
6324,Chasing Ghosts: Beyond the Arcade,"1982's video game world champions share their philosophies on joysticks, groupies and life."
6341,Bugs!,"explore the extraordinary hidden world of insects, where a leaf weighs more than a car, rain drops feel like exploding hand grenades and a blade of grass soars like a skyscraper. shot on location in the borneo rainforest, bugs! brings the beautiful and dangerous universe of its tiny stars up close and personal with cutting-edge technology that magnifies them up to 250,000 times their normal size."
6352,To See If I'm Smiling,"israel is the only country in the world where 18-year-old girls are drafted for compulsory military service. the frank testimonials of six female israeli soldiers stationed in gaza and the west bank sees the young women revisit their tours of duty in the occupied territories, and share shocking moments of negligence, flippancy, immaturity and power-tripping."
6376,Death to the Supermodels,"this sexy comedy finds the world's greatest, most eccentric supermodels gathered on a deserted island for the swimsuit photo shoot from hell"
6392,See you in Vegas,this is a documentary about the dutch magician hans klok. it's a story about his quest to make his dream come true in the magician capital of the world: las vegas.
6433,Love n' Dancing,"when a bored-with-life english teacher meets a west coast swing champion dancer, they have an instant connection. both feel that the other can fulfill what was missing in their lives. jake and jessica must try to elude all obstacles, romantic or otherwise, to stay focused on the goal - winning the world title and winning each other. will they give in to the pressure or come out like champs?"
6473,House Party 2,kid'n'play leave their neighborhood and enter the world of adulthood and higher education. play attempts to get rich quick in the music business while kid faces the challenges of college.
6476,The Day the Earth Stopped,hundreds of massive intergalactic robots appear in all of the world's major capitals with an ultimatum: prove the value of human civilization or be destroyed.
6493,Last Night,"various citizens of toronto anxiously await the end of the world, which is occurring at the stroke of midnight on new year's day."
6610,Echelon Conspiracy,"mysterious cell phone messages promise a young american engineer untold wealth - then make him the target of a deadly international plot. dangerous security operatives chase the engineer across the globe, while a powerful government official pursues a mysterious agenda that threatens the stability of the entire world."
6622,Center Stage: Turn It Up,"all self-taught dancer kate parker has ever wanted to do was perform with the american academy of ballet. but when she doesnt make it after auditioning, she learns that it takes more than precision and perfection to succeed in the dance world."
6666,Barbie Presents: Thumbelina,"meet a tiny girl named thumbelina who lives in harmony with nature in the magical world of the twillerbees that's hidden among the wildflowers. at the whim of a spoiled young girl named makena, thumbelina and her two friends have their patch of wildflowers uprooted and are transported to a lavish apartment in the city."
6670,Bob the Builder: On Site - Skyscrapers,"bob is back in an-all new construction adventure to teach the art of building skyscrapers. along with tumbler, dizzy, lofty and flex, bob is always ready to tackle even the tallest projects. no problem is too high to solve when you have positive-thinking and teamwork. in this exciting mix of animation and live action, you'll find yourself on top of the world!"
6671,Assassination Tango,"john j. is a seasoned hit man sent on a job to argentina. when the general he's sent to kill delays his return to the country, john passes the time with manuela, a beautiful dancer who becomes his teacher and guide into argentina's sensual world of the tango."
6689,Zach Galifianakis: Look Who it Isn't,"self-released dvd showcasing a variety of zach galifianakis' comedy routines. includes clips from vh-1's ""late world with zach"" and some of zach's stand-up appearances."
6690,The Magic Roundabout,"a shaggy, candy-loving puppy named dougal along with a group of friends embarks on a dangerous journey in an effort to imprison their oppressor -- the evil ice sorcerer zeebad (zebedee's evil twin). as the world is placed in mortal danger zeebad who wants to turn the world to ice. doogal and his friends must recover 3 diamonds that are needed to stop him."
6693,Garfield Gets Real,animated tale in which garfield leaves the cartoon world for the real one but as the novelty wears off he begins looking for a way back before his cartoon strip is permanently cancelled.
6732,Adventureland,"in the summer of 1987, a college graduate takes a 'nowhere' job at his local amusement park, only to find it's the perfect course to get him prepared for the real world."
6749,The Singles Ward,"when jonathan jordan gets divorced he's thrust back into the world of being a single mormon - a world who's ultimate goal is eternal marriage. struggling to fit in, jonathan decides to stop going to church only to be pursued by the members of the local singles ward who want to reactivate him. nothing works until jonathan falls for cammie giles, the ward activities director. suddenly, going to church becomes much more appealing, but is he going for the right reasons?"
6799,All That Jazz,"joe gideon is at the top of the heap, one of the most successful directors and choreographers in musical theater. but he can feel his world slowly collapsing around him - his obsession with work has almost destroyed his personal life, and only his bottles of pills keep him going."
6813,2 Hitmen,"two odd-ball best friends lead a team of wanna-be hitmen as they attempt to become something more in their lives. they will practice and train to be the best hitmen possible, but at the end of the day. they stumble their way into trouble and learn the hard way about the world of killing for hire."
6828,Global Metal,"in global metal, directors scot mcfadyen and sam dunn set out to discover how the west's most maligned musical genre - heavy metal - has impacted the world's cultures beyond europe and north america. the film follows metal fan and anthropologist sam dunn on a whirlwind journey through asia, south america and the middle east as he explores the underbelly of the world's emerging extreme music scenes; from indonesian death metal to chinese black metal to iranian thrash metal. global metal reveals a worldwide community of metalheads who aren't just absorbing metal from the west - they're transforming it - creating a new form of cultural expression in societies dominated by conflict, corruption and mass-consumerism."
6829,Autopsy,"emily johnson, her boyfriend bobby and their friends clare and jude are recent college grads driving cross-country, taking a last vacation together before they face the ""real"" world. an accident leaves them hurt and stranded on a lonely louisiana road. when the ambulance arrives, it whisks them to mercy hospital."
6864,Ba'al,"a world-renowned archaeologist must reawaken the storm god ba'al by collecting four ancient amulets scattered around the world. as each amulet is uncovered, ba'al's fury threatens to destroy everything in its path with the most powerful storm mankind has ever seen."
6897,The Reality of Bob Burnquist,"captures the true essence of skateboarding through the eyes and mind of bob burnquist, world-famous multiple x-games medal winner and owner of some of the most devious feats in skateboarding history."
6911,Rush: R30,"r30 captures the band's $21-million grossing, sell-out 30th anniversary world tour and was filmed with 14 hi-definition cameras in 16x9 widescreen format at the festhalle, frankfurt germany on september 24, 2004.  the set list spans the band's diverse 30-year career, and includes fan favorites ""xanadu,"" ""the spirit of radio,"" ""working man,"" ""tom sawyer,"" ""subdivisions,"" ""earthshine,"" ""2112,"" ""limelight,"" ""between the wheels,"" which hasn't been performed live in 20 years as well as tracks from 2004's covers ep feedback, including ""summertime blues"" and ""crossroads."" most of all eighteen studio albums are well represented through a non-stop energetic set of 22 electrifying songs."
6912,Rush: Grace Under Pressure Tour 1984,"by 1984, rush were becoming the world's most popular 'underground' band. the world was also in a sombre mood, perhaps reflecting on george orwell's 1984 thoughts. rush's music from the grace under pressure album captured this mood well, and their footage of the maple leaf gardens concert in their home town toronto on 21 september 1984 covers many of the stunning tracks from that album."
6955,The Emperor's Club,"william hundert is a passionate and principled classics professor who finds his tightly-controlled world shaken and inexorably altered when a new student, sedgewick bell, walks into his classroom. what begins as a fierce battle of wills gives way to a close student-teacher relationship, but results in a life lesson for hundert that will still haunt him a quarter of a century later."
6959,The Cell Phone Revolution,the cell phone revolution is a revealing look at the enormous impact this small device has had on the way we live -- and the surprising dead ends and detours it took along the way. from a futuristic dream at the 1939 world's fair -- the cell phone became a reality some thirty years later.
6989,National Geographic Ultimate Shark,"see the world's first mri scan of a great white shark as ultimate shark reveals the extreme engineering and predatory abilities of one of nature's most near perfect predators. hear firsthand accounts of people who survived harrowing encounters, including a surfer who was bitten on the arm and leg, towed by the surfboard ankle strap and miraculously escaped only with minor injuries. national geographic demystifies the true motives and power behind their behavior."
6991,The Black Stallion,"while traveling with his father, young alec becomes fascinated by a mysterious arabian stallion that is brought on board and stabled in the ship he is sailing on. when it tragically sinks both he and the horse survive only to be stranded on a deserted island. he befriends it, so when finally rescued both return to his home where they soon meet henry dailey, a once successful trainer. together they begin training the horse to race against the fastest ones in the world."
6992,Tooth,"tooth is a young, feisty tooth fairy, who lives in a world called fairytopia that has lost its ability to use magic. fed up with the way most fairies have forgotten about magic, she decides to give away all of its money. when tooth begins to understand how much trouble she is in, she realizes the only person who can help is the legendary mrs. c, who disappeared, along with magic over 100 years ago. teaming up with two human children and a number of fairies, who are living incognito amongst humans she sets off on the adventure of a lifetime. pursued by the evil plug, a terrifying fairy hunter and his posse, the race is on to save the world before christmas, easter and all the holidays are ruined forever."
7000,Kiss Me Deadly,"settled into a cozy home life in milan with his boyfriend paolo and his daughter julia, photographer and ex-spy jacob keane is suddenly drawn back into the espionage world when his old partner marta reappears with her memory erased."
7013,Big Dreams Little Tokyo,"big dreams little tokyo is the story of boyd, an american with an uncanny ability to speak japanese. boyd aspires to succeed in the world of japanese business but finds himself mostly on the outside looking in. meanwhile, his roommate jerome, is a japanese american who has always felt too american to be japanese but too japanese to be american. he aspires to be a sumo wrestler but finds his weight and blood pressure are thwarting his dreams. together they struggle to find their place in a world where cultural identity is seldom what it seems."
7064,The Room,"johnny is a successful banker with great respect for and dedication to the people in his life, especially his future wife lisa. the happy-go-lucky guy sees his world being torn apart when his friends begin to betray him one-by-one."
