id,title,synopsis
3848,I Am Sam,"although sam has the mental capacity of a 7-year-old, he has a daughter with a homeless woman who abandons them when they leave the hospital, leaving sam to raise lucy on his own. but as lucy grows up, sam's limitations start to become a problem and the authorities take her away. sam shames high-priced lawyer, rita into taking his case pro bono and in turn teaches her the value of love and family."
3870,Stuart Little 2,"stuart, an adorable white mouse, still lives happily with his adoptive family, the littles, on the east side of manhattan's central park. more crazy mouse adventures are in store as stuart, his human brother, george, and their mischievous cat, snowbell, set out to rescue a friend."
3888,Billy Madison,"billy madison is the 27 year-old son of bryan madison, a very rich man who has made his living in the hotel industry. billy stands to inherit his father's empire but only if he can make it through all 12 grades, 2 weeks per grade, to prove that he has what it takes to run the family business."
3912,The Last Temptation of Christ,"jesus, a humble judean carpenter beginning to see that he is the son of god, is drawn into revolutionary action against the roman occupiers by judas -- despite his protestations that love, not violence, is the path to salvation. the burden of being the savior of mankind torments jesus throughout his life, leading him to doubt."
3915,Darkness,"a teenage girl moves into a remote countryside house with her family, only to discover that their gloomy new home has a horrifying past that threatens to destroy the family."
3929,Fly Away Home,"amy is only 13 years old when her mother is killed. she goes to canada to live with her father, an eccentric inventor whom she barely knows. amy is miserable in her new life... until she discovers a nest of goose eggs that were abandoned when a local forest is torn down. the eggs hatch and amy becomes ""mama goose"". when winter comes, amy, and her dad must find a way to lead the birds south..."
3936,The Hand that Rocks the Cradle,"a suburban family chooses seemingly sweet peyton flanders as their newborn's nanny. only much later does the infant's mother, claire bartel, realize peyton's true intentions -- to destroy claire and replace her in the family. the nail-biting suspense builds quickly in this chilling psychological thriller about deception and bitter revenge."
3939,Riding in Cars with Boys,"a single mother, with dreams of becoming a writer, has a son at the age of 15 in 1965, and goes through a failed marriage with the drug-addicted father."
3947,Vera Drake,abortionist vera drake finds her beliefs and practices clash with the mores of 1950s britain – a conflict that leads to tragedy for her family.
3963,Poltergeist II: The Other Side,"the freeling family move in with diane's mother in an effort to escape the trauma and aftermath of carol anne's abduction by the beast. but the beast is not to be put off so easily and appears in a ghostly apparition as the reverend kane, a religeous zealot responsible for the deaths of his many followers. his goal is simple - he wants the angelic carol anne."
3965,The Prince & Me,"a fairy tale love-story about pre-med student paige who falls in love with a danish prince ""eddie"" who refused to follow the traditions of his parents and has come to the us to quench his thirst for rebellion. paige and edward come from two different worlds, but there is an undeniable attraction between them."
3972,Christmas Vacation 2: Cousin Eddie's Island Adventure,"though eddie's fired right at christmastime, his boss sends him and his family on a south pacific vacation, hoping eddie won't sue him after being bitten by a lab monkey. when the tuttle family winds up trapped on a tropical island, however, eddie manages to provide for everyone and prove himself a real man."
3992,Ring of the Nibelungs,"in this swords-and-sorcery tale, good-hearted blacksmith eyvind hides away infant prince siegfried after two malevolent kings murder his father. but a fiery meteor sent by the gods reveals siegfried's destiny, sending him on the quest of a lifetime. to save a crumbling kingdom claim the heart of his true love, he'll have to slay the nefarious dragon, fafnir."
3999,Wicker Park,"matthew, a young advertising executive in chicago, puts his life and a business trip to china on hold when he thinks he sees lisa, the love of his life who left him without a word two years earlier, walking out of a restaurant one day."
4022,The Meteor Man,"one night jefferson reed gets hit in the chest by a souped-up chunk of meteor. so he can fly, but he's scared of heights. he can master the information in any book ... for about thirty seconds. now his friends and family want him to protect their community from the dreaded golden lords."
4051,City Slickers II: The Legend of Curly's Gold,"mitch robbins 40th birthday begins quite well until he returns home and finds his brother glen, the black sheep of the family, in his sofa. nevertheless he is about to have a wonderful birthday-night with his wife when he discovers a treasure map of curly by chance. together with phil and unfortunately glen he tries to find the hidden gold of curly's father in the desert of arizona."
4052,Hearts in Atlantis,a widowed mother and her son change when a mysterious stranger enters their lives.
4055,My Girl 2,"vada sultenfuss has a holiday coming up, and an assignment: to do and essay on someone she admires and has never met. she decides she wants to do an assignment on her mother, but quickly realises she knows very little about her. she manages to get her father to agree to let her go to la to stay with her uncle phil and do some research on her mother."
4063,Midnight Express,"billy hayes is caught attempting to smuggle drugs out of turkey. the turkish courts decide to make an example of him, sentencing him to more than 30 years in prison. hayes has two opportunities for release: the appeals made by his lawyer, his family, and the american government, or the ""midnight express""."
4068,The Dead Zone,"johnny smith is a schoolteacher with his whole life ahead of him but, after leaving his fiancee's home one night, is involved in a car crash which leaves him in a coma for 5 years. when he wakes, he discovers he has an ability to see into the past, present and future life of anyone with whom he comes into physical contact."
4075,Cape Fear,"sam bowden witnesses a rape committed by max cady and testifies against him. when released after 8 years in prison, cady begins stalking bowden and his family but is always clever enough not to violate the law."
4086,Halloween 5: The Revenge of Michael Myers,"presumed dead after a shoot-out with the haddonfield police, michael myers is secretly nursed back to health -- and returns a year later to kill again and once more targets his young niece, jamie. jamie is now recovering in the local children's hospital after attacking her stepmother and losing her voice. her mental link with her evil uncle may be the key to uprooting her family tree."
4101,Tommy Boy,"to save the family business, two ne’er-do-well traveling salesmen hit the road with disastrously funny consequences."
4116,The River Why,a young man abandons his family for a solitary life of fly-fishing. his goal was to find his own way in the fishing world and thereby find himself and love.
4125,Vegas Vacation,"the griswold family hits the road again for a typically ill-fated vacation, this time to the glitzy mecca of slots and showgirls—las vegas."
4128,High Society,"childhood friends tracy lord and c.k. dexter haven got married and quickly divorced. now tracy is about to marry again, this time to a shrewd social-climbing businessman. c.k. still loves her. spy magazine blackmails tracy's family by threatening to reveal her playboy father's exploits if not allowed to cover the wedding."
4131,Dead End,"christmas eve. on his way to his in-laws with his family, frank harrington decides to try a shortcut, for the first time in 20 years. it turns out to be the biggest mistake of his life."
4180,Addams Family Reunion,"the addams family goes on a search for their relatives. gomez and morticia are horrified to discover that grandpa and grandma addams have a disease that is slowly turning them ""normal"". the only chance they have of a cure is to find a family member hoping that they know a home remedy."
4182,Repossessed,"it's been some time since father jebedaiah mayii exorcised the devil from little nancy aglet, who is now grown up with a husband and two children of her own. but the prince of darkness wants to go a second round and has returned to repossess her! with father mayii unwilling to help, father luke brophy tries his best to help nancy, even when tv's ernest weller plans to air the exorcism live on tv."
4238,Serial Mom,"a picture perfect middle class family is shocked when they find out that one of their neighbors is receiving obscene phone calls. the mom takes slights against her family very personally, and it turns out she is indeed the one harassing the neighbor. as other slights befall her beloved family, the body count begins to increase."
4239,Nobody's Fool,"sully is a rascally ne'er-do-well approaching retirement age. while he is pressing a worker's compensation suit for a bad knee, he secretly works for his nemesis, carl, and flirts with carl's young wife toby. sully's long- forgotten son and family have moved back to town, so sully faces unfamiliar family responsibilities. meanwhile, sully's landlady's banker son plots to push through a new development and evict sully from his mother's life."
4261,Mamma Mia!,"an independent, single mother who owns a small hotel on a greek island is about to marry off the spirited young daughter she's raised alone. but, the daughter has secretly invited three of her mother's ex-lovers in the hopes of finding her biological father."
4269,Must Love Dogs,"sarah nolan is a newly divorced woman cautiously rediscovering romance with the enthusiastic but often misguided help of her well-meaning family. as she braves a series of hilarious disastrous mismatches and first dates, sarah begins to trust her own instincts again and learns that, no matter what, it's never a good idea to give up on love."
4277,Life Love Death,"françois toledo, married businessman and father, falls head-over-heels in love with janine, a work colleague. however, he is soon found out: after three dates, he strangles some prostitutes, when, the victim of blackmail, he becomes dishonored. he is taken to court, and sentenced to be killed by a guillotine."
4296,The Secret of NIMH,"a widowed field mouse must move her family -- including an ailing son -- to escape a farmer's plow. aided by a crow and a pack of superintelligent, escaped lab rats, the brave mother struggles to transplant her home to firmer ground."
4306,The Girl Next Door,there's someone peeping through windows so arthur has been asked to watch the neighbour's eighteen year old daughter while her parents are away. soon their mutual attraction develops into something that arthur later regrets.
4315,Harvey,"the story of elwood p. dowd who makes friends with a spirit taking the form of a human-sized rabbit named harvey that only he sees (and a few privileged others on occasion also.) after his sister tries to commit him to a mental institution, a comedy of errors ensues. elwood and harvey become the catalysts for a family mending its wounds and for romance blossoming in unexpected places."
4322,Angel,"edwardian england. a precocious girl from a poor background with aspirations to being a novelist finds herself swept to fame and fortune when her tasteless romances hit the best seller lists. her life changes in unexpected ways when she encounters an aristocratic brother and sister, both of whom have cultural ambitions, and both of whom fall in love with her."
4325,Beethoven,"the newton family live in their comfortable home, but there seems to something missing. this ""hole"" is filled by a small puppy, who walks into their home and their lives. beethoven, as he is named, grows into a giant of a dog... a st bernard. doctor varnick, the local vet has a secret and horrible sideline, which requires lots of dogs for experiments. beethoven is on the bad doctor's list."
4328,The Sweetest Thing,"christina's love life is stuck in neutral. after years of avoiding the hazards of a meaningful relationship, one night while club-hopping with her girlfriends, she meets peter, her perfect match. fed up with playing games, she finally gets the courage to let her guard down and follow her heart, only to discover that peter has suddenly left town. accompanied by courtney, she sets out to capture the one that got away."
4331,On Golden Pond,"for norman and ethel thayer, this summer on golden pond is filled with conflict and resolution. when their daughter chelsea arrives, the family is forced to renew the bonds of love and overcome the generational friction that has existed for years."
4343,Death Sentence,"nick hume is a mild-mannered executive with a perfect life, until one gruesome night he witnesses something that changes him forever. transformed by grief, hume eventually comes to the disturbing conclusion that no length is too great when protecting his family."
4349,Intimacy,"jay, a failed musician, walked out of his family and now earns a living as head bartender in a trendy london pub. every wednesday afternoon a woman comes to his house for graphic, almost wordless, sex. one day jay follows her and finds out about the rest of her life (and that her name is claire). this eventually disrupts their relationship."
4359,Orange County,"shaun brumder is a local surfer kid from orange county who dreams of going to stanford to become a writer and to get away from his dysfunctional family household. except shaun runs into one complication after another, starting when his application is rejected after his dim-witted guidance counselor sends in the wrong form."
4388,Kind Hearts and Coronets,"when his mother eloped with an italian opera singer, louis mazzini was cut off from her aristocratic family. after the family refuses to let her be buried in the family mausoleum, louis avenges his mother's death by attempting to murder every family member who stands between himself and the family fortune. but when he finds himself torn between his longtime love and the widow of one of his victims, his plans go awry."
4401,In Her Shoes,"irresponsible party girl, maggie is kicked out of her father's and stepmother's home—where she lives for free—and is taken in by her hard-working sister, philadelphia lawyer, rose. after maggie's disruptive ways ruin her sister's love life, rose turns her out as well. but when their grandmother, who they never knew existed, comes into their lives, the sisters face some complicated truths about themselves and their family."
4437,Dr. Alemán,"marc, an unexperienced medical doctor from germany arrives at the hospital universitario del valle in cali, colombia for his internship and soon finds himself in-between a raging gang war in siloé, a cali barrio. in the hospital he has to care mostly for shotgun wounds, while in the streets he falls in love with a stall-holder who cares for some of the children involved in drug trafficking and criminal violence. alienating his colleagues and his host family while befriending the kids, he soon finds himself trapped in the center of the violent conflict between the gangs and has to come to a decision."
4440,Just Married,"tom leezak and sarah mcnerney fall in love and plan to get married, despite opposition from sarah's uptight, rich family. when they do get married, and get a chance to prove sarah's family wrong, they go on a european honeymoon and run into disaster after disaster. they have to decide whether the honeymoon from hell and a few pre-marital mistakes are worth throwing away their love and marriage."
4456,"Love, Money, Love","david, a recently fired scrapyard worker and marie, a prostitute, both about 20 years old, meet on new year's eve in berlin and decide to run away together. as david's arm is plastered from an accident marie continues to prostitute herself to finance their restless journey through the ruhr area. their love and their will to survive guide them though all problems."
4472,The Missing,"when rancher and single mother of two maggie gilkeson sees her teenage daughter, lily, kidnapped by apache rebels, she reluctantly accepts the help of her estranged father, samuel, in tracking down the kidnappers. along the way, the two must learn to reconcile the past and work together if they are going to have any hope of getting lily back before she is taken over the border and forced to become a prostitute."
4482,Wyatt Earp,"covering the life and times of one of the west's most iconic heroes wyatt earp weaves an intricate tale of earp and his friends and family. with a star studded cast, sweeping cinematography and authentic costumes wyatt earp led the way during the western revival in the 90's."
4489,With a Little Help from Myself,"besieged matriarch sonia tries to make certain her daughter's nuptials come off flawlessly even as events spiral out of control is in this dark comedy helmed by françois dupeyron. with sonia's wayward eldest son under arrest on drug charges, she then discovers that her no-account hubby has gambled away the money set aside for the reception. will sonia and her family triumph or crumble in the face of adversity?"
4498,The Other Boleyn Girl,"a sumptuous and sensual tale of intrigue, romance and betrayal set against the backdrop of a defining moment in european history: two beautiful sisters, anne and mary boleyn, driven by their family's blind ambition, compete for the love of the handsome and passionate king henry viii."
4512,The Stepford Wives,"joanna eberhart has come to the quaint little town of stepford, connecticut with her family, but soon discovers there lies a sinister truth in the all too perfect behavior of the female residents."
4526,Mulan II,"fa mulan gets the surprise of her young life when her love, captain li shang asks for her hand in marriage. before the two can have their happily ever after, the emperor assigns them a secret mission, to escort three princesses to chang'an, china. mushu is determined to drive a wedge between the couple after he learns that he will lose his guardian job if mulan marries into the li family."
4529,Shotgun Stories,"shotgun stories tracks a feud that erupts between two sets of half brothers following the death of their father. set against the cotton fields and back roads of southeast arkansas, these brothers discover the lengths to which each will go to protect their family."
4531,Mo' Money,"trying to get his act together, a con artist gets a job in a credit card company. he falls in love with a fellow employee, he steals a couple of cards, everything is going great. but soon, the chief of security drags him into the big leagues of criminals..."
4535,Home Fries,"dorian and angus chase down their womanizing stepfather with a helicopter, frightening him to death. in his effort to cover their tracks, dorian begins investigating his stepfather's mistress, sally. she works at a fast-food drive-through, she's pregnant and dorian quickly falls in love with her. unfortunately, his scheming mother wants sally dead. and sally isn't sure she wants dorian to be her child's father and also his brother."
4537,The Hills Have Eyes,"on the way to california, a family has the misfortune to have their car break down in an area closed to the public, and inhabited by violent savages ready to attack."
4565,Vegas: Based on a True Story,"the film takes place away from the glittering strip of mega casinos, but the greed of sin city is just as pervasive on the desert outskirts. this is where a happy family learns of a forgotten fortune that may be buried beneath their home. their lives are turned upside down. a sophisticated study of just how far people are able and willing to go if faced with the tempting prospect of easily acquired wealth."
4568,How the Garcia Girls Spent Their Summer,three generations of women in a mexican american family experience sexual awakenings over the course of a summer.
4610,The French Lieutenant's Woman,"in this story-within-a-story, anna is an actress starring opposite mike in a period piece about the forbidden love between their respective characters, sarah and charles. both actors are involved in serious relationships, but the passionate nature of the script leads to an off-camera love affair as well. while attempting to maintain their composure and professionalism, anna and mike struggle to come to terms with their infidelity."
4615,Shadows in the Sun,an aspiring young writer tracks a literary titan suffering from writers block to his refuge in rural italy and learns about life and love from the irascible genius and his daughters.
4617,Ghosts of Girlfriends Past,"when notorious womanizer connor mead attends his brother paul's wedding, he is forced to re-evaluate his behavior as he comes face-to-face with the ghosts of girlfriends past, present, and future, along with his deceased uncle. the experience changes his attitude and allows him to reconnect with his first and only love, jenny."
4629,The Seven Days,"when one of the brothers (ohayn) dies, all the whole family comes for shiva (jewish tradition,when the family sits seven days at the home after the death one of their family). a large family with a lot of problems and conflicts between them."
4646,Death of a Salesman,"salesman willy loman is in a crisis. he's about to lose his job, he can't pay his bills, and his sons biff and happy don't respect him and can't seem to live up to their potential. he wonders what went wrong and how he can make things up to his family."
4665,Billy Bathgate,"in the year 1935, a teen named billy bathgate finds first love while becoming the protégé of fledgling gangster dutch schultz."
4671,Feeling Minnesota,"sam clayton's marriage to ex-stripper freddie comes about when she's strong-armed into the match by red, a club proprietor who once did her a favor. but freddie falls in love with jjaks, sam's brother, and the pair tries to escape the situation together. it isn't long before both sam and red catch up with them, resulting in threats against the two of them -- although tension also starts to build between sam and red."
4678,The Snapper,"sharon curley is a 20-year-old living with her parents and many brothers and sisters in dublin. when she gets pregnant and refuses to name the father, she becomes the talk of the town."
4695,The Brown Bunny,"bud clay races motorcycles in the 250cc formula ii class of road racing. after a race in new hampshire, he has five days to get to his next race in california. during his road trip, he is haunted by memories of the last time he saw daisy, his true love."
4701,Big Business,"in the 1940s in the small town of jupiter hollow, two sets of identical twins are born in the same hospital on the same night. one set to a poor local family and the other to a rich family just passing through. the dizzy nurse on duty accidentally mixes the twins unbeknown to the parents. our story flashes forward to the 1980s where the mismatched sets of twins are about to cross paths."
4706,"No Retreat, No Surrender","young jason stillwell moves with his parents to seattle, where local bullies harass them without mercy. jason's father tom does not believe in violence, so the family takes it on the chin. one day jason enrolls in a martial arts class and quietly rises in rank to be a major contender. his mettle is tested in an international match against ivan, a russian champion."
4710,Doll Graveyard,"it's 1905 when 12 year old sophia plays all by herself in her big, creepy house with only four handmade dolls as friends. when her abusive father has finally had enough, he forces her to bury them in the backyard. but, after she ""slips"" and breaks her neck, dad buries her right along with the dolls. 100 years later, the fillbrook family moves into the very same house."
4727,Homeboy,"johnny walker is a cowboy and a boxer. he is very shy and a bit of a fool. he is in love with ruby, but he cannot tell her. he is also a bit old to keep on boxing, but its the only thing he does well."
4734,The Best Day of My Life,the best day of my life is the story of a dysfunctional family as seen through the eyes of young chiara (maria luisa de crescenzo) who is about to receive her first communion. the family includes matriarch irene (virna lisi) and her three grown up children.
4735,Gasoline,"fiery, dark-haired stella, an intense auto mechanic, and nervous, blonde eleonora are young and in love. they operate a gas station peacefully, until eleonora's mother appears and voices her disapproval of their romance."
4740,Alpha and Omega,"two young wolves at opposite ends of their pack's social order are thrown together into a foreign land and need each other to return home, but love complicates everything."
4742,No. 2,"a matriarch organizes a feast with her family, in which she will name her successor. the heart has gone out of nanna maria's family. there are no parties — they don't even fight anymore..."
4744,Leaves of Grass,"an ivy league professor returns home, where his pot-growing twin brother has concocted a plan to take down a local drug lord."
4745,The Secret Life of Bees,"set in south carolina in 1964, this is the tale of lily owens a 14 year-old girl who is haunted by the memory of her late mother. to escape her lonely life and troubled relationship with her father, lily flees with rosaleen, her caregiver and only friend, to a south carolina town that holds the secret to her mother's past."
