id,title,synopsis
5700,Stealing Beauty,"lucy harmon, an american teenager is arriving in the lush tuscan countryside to be sculpted by a family friend who lives in a beautiful villa. lucy visited there four years earlier and exchanged a kiss with an italian boy with whom she hopes to become reacquainted."
5704,Comeback Season,"first down. second chance. skylar is a star quarterback of his football team. he's got the skills, the looks, and the girls. his next-door neighbor, walter (liotta) is a loving husband, good father and all-round decent family man. when their worlds start to crumble they find themselves in jail together and suddenly these former enemies must rely on each other to rebuild their lives... finding wha"
5710,The Boy in the Striped Pyjamas,"when his family moves from their home in berlin to a strange new house in poland, young bruno befriends shmuel, a boy who lives on the other side of the fence where everyone seems to be wearing striped pajamas. unaware of shmuel's fate as a jewish prisoner or the role his own nazi father plays in his imprisonment, bruno embarks on a dangerous journey inside the camp's walls."
5715,Lake City,"in this searing southern drama, a mother and son reunite under desperate circumstances years after a family tragedy drove them far apart."
5720,In the Company of Men,"two business executives--one an avowed misogynist, the other recently emotionally wounded by his love interest--set out to exact revenge on the female gender by seeking out the most innocent, uncorrupted girl they can find and ruining her life."
5729,Anita and Me,"meena, a 12-year-old living in a mining village in the english midlands in 1972, is the daughter of indian parents who've come to england to give her a better life. this idyllic existence is upset by the arrival in the village of anita rutter and her dysfunctional family."
5730,Lassie,"a family in financial crisis is forced to sell lassie, their beloved dog. hundreds of miles away from her true family, lassie escapes and sets out on a journey home."
5737,Partition,"determined to leave the ravages of war behind, 38 year old gian singh resigns from the british indian army to a quiet life. his world is soon thrown in turmoil, when he suddenly finds himself responsible for the life of a 17 year old girl, traumatized by the events that separated her from her family."
5744,All the Good Ones Are Married,"ben gold gets the break of his life as aspiring author, but must stay home with his kids, luke and madison, to make his 5 months deadline. his feminist wife, workaholic fashion executive alex, selfishly decides to take in promising rebel designer zoe miller, who left her boyfriend trey. the teenager soon wins the family's hearts. written by kgf vissers"
5746,The Butterfly Effect 2,"after his girlfriend, julie, and two best friends are killed in a tragic auto accident, nick struggles to cope with his loss and grief. suffering from migraine-like seizures, nick soon discovers that he has the power to change the past via his memories. however, his time-traveling attempts to alter the past and save his one true love have unexpected and dire consequences."
5750,Crooked Earth,"will bastion returns home from the army after an absence of 20 years to bury his father, the former chief of thee maori tribe, ngati kaipuku. the eldest son, he is reluctant to inherit his fathers role, so it is taken more willingly by his younger brother, kahu. kahu is the leader of a band of drug dealers and trouble-makers who ride horses through the middle of town, wrecking peoples gardens. under the guise of refusal of a land settlement, kahu makes a large marijuana deal with some murdering city folk. will must choose between loyalty for his brother and his father, maori tradition, and contemporary financial issues."
5756,The Stone Angel,"the feisty aging hagar shipley has lived an unconventional life. her rebellious heart has always ruled and her choices have put her at odds with family and friends. faced with her own mortality, and desperate to find solace, she goes on the run. in both the past and the present, she is forced to come to terms with the pain and pleasure, the disappointments and the exhilarations of her life."
5762,Homo Erectus,"ishbo is a caveman living in the prehistoric age who thinks there's more to life than hunting and gathering. he tries to better the lives of those in his tribe by inventing things like spoons and the toothbrush, which leave everyone, including his parents, unimpressed. he also has a thing for cavewoman fardart, but she only has eyes for his brother thudnik. can ishbo prove his worth when a rival clan attacks?"
5767,Solstice,"while on a summer trip with her friends, megan begins to feel the presence of sophie, her twin sister who recently committed suicide."
5768,Slums of Beverly Hills,"in 1976, a lower-middle-class teenager struggles to cope living with her neurotic family of nomads on the outskirts of beverly hills."
5781,Eating Out,"after getting dumped by his slutty girlfriend, caleb falls in love with gwen. however, thanks to caleb's roommate, gwen thinks he's gay and sets him up with her roommate, marc."
5816,Boy A,"freed after a lengthy term in a juvenile detention center, convicted child killer jack burridge (andrew garfield) finds work as a deliveryman and begins dating co-worker michelle (katie lyons). while out on the road one day, the young englishman notices a distressed child, and, after reuniting the girl with her family, becomes a local celebrity. but, when a local newspaper unearths his past, jack must cope with the anger of citizens who fear for the safety of their children."
5832,Erskineville Kings,"barky, 25, lost soul, left home two years ago to escape his abusive father leaving behind everything in the world that was important to him; now that his father's dead, he thinks it's safe to come home."
5845,Baby Blues,"on a secluded family farm, a mother suffers a psychotic break due to postpartum depression, forcing the eldest son to protect his sibling from the mother they have always known and loved."
5866,The Cement Garden,"after the death of her husband, the mother of julie, jack, sue and tom begins to suffer from a mysterious illness. aware that she is going to have to go into hospital she opens a bank account for the children, so that they can be financially self-sufficient and will be able to avoid being taken into care by the authorities. unfortunately she also dies and julie and jack (the older, teenage children) decide to hide her body in the basement so that they can have free reign of their household. soon tom has taken to dressing as a girl whilst sue has become increasingly reticent, confiding only to her diary, meanwhile jack and julie sense an attraction developing for each other. however julie's new beau, derek, threatens to unearth the many dark secrets within this family as he becomes increasingly suspicious of jack."
5876,Ten Inch Hero,four friends search for love and happiness while working at a california sandwich shop.
5877,Chasing Liberty,"the president's daughter, unable to experience life like a normal 18 year-old, escapes from her entourage of secret service agents while traveling in europe. she falls in love with a handsome british stranger, who also happens to be working undercover for her father."
5878,Gray Matters,"sam and gray are such a well-matched pair that it is difficult to believe they are brother and sister rather than husband and wife. they both share a love of 1940s movies and dancing, and when they meet charlie, they have something else in common: they both fall in love with her. sam must deal with unexpected feelings of jealousy, while gray struggles to come to terms with her sexual orientation."
5882,Dead Like Me: Life After Death,"when george and her colleagues get a new boss whose focus is on moving souls quickly and enjoying life without consequences, the team begins to break the strict reaper rules. while her friends fall victim to their desires for money, success, and fame, george breaks another rule by revealing her true identity to her living family."
5884,The Escapist,"frank perry is an institutionalized convict twelve years into a life sentence without parole. when his estranged daughter falls ill, he is determined to make peace with her before it's too late. he develops an ingenious escape plan, and recruits a dysfunctional band of escapists - misfits with a mutual dislike for one other but united by their desire to escape their hell hole of an existence."
5898,The Cutting Edge: Going for the Gold,two ice skaters develop a love-hate relationship while dreaming of olympic glory.
5906,This Girl's Life,"""slice of life"" take on life of international porn celebrity, moon, and her musings on modern life, love and loss."
5958,West,"pete and jerry are cousins living in sydney's western suburbs, where life consists of drinking, getting stoned, getting in fights and hanging out. but things change forever when pete and jerry both fall in love with the same girl."
5960,Linewatch,"academy award winner cuba gooding, jr. is a border patrol officer in the new mexico desert with a secret past that is about to catch up with him. when his old gang leader tracks him down and forces him to smuggle drugs across the border, he must choose between the life he swore to leave behind and saving his family at any cost."
5965,I Could Never Be Your Woman,this movie follows a mother who falls for a younger man while her daughter falls in love for the first time. mother nature messes with their fates.
5968,Park,"park takes place all in one day in a public park in los angeles, as 11 disaffected angelenos find both love and loss in unexpected ways"
5973,The Breaks,"derrick, a racially-confused irishman raised in the hood by a black family is having the worst day ever. determined to prove to his fed-up mother and would-be girlfriend that he's not a screw-up, he sets out to do one thing right (get some milk) and even that proves to be a challenge! hilarious encounters with racist red-neck cops, local gangsters and 'flamboyant' pawn shop owners ensue, and along the way derek shows that he can actually do things for others and maybe even get his own life together."
5979,American Girl,a pregnant teenager is determined to leave her trailer park home with the hope of living a happy family life.
6017,Tortilla Soup,a mexican-american master chef and father to three daughters has lost his taste for food but not for life.
6046,Illegal Tender,"after the gangsters who killed his father come to settle a score, a teenage boy and his mother turn the tables on the killers - one latino family's quest for honor and revenge as the hunted become the hunters."
6064,Hotel for Dogs,"placed in a foster home that doesn't allow pets, 16-year-old andi and her younger brother, bruce, turn an abandoned hotel into a home for their dog. soon other strays arrive, and the hotel becomes a haven for every orphaned canine in town. but the kids have to do some quick thinking to keep the cops off their tails."
6072,Eight Days a Week,"peter loves his next door neighbour erica and, on the advice of his grandfather, decides to camp out on her front lawn for the entire summer, or until she agrees to go out with him. his father is none too happy about the idea and refuses to let his son back in the house, even to get a change of clothes."
6083,This Christmas,"this year christmas with the whitfields promises to be one they will never forget. all the siblings have come home for the first time in years and they've brought plenty of baggage with them. as the christmas tree is trimmed and the lights are hung, secrets are revealed and family bonds are tested. as their lives converge, they join together and help each other discover the true meaning of family."
6122,Twin Town,"jeremy and julian lewis, the ""lewis twins"", are two unruly brothers who terrorise the city of swansea from the caravan park where they live with their family. when their father, fatty, is injured while working on a roof for local kingpin bryn cartwright, they try in vain to claim compensation. thus begins a campaign of terror, which local policemen terry and grayo are ill-equipped to prevent, involved as they are in a drugs deal with cartwright."
6133,Something New,"kenya mcqueen, a corporate lawyer, finds love in the most unexpected place when she agrees to go on a blind date with brian kelly, a sexy and free-spirited landscaper."
6144,Charlie & Me,"when her beloved grandfather charlie suddenly falls ill, twelve year-old casey finds herself making some life or death decisions—and learning to live with the consequences."
6197,Around the Bend,"a tale of four generations of men, all of whom have had their offspring at a young age: a great-grandfather, a grandfather, a father in his twenties and a son who is about 7 years old. when the oldest member passes away, the trio heads out on the road together in the southwest to search out an old family secret that connects to their past."
6230,Surviving Christmas,"drew latham is an executive leading an empty, shallow life with only wealth on his side. facing another lonely christmas ahead, he revisit his old childhood home in the hope of reliving some old holiday memories – but he finds that the house in which he was raised is no longer the home in which he grew up."
6253,Grumpier Old Men,"a family wedding reignites the ancient feud between next-door neighbors and fishing buddies john and max. meanwhile, a sultry italian divorcée opens a restaurant at the local bait shop, alarming the locals who worry she'll scare the fish away. but she's less interested in seafood than she is in cooking up a hot time with max."
6271,Hoboken Hollow,"as trevor drifts through texas on collision course with a nightmare he is still haunted by the evils of the war he recently returned from and a promise he failed to keep. when a stranger offers a ride, trevor finds himself battling the brutal homegrown evil of the broderick family at hoboken hollow,a remote west texas ranch that many visit but few ever leave."
6276,Flowers in the Attic,"after the death of her husband, a mother takes her kids off to live with their grandparents in a huge, decrepit old mansion. however, the kids are kept hidden in a room just below the attic, visited only by their mother who becomes less and less concerned about them and their failing health, and more concerned about herself and the inheritence she plans to win back from her dying father."
6278,Mommie Dearest,"in this biographical film, glamorous yet lonely star joan crawford takes in two orphans, and at first their unconventional family seems happy. but after joan's attempts at romantic fulfillment go sour and she is fired from her contract with mgm studios, her callous and abusive behavior towards her daughter christina becomes even more pronounced. christina leaves home and takes her first acting role, only to find her mother's presence still overshadowing her."
6291,Neil Young: Heart of Gold,"in march 2005, neil young was diagnosed with a brain aneurysm. four days before he was scheduled for a lifesaving operation, he headed to nashville, where he wrote and recorded the country folk album prairie wind with old friends and family members. after the successful operation and recovery period, he returned to nashville that august to play at the famed ryman auditorium, once again gathering together friends and family for this special performance."
6307,Opal Dream,"pobby & dingan are invisible. they live in an opal town in australia and are friends with kellyanne, the 9 year-old daughter of an opal miner. the film tells the story of the bizarre and inexplicable disappearance of pobby & dingan, kellyanne's imaginary friends, and the impact this has on her family and the whole town. the story is told through the eyes of kellyanne's 11 years old brother ashmol."
6313,Man of Her Dreams,"marcus seems to have the perfect marriage, but a surprise visit from his long-absent sister-in-law, louise, threatens to disrupt his serene home. louise brings along her adopted daughter, who professes her love for marcus's son. the news forces marcus to share his own long-buried secret in this film adaptation of donald gray's stage play - a secret that may destroy his family."
6329,Libera,"this high-energy three part comedy has a strong undercurrent of melancholy, as it shows three different women coping with difficult situations which are usually sexual in origin, even if the moment of romance is long past. in the first tale, aurora has gotten used to a cozy, wealthy life, but begins to see her world destroyed when her husband is caught in bed with his secretary. later, he flees the country to avoid getting arrested for something else he has done. carmela is just welcoming her wayward son back to their slum home after he has spent a stint in ""reform"" school. not only has he just confessed to her that he's gay, but he has become a heroin addict.finally, libera works at a newsstand outside of naples as the sole breadwinner for her family. she is tired of her husband lounging in their house when he is not out tomcatting around with prostitutes, and decides to do something about it. so she secretly has him filmed in bed, and is marketing the tapes at her newsstand."
6332,Adored,"south of france: riki kandinski and his elder brother fredrico, come back to their family castle for their father's funeral. fredrico knows nothing about his younger brother, but he notices that he is making big money and living in luxury all for a few days work a week. by pure chance, fredrico gets his hands on a gay porn magazine and sees his brother in it."
6339,Windcroft,"on a remote farm in the sweeping hills of pennsylvania, three lives are torn apart by love, abandonment, deception and murder."
6372,The Burrowers,"it is 1879 in the dakota territories, a band of men who set out to find and recover a family of settlers that has mysteriously vanished from their home. expecting the offenders to be a band of fierce natives, but they soon discover that the real enemy stalks them from below."
6391,Fishtales,a greek history professor & his daughter travel to a greek island for one last chance to finish his thesis on ancient love spells before he loses his research grant. his daughter attempts to match her father with the local women without success until she meets a beautiful mermaid with whose help the professor might finally find true love for himself.
6394,Unstable Fables: 3 Pigs & a Baby,"when the three pigs find a tiny wolf cub on their doorstep, they decide to raise him as their own, unaware that they've played right into the plan of a special-ops team of wolves. as the newest addition to their family, lucky grows into his teens not knowing his history, his role in the wolves' plan or the difficult choice he will have to make about the family that raised him."
6400,Barbie and the Magic of Pegasus 3-D,"princess annika (barbie) escapes the clutches of the evil wizard, explores the wonders of cloud kingdom, and teams up with a magnificent winged horse - who turns out to be her sister, princess brietta - to defeat the wizard and break the spells that imprisoned her family."
6407,Marty,"marty, a butcher who lives in the bronx with his mother is unmarried at 34. good-natured but socially awkward he faces constant badgering from family and friends to get married but has reluctantly resigned himself to bachelorhood. marty meets clara, an unattractive school teacher, realising their emotional connection, he promises to call but family and friends try to convince him not to."
6408,All Roads Lead Home,the story is about a 12 year old girl who loses her mother in an automobile accident. her father struggles with the loss of his wife and trying to raise his young daughter who believes her father is partly responsible for her mother's death. belle's maternal grandfather is a changed man since losing his daughter in the accident. he finds it difficult to have a relationship with belle since she is a constant reminder of her mother. it is atticus the new puppy who will change belle's life and the lives of those who love her
6436,Day Zero,"the military draft is back. three best friends are drafted and given 30 days to report for duty. in that time they're forced to confront everything they believe about courage, duty, love, friendship and honor. if called to serve, what would you do?"
6445,All About Anna,"anna is a young costume designer, focused on her job and wary of getting caught in romantic relationships. she has just found a new apartment, and is tempted to let her latest boyfriend, frank, move in with her. instead, she finds a tenant: the flamboyant, fun-loving camilla, who shares anna’s views on love and commitment. for both of them, it’s all about fun."
6446,Selena,"in this biographical drama, selena quintanilla is born into a musical mexican-american family in texas. her father, abraham, realizes that his young daughter is talented and begins performing with her at small venues. she finds success and falls for her guitarist, chris perez, who draws the ire of her father. seeking mainstream stardom, selena begins recording an english-language album which, tragically, she would never complete."
6458,The Cake Eaters,"the death of the kimbrough family matriarch affects the three male survivors of the clan. widower easy tries to reconnect with his old flame, marg. eldest son and struggling musician guy moves back to town, feeling guilty that he missed the funeral. his brother, beagle, who was his mother's caretaker, falls for marg's granddaughter, georgia, a chronically ill girl who fears her time is growing short."
6466,Freaky Friday,"school girl annabel is hassled by her mother, and mrs. andrews is annoyed with her daughter, annabel. they both think that the other has an easy life. on a normal friday morning, both complain about each other and wish they could have the easy life of their daughter/mother for just one day and their wishes come true as a bit of magic puts annabel in mrs. andrews' body and vice versa. they both have a freaky friday."
6491,Forbidden Zone,"a mysterious door in the basement of the hercules house leads to the sixth dimension by way of a gigantic set of intestine. when frenchy slips through the door, king fausto falls in love with her. the jealous queen doris takes frenchy prisoner, and it is up to the hercules family and friend squeezit henderson to rescue her."
6510,Baby Boy,"the story of jody, a misguided, 20-year-old african-american who is really just a baby boy finally forced-kicking and screaming to face the commitments of real life. streetwise and jobless, he has not only fathered two children by two different women-yvette and peanut but still lives with his own mother. he can't seem to strike a balance or find direction in his chaotic life."
6515,Simply Irresistible,"after her mother's death, mediocre chef amanda shelton is having trouble attracting customers to her family's restaurant. while shopping for ingredients, she is given a magical crab by mysterious gene o'reilly. afterward, amanda's dishes suddenly become excellent, inducing strong emotional reactions in everyone who eats them. tom bartlett, who is preparing to open his own eatery, tries her cooking and falls in love."
6519,The Slipper and the Rose,"in the tiny kingdom of euphrania, the king and his court are most anxious to get prince edward wed. but edward wants to marry for love. meanwhile, young cinderella finds life drastically altered with her father's death as she's forced to be a servant in her own house. but a cheery fairy godmother helps her with her impossible tasks, and even gets her to take an evening out at the king's bride-fin"
6534,Storm Cell,"a brother and sister are torn apart when their parents die tragically in a tornado. while he moves to seattle to be away from the memory, she devotes her life to studying storms and weather patterns. when she discovers the threat of a powerful series of tornadoes are heading for seattle, she must convince her brother and the entire city that she is not crazy; and they are in grave danger"
6542,The Sons of Katie Elder,"the four sons of katie elder reunite in their hometown of clearwater, texas for their mother's funeral, and discover that the family ranch is now in the hands of morgan hastings, the town's gunsmith."
6560,Amityville II: The Possession,"eager to start afresh, the unsuspecting couple of anthony and dolores montelli, along with their four children, move into their dream house in amityville. however, right from the very first night, strange paranormal experiences shatter the montellis' fantasy, as the restless spirits of the dead and the new home's dark secrets open the unfathomable black portal of hell. now, the family's older child, sonny, has become the perfect vessel of destruction, as the invisible demonic forces claim his soul. can father frank adamsky cleanse the infernal amityville house?"
6579,Holiday,"johnny case, a freethinking financier, has finally found the girl of his dreams — julia seton, the spoiled daughter of a socially prominent millionaire — and she's agreed to marry him. but when johnny plans a holiday for the two to enjoy life while they are still young, his fiancée has other plans & that is for johnny to work in her father's bank!"
6581,A Place To Be Loved,"gregory kingsley, a boy passed off onto social services by his natural mother and abused by his natural father, finds the foster family he is put into to be the type of family he needs and takes his natural mother to court to have her parental rights revoked so that he can be adopted by the russes. the story is based on the real case of the boy who really did have to take this action to avoid being sent back into an unacceptable situation."
