id,title,synopsis
1461,Frankenstein: Birth of a Monster,"a drama telling the story of the life of the writer of frankenstein; the 19-year-old mary shelley. telling of her influences, her writing and her personal life. the extraordinary story of how she created frankenstein, one of the world's most terrifying monsters."
1475,The Blood of Fu Manchu,"fu manchu inoculates ten women with poison, to kill ten world leaders."
1481,Drums of Fu Manchu,"the nefarious dr. fu manchu searches for the keys to the tomb of genghis khan, in order to fulfill a prophecy that will enable him to conquer the world. his nemesis, dr. nayland smith, and his associates fight to keep the evil doctor from getting his hands on the keys. in 1943, the serial that was edited together into a feature movie also called drums of fu manchu."
1503,"Girl, Interrupted","set in the changing world of the late 1960s, susanna kaysen's prescribed ""short rest"" from a psychiatrist she had met only once becomes a strange, unknown journey into alice's wonderland, where she struggles with the thin line between normal and crazy. susanna soon realizes how hard it is to get out once she has been committed, and she ultimately has to choose between the world of people who belong inside or the difficult world of reality outside."
1514,Clockmaker,"fourteen-year-old henry and his friends are about to change history. sneaking into the apartment of an eccentric clockmaker, the kids discover that the old man controls time for the entire world through an incredible array of magnificent timepieces and weird machines. when one of the curious kids accidentally pushes a wrong button and gets launched back in time, the space-time continuum is severely disrupted. as everything begins to change around them, the young adventurers must travel back in time to save their friend...and the future"
1526,Lost Horizon,"british diplomat robert conway and a small group of civilians crash land in the himalayas, and are rescued by the people of the mysterious, eden-like valley of shangri-la. protected by the mountains from the world outside, where the clouds of world war ii are gathering, shangri-la provides a seductive escape for the world-weary conway."
1585,Team America: World Police,"team america world police follows an international police force dedicated to maintaining global stability. learning that dictator kim jong il is out to destroy the world, the team recruits broadway star gary johnston to go undercover. with the help of team america, gary manages to uncover the plan to destroy the world. will team america be able to save it in time? it stars… samuel l jackson, tim robbins, sean penn, michael moore, helen hunt, matt damon, susan sarandon, george clooney, danny glover, ethan hawke, alec baldwin… or does it?"
1590,The Down-in-the-Hole Gang,"here we find a group of misfits who've given up on humanity and have decided to dwell below the pavement. the group has its own hierarchy, of course, and soon the conditions that drove them underground begin to manifest themselves without the influences of the outside world."
1630,The Comeback,"after an absence of five years, six times mr olympia winner arnold schwarzenegger makes a comeback and attempts to take the world body building championship for the 7th time."
1633,Scary Movie 4,"cindy finds out the house she lives in is haunted by a little boy and goes on a quest to find out who killed him and why. also, alien ""tr-ipods"" are invading the world and she has to uncover the secret in order to stop them."
1692,Enchanted,"the beautiful princess giselle is banished by an evil queen from her magical, musical animated land and finds herself in the gritty reality of the streets of modern-day manhattan. shocked by this strange new environment that doesn't operate on a ""happily ever after"" basis, giselle is now adrift in a chaotic world badly in need of enchantment. but when giselle begins to fall in love with a charmingly flawed divorce lawyer who has come to her aid - even though she is already promised to a perfect fairy tale prince back home - she has to wonder: can a storybook view of romance survive in the real world?"
1694,The World's Biggest Penis,"meet the men, including the man claiming to have the world's biggest penis, who reveal there is a bittersweet side to nature's gift, and who lift the veil on a taboo subject and to show the reality of what it's like to have what all men dream of."
1699,The Meaning of Life,"life's questions are 'answered' in a series of outrageous vignettes, beginning with a staid london insurance company which transforms before our eyes into a pirate ship. then there's the national health doctors who try to claim a healthy liver from a still-living donor. the world's most voracious glutton brings the art of vomiting to new heights before his spectacular demise."
1754,The 11th Hour,"a look at the state of the global environment including visionary and practical solutions for restoring the planet's ecosystems. featuring ongoing dialogues of experts from all over the world, including former soviet prime minister mikhail gorbachev, renowned scientist stephen hawking, former head of the cia r. james woolse"
1759,Ten Little Indians,"ten strangers are invited as weekend guests to a remote mountain mansion. when the host doesn't show up, the guests start dying, one by one, in uniquely macabre agatha christie-style. it is based on christie's best-selling novel with 100 million sales to date, making it the world's best-selling mystery ever, and one of the most-printed books of all time."
1774,A Boy and His Dog,"set in the year 2024 in post-apocalyptic america, 18-year old vic and his telepathic dog, blood, are scavengers in the desolate wilderness ravaged by world war iv, where survivors must battle for food, shelter, and sexual companionship in the desert-like wasteland. vic and blood eke out a meager existence, foraging for food and fighting gangs of cutthroats."
1781,Edge of Seventeen,"from toni basil to the eurythmics, from friendship bracelets to whip-it's, the summer of 1984 was about as 80s as the 80s ever got. stuck right in the middle of it is eric hunter, heading towards his senior year, and passing the summer working at a local amusement park in the fast food restaurant. he is joined by his long time girl/friend maggie, as they don their ugly brown polyester uniforms and face the world."
1784,House of Cards,"in 1960s paris, an american boxer stumbles upon an international fascist conspiracy that aims to create a new world order."
1802,The International,"an interpol agent and an attorney are determined to bring one of the world's most powerful banks to justice. uncovering money laundering, arms trading, and conspiracy to destabilize world governments, their investigation takes them from berlin, milan, new york and istanbul. finding themselves in a chase across the globe, their relentless tenacity puts their own lives at risk."
1811,An American Tail,"a young mouse named fievel and his family decide to migrate to america, a ""land without cats,"" at the turn of the 20th century. but somehow, fievel ends up in the new world alone and must fend off not only the felines he never thought he'd have to deal with again but also the loneliness of being away from home."
1856,Ancient Warriors,special forces captain aldo paccione must pull together his former world team delta force and go deep within the mines of sardinia when it is discovered that a vengeful band of mercenaries are developing deadly biochemical weapons.
1933,Dead Weekend,"set in the ""not-too distant future"", martial law has been declared in the city in leu of a looming earthquake. however, the earthquake is merely a ruse, a story fed to the public so the twf (true world forces) can capture an alien spotted over the city some few days earlier. a twf agent runs into the alien (a *hottie* who can change her appearance, while always remaining - of course - a hottie), and the two go off and, um, compare their respective physiology (yeah, that's it)."
2063,Along Came Polly,"reuben feffer is a guy who's spent his entire life playing it safe. polly prince is irresistible as a free-spirit who lives for the thrill of the moment. when these two comically mismatched souls collide, reuben's world is turned upside down, as he makes an uproarious attempt to change his life from middle-of-the-road to totally-out-there."
2073,The Good Thief,a compulsive gambler plans the heist of his life - a priceless collection of art from the world-class casino riviera in monte carlo.
2082,Murder by Death,"lionel twain invites the world's five greatest detectives to a 'dinner and murder'. included are a blind butler, a deaf-mute maid, screams, spinning rooms, secret passages, false identities and more plot turns and twists than are decently allowed."
2095,The Strange Case of the End of Civilization as We Know It,"the grandchild of professor james moriarty had promised the world that it has only five days left to live. moriarty is a master of disguise, a crack shot, and is very patient. several government figures are shot to death, and it seems that it truly is the end of civilization as we know it - until the president learns that the grandson of sherlock holmes is living at 221b baker street, and sends the police commissioner of scotland yard to employ him."
2097,Revenge of the Pink Panther,"chief inspector jacques clouseau is dead. at least that is what the world—and charles dreyfus—believe when a dead body is discovered in clouseau's car after being shot off the road. naturally, clouseau knows differently and, taking advantage of not being alive, sets out to discover why an attempt was made on his life."
2135,Beautiful Boxer,"based on the true life story of a thai who wishes to have a sex change operation to become a woman. to pay for this he enters the brutal world of thai boxing, un-nerving his opponents by performing a makeup application ritual before each fight."
2255,Search for the Jewel of Polaris: Mysterious Museum,"while visiting a museum, two siblings ben and kim a fierce electrical storm creates a passage between the real world and worlds within the paintings. they are magically whisked through time to the 1600's and find they must square off against a wicked magician and also locate a valuable jewel in order to return to the present day."
2284,xXx,"xander cage is your standard adrenaline junkie with no fear and a lousy attitude. when the us government ""recruits"" him to go on a mission, he's not exactly thrilled. his mission: to gather information on an organization that may just be planning the destruction of the world, led by the nihilistic yorgi."
2380,Æon Flux,"400 years into the future, disease has wiped out the majority of the world's population, except one walled city, bregna, ruled by a congress of scientists. when æon flux, the top operative in the underground 'monican' rebellion, is sent on a mission to kill a government leader, she uncovers a world of secrets."
2381,The Spiderwick Chronicles,"upon moving into the run-down spiderwick estate with their mother, twin brothers jared and simon grace, along with their sister mallory, find themselves pulled into an alternate world full of faeries and other creatures."
2383,Meet the Feebles,"heidi, the star of the ""meet the feebles variety hour"" discovers her lover bletch, the walrus, is cheating on her. and with all the world waiting for the show, the assorted co-stars must contend with drug addiction, extortion, robbery, disease, drug dealing, and murder. meanwhile the love between two of the stars is threatened by trevor the rat, who wishes to exploit the young starlet for use in his porno movie."
2412,They Live,"nada, a wanderer without meaning in his life, discovers a pair of sunglasses capable of showing the world the way it truly is. as he walks the streets of los angeles, nada notices that both the media and the government are comprised of subliminal messages meant to keep the population subdued, and that most of the social elite are skull-faced aliens bent on world domination. with this shocking discovery, nada fights to free humanity from the mind-controlling aliens."
2419,What the #$*! Do We (K)now!?,"amanda is a divorced woman who makes a living as a photographer. during the fall of the year amanda begins to see the world in new and different ways when she begins to question her role in life, her relationships with her career and men and what it all means. as the layers to her everyday experiences fall away insertions in the story with scientists, and philosophers and religious leaders impart information directly to an off-screen interviewer about academic issues, and amanda begins to understand the basis to the quantum world beneath. during her epiphany as she considers the great questions raised by the host of inserted thinkers, she slowly comprehends the various inspirations and begins to see the world in a new way."
2442,I Spy,"when the switchblade, the most sophisticated prototype stealth fighter created yet, is stolen from the u.s. government, one of the united states' top spies, alex scott, is called to action. what he doesn't expect is to get teamed up with a cocky civilian, world class boxing champion kelly robinson, on a dangerous top secret espionage mission. their assignment: using equal parts skill and humor, catch arnold gundars, one of the world's most successful arms dealers."
2448,The 6th Day,futuristic action about a man who meets a clone of himself and stumbles into a grand conspiracy about clones taking over the world.
2453,Torch Song Trilogy,"a very personal story that is both funny and poignant, torch song trilogy chronicles a new yorker's search for love, respect and tradition in a world that seems not especially made for him."
2496,The Fashionistas,"a famous fashion designer, searching for a hot new ""bondage"" look, comes across a design house called the fashionistas. unbeknownst to him, the firm's owner is determined to seduce him--not only to get him to buy her line, but also because she knows he can get her into the strange world of underground s&m clubs."
2500,Steel Chariots,"set in the world of nascar racing, a family racing team is in danger of being ripped apart by the rivalry between two brothers tempted by fame, money, and beautiful women."
2528,Jumanji,"when siblings judy and peter discover an enchanted board game that opens the door to a magical world, they unwittingly invite alan -- an adult who's been trapped inside the game for 26 years -- into their living room. alan's only hope for freedom is to finish the game, which proves risky as all three find themselves running from giant rhinoceroses, evil monkeys and other terrifying creatures."
2533,The Shadow,"based on the 1930's comic strip, puts the hero up against his arch enemy, shiwan khan, who plans to take over the world by holding a city to ransom using an atom bomb. using his powers of invisibility and ""the power to cloud men's minds"", the shadow comes blazing to the city's rescue with explosive results."
2535,Prince of Darkness,"a research team finds a mysterious cylinder in a deserted church. if opened, it could mean the end of the world."
2546,Wayne's World,"based on the saturday night live sketch of the same name, wayne's world is a wacky, irreverent pop-culture comedy about the adventures of two amiably aimless metal-head friends, wayne (mike myers) and garth (dana carvey). from wayne's basement, the pair broadcast a talk-show called ""wayne's world"" on local public access television. the show comes to the attention of a sleazy network executive (rob lowe) who wants to produce a big-budget version of ""wayne's world""—and he also wants wayne's girlfriend, a rock singer named cassandra (tia carrere). wayne and garth have to battle the executive not only to save their show, but also cassandra. director penelope spheeris, myers and carvey hang a lot of silly, but funny, jokes on this thin plot, and the energy of the cast—as well as the wild pop-culture references—make wayne's world a cut above the average saturday night live spin-off movie."
2553,Che: Part Two,"after the cuban revolution, che is at the height of his fame and power. then he disappears, re-emerging incognito in bolivia, where he organizes a small group of cuban comrades and bolivian recruits to start the great latin american revolution. through this story, we come to understand how che remains a symbol of idealism and heroism that lives in the hearts of people around the world."
2557,Maradona by Kusturica,"a documentary on argentinean soccer star diego maradona, regarded by many as the world's greatest modern player."
2561,Amelia,"a look at the life of legendary american pilot amelia earhart, who disappeared while flying over the pacific ocean in 1937 in an attempt to make a flight around the world."
2565,Green Street Hooligans,"after being wrongfully expelled from harvard university, american matt buckner flees to his sister's home in england. once there, he is befriended by her charming and dangerous brother-in-law, pete dunham, and introduced to the underworld of british football hooliganism. matt learns to stand his ground through a friendship that develops against the backdrop of this secret and often violent world. 'green street hooligans' is a story of loyalty, trust and the sometimes brutal consequences of living close to the edge."
2573,Hancock,"hancock is a down-and-out superhero who's forced to employ a pr expert to help repair his image when the public grows weary of all the damage he's inflicted during his lifesaving heroics. the agent's idea of imprisoning the antihero to make the world miss him proves successful, but will hancock stick to his new sense of purpose or slip back into old habits?"
2577,Atlantis: Milo's Return,milo and kida reunite with their friends to investigate strange occurances around the world that seem to have links to the secrets of atlantis.
2626,The Cave,"after a group of biologists discovers a huge network of unexplored caves in romania and, believing it to be an undisturbed eco-system that has produced a new species, they hire the best american team of underwater cave explorers in the world. while exploring deeper into the underwater caves, a rockslide blocks their exit, and they soon discover a larger carnivorous creature has added them to its food chain."
2640,Tank Girl,"based on the british cult comic-strip, our tank-riding anti-heroine fights a mega-corporation, which controls the world's water supply."
2653,The American President,"widowed u.s. president andrew shepherd, one of the world's most powerful men, can have anything he wants -- and what he covets most is sydney ellen wade, a washington lobbyist. but shepherd's attempts at courting her spark wild rumors and decimate his approval ratings."
2665,The Quest,"ghang-gheng, the ancient winner-take-all competition in which the deadliest fighters from around the world employ the most spectacular feats of martial arts skills ever displayed in order to win the prized golden dragon. but fighting prowess alone will not be enough for chris to triumph over such daunting foes."
2715,The Avengers,"british ministry agent john steed, under direction from ""mother"", investigates a diabolical plot by arch-villain sir august de wynter to rule the world with his weather control machine. steed investigates the beautiful doctor mrs. emma peel, the only suspect, but simultaneously falls for her and joins forces with her to combat sir august."
2722,The Scorpion King,"in ancient egypt, peasant mathayus is hired to exact revenge on the powerful memnon and the sorceress cassandra, who are ready to overtake balthazar's village. amid betrayals, thieves, abductions and more, mathayus strives to bring justice to his complicated world."
2765,Zoolander,"clear the runway for derek zoolander, vh1's three-time male model of the year. his face falls when hippie-chic hansel scooters in to steal this year's award. the evil fashion guru mugatu seizes the opportunity to turn derek into a killing machine. it's a well-designed conspiracy and only with the help of hansel and a few well-chosen accessories like matilda can derek make the world safe for male models everywhere."
2770,Double Team,he's a one-man arsenal... with enough voltage to rock the free world. they don't play by the rules. you're either on their side...or in their way. america's top counter-terrorist usually works alone...this time he's got company.
2812,The Crow: Salvation,"alex corvis returns to the world of the living to avenge the murder of his girlfriend, who he was wrongly accused of killing. but first he must uncover the truth about who really killed her."
2833,Spy Kids 2: The Island of Lost Dreams,"exploring the further adventures of carmen and juni cortez, who have now joined the family spy business as level 2 oss agents. their new mission is to save the world from a mad scientist living on a volcanic island populated by an imaginative menagerie of creatures. on this bizarre island, none of the cortez's gadgets work and they must rely on their wits--and each other--to survive and save the day."
2866,Scanners,"after a man with extraordinary—and frighteningly destructive—telepathic abilities is nabbed by agents from a mysterious rogue corporation, he discovers he is far from the only possessor of such strange powers, and that some of the other “scanners” have their minds set on world domination, while others are trying to stop them."
2870,Prince of Persia: The Sands of Time,"a rogue prince reluctantly joins forces with a mysterious princess and together, they race against dark forces to safeguard an ancient dagger capable of releasing the sands of time – gift from the gods that can reverse time and allow its possessor to rule the world."
2886,The Fan,"when the san francisco giants pay center-fielder, bobby rayburn $40 million to lead their team to the world series, no one is happier or more supportive than #1 fan, gil renard.  when rayburn becomes mired in the worst slump of his career, the obsessed renard decides to stop at nothing to help his idol regain his former glory—not even murder."
2904,Last Action Hero,"danny is obsessed with a fictional movie character action hero jack slater. when a magical ticket transports him into jack's latest adventure, danny finds himself in a world where movie magic and reality collide. now it's up to danny to save the life of his hero and new friend."
2922,The Fast and the Furious: Tokyo Drift,"in order to avoid a jail sentence, sean boswell heads to tokyo to live with his military father. in a low-rent section of the city, shaun gets caught up in the underground world of drift racing"
2932,Red Sonja,"the tyrant gedren seeks the total power in a world of barbarism. she raids the city hablac and kills the keeper of a talisman that gives her great power. red sonja, sister of the keeper, sets out with her magic sword to overthrow gedren."
2962,Pulse,"when their computer hacker friend accidentally channels a mysterious wireless signal, a group of co-eds rally to stop a terrifying evil from taking over the world."
2964,Sweet and Lowdown,"a comedic biopic focused on the life of fictional jazz guitarist emmett ray. ray was an irresponsible, free-spending, arrogant, obnoxious, alcohol-abusing, miserable human being, who was also arguably the best guitarist in the world."
2999,End Game,"alex thomas was the man in charge of protecting the president but, when the time came to fulfill his duties, everything just went wrong. his conscience haunted by a bullet, and his devotion to his country stronger than ever, alex teams with a seasoned reporter to navigate a treacherous web of lies, unlocking a dangerous conspiracy, and enter a deadly world in which skilled assassins and highly-trained ex-special ops lurk in every shadow."
3021,Epic Movie,"when edward, peter, lucy and susan each follow their own path, they end up finding themselves at willy's chocolate factory. walking through a wardrobe, they discover the world of gnarnia, which is ruled by the white bitch. meeting up with characters such as harry potter and captain jack swallows, the newly reunited family must team up with aslo, a wise-but-horny lion to stop the white bitch's army"
3022,Elephants Dream,"elephants dream is the story of two strange characters exploring a capricious and seemingly infinite machine. the elder, proog, acts as a tour-guide and protector, happily showing off the sights and dangers of the machine to his initially curious but increasingly skeptical protege emo. as their journey unfolds we discover signs that the machine is not all proog thinks it is, and his guiding takes on a more desperate aspect.  elephants dream is a story about communication and fiction, made purposefully open-ended as the world’s first 3d animated “open movie”. the film itself is released under the creative commons license, along with the entirety of the production files used to make it (roughly 7 gigabytes of data). the software used to make the movie is the free/open source animation suite blender along with other open source software, thus allowing the movie to be remade, remixed and re-purposed with only a computer and the data on the dvd or download."
3024,Goal!,"like millions of kids around the world, santiago harbors the dream of being a professional footballer... however, living in the barrios section of los angeles, he thinks it is only that--a dream. until one day an extraordinary turn of events has him trying out for premiership club newcastle united."
3029,Mad City,a misguided museum guard who loses his job and then tries to get it back at gunpoint is thrown into the fierce world of ratings-driven tv gone mad.
