id,title,synopsis
1571,Blondie's Lucky Day,"blondie's lucky day is the 17th entry in the long-running blondie film series based on the comic strip by chic young. blondie's lucky day, indeed!  not only must blondie bumstead (penny singleton) put on a brave face when her husband dagwood (arthur lake) is fired for the umpteenth time by mr. dithers (jonathan hale), but she must also tolerate the attentions paid to dagwood by pretty wac mary jane mcdermott (angelyn orr).  a whiz in business matters, mary jane sets up dag in his own business, which replenishes the bumstead coffers but which drives blondie into a jealous frenzy.  the film's highlight occurs early on, when dagwood assumes dithers' responsibilities for a single day--and makes a proper mess of things within five minutes.["
1578,Blondie's Secret,"the 24th entry in the ""blondie"" film series begins as dagwood prepares for a long-delayed vacation with the family.  his boss mr. radcliffe (jerome cowan) has promised the bumsteads that there'll be no more postponements for their holiday.  but when something comes up that requires dagwood's presence, radcliffe hires a couple of thugs to steal blondie and dagwood's luggage so that they'll have to stay in town. and that's only the beginning of the frantic fun."
1582,Blondie's Big Deal,"in this, the 25th blondie film, dagwood accidentally discovers a non-flammable paint.  bad guys dillon and stack steal it before he can give it to his boss radcliffe.  to show off his invention, dagwood paints radcliffe's house with it and disgraced when the house burns down!"
1602,Three Seasons,"three seasons wants to show individuals triumphing over adversities, recovering from traumas, looking forward to better times, as well as nostalgia for those better days before american and french and other invasions, material and ideological. it is a poetic film that tries to paint a picture of the urban culture undergoing westernisation."
1621,Scream 2,"two years after the terrifying events that occurred in woodsboro, sidney is now attending windsor college in cincinnati, and gale weathers' best selling book on sidney's life has now been made into a major motion picture. when two college students are killed in a theatre while watching the new film 'stab', sidney knows deep down that history is repeating itself."
1645,Monsieur Truffaut Meets Mr. Hitchcock,"when francois truffaut approached alfred hitchcock in 1962 with the idea of having a long conversation with him about his work and publishing this in book form, he didn't imagine that more than four years would pass before le cinéma selon hitchcock finally appeared in 1966. not only in france but all over the world, truffaut's hitchcock interview developed over the years into a standard bible of film literature. in 1983, three years after hitchcock's death, truffaut decided to expand his by now legendary book to include a concluding chapter and have it published as the ""edition définitive"". this film describes the genesis of the ""hitchbook"" and throws light on the strange friendship between two completely different men. the centrepieces are the extracts from the original sound recordings of the interview with the voices of alfred hitchcock, francois truffaut, and helen scott – recordings which have never been heard in public before."
1697,Emil and the Detectives,"erich kästner’s beloved novel has been adapted for film or television six times since its publication in 1929; this 1935 british version was the first in english. believed lost for decades, it was recently rediscovered by the bfi and has now been restored. the film moves the action from berlin to london, where emil goes to stay with his grandmother and cousin. thereafter, the tale of emil’s adventures with a gang of streetwise london children faithfully follows the original plot."
1728,Arctic Tale,"arctic tale is a 2007 documentary film from the national geographic society about the life cycle of a walrus and her calf, and a polar bear and her cubs, in a similar vein to the 2005 hit production march of the penguins, also from national geographic."
1736,Southland Tales,"set in the futuristic landscape of los angeles on july 4, 2008, as it stands on the brink of social, economic and environmental disaster. boxer santaros is an action star who's stricken with amnesia. his life intertwines with krysta now, an adult film star developing her own reality television project, and ronald taverner, a hermosa beach police officer who holds the key to a vast conspiracy."
1753,Five Moons Plaza,just the night before his retirement district attorney saracini is given a film showing the kidnapping of aldo moro.  as the district attorney takes on the case he along with his team finds more compelling and secretive evidences.  too many secrets are found that should stayed as secrets.
1812,There Is No Authority But Yourself,"a dutch documentary about the history of the anarchist punk band crass. the film features archival footage of the band, and interviews with former members steve ignorant, penny rimbaud and gee vaucher."
1852,The Day of the Locust,"hollywood, 1930s. tod hackett, a young painter who tries to make his way as an art director in the lurid world of film industry, gets infatuated with his neighbor faye greener, an aspiring actress who prefers the life that homer simpson, a lone accountant, can offer her."
1877,Pumping Iron,"pumping iron is a 1977 documentary film about the run-up to the 1975 mr. olympia bodybuilding competition. the film focuses on arnold schwarzenegger and his competitors, lou ferrigno and franco columbu. the documentary was co-directed by robert fiore and george butler. it was based on the book of the same name by charles gaines and george butler (simon and schuster, 1974)."
1888,Fast Lane to Malibu,"the film follows randy college boys zack and brian on a trip to malibu for a party where there's a shortage of boys but a bevy of buxom girls. beset on the way by car trouble, and various other distractions, the film also follows the journey of zack and brian's girlfriends, who follow the boys to malibu but end up having their own lusty adventures."
1917,Battlefield Earth: Evolution & Creation,"travolting (unfortunately i can't take credit for this brilliant insult)!!! one of the worst movies i have ever seen; yet you(might) have to give travolta credit for sticking it out with this obvious train-wreck, which most likely was quite evident even during the filming. one of the most infuriating things about this movie is the complete lack of any creativity in order to explain the inconsistencies and conflicts of logic in the plot and story, like using 1000 year old weapons and airplanes!; either the creators of this film think that anyone who would watch this movie are completely retarded (which may be true, and that includes me!), or the people who made this movie are freaking delusional- both are obviously true! (by n-reynolds (united states))"
1946,The Immoral Mr. Teas,"mr. teas is a door to door salesman for dentists' appliances. everywhere he goes he encounters beautiful ""well-developed"" nude women, which of course stir his interest. the only sound in the film is the voice of a narrator and a very monotonic musical theme played on the clarinet or some similar instrument."
1947,Up!,"up! is a 1976 soft core sex comedy film directed by american filmmaker russ meyer. the plot centers around a bizarre murder mystery involving the death of former nazi adolf schwartz, a caricature of adolf hitler, who was living in hiding in a bavarian style castle in northern california.kitten natividad plays the ""greek chorus"", who appears nude between scenes throughout the film to provide narration, plot details, and updates."
1956,Pandora Peaks,documentary on famed erotic icon pandora peaks. last film directed by russ meyer.
1969,Star Virgin,"the film is about a star virgin who lives with a robot in space and one day she starts to become aroused.  she starts to question the robot about sex so the robot shows her a series of vignettes involving sex.  the first is about a young couple who find themselves in the garden of eden.  the second is  a vampire tale as dracula finds himself a new bride, the third follows a quarterback who gets hurt in the big game and is out cold so they take him into the locker room where two cheerleaders fuck him back to life. the fourth tale is about a special strip club where men may pay a price and gang bang the strippers.  the star virgin hears these stories and starts getting even more horny ..."
1975,Heavenly Bodies!,"taking a look at the connection that glamour models have to photography, a group of film makers follow a number of  glamour magazine photographers around, to discover the skill involved in getting ""magic"" to appear on the photos."
1986,The Desperate Women,the film is a cheesy but sincere plea for proper sex education--and against illegal abortion.
1996,The Seven Minutes,"the seven minutes is a steamy book written in 1969. to help with an upcoming election, a bookstore clerk is indicted for selling obscene material and most of the film centers about the trial. the defense attorneys need to find the mystery of the original publication of the book."
2007,Baghead,"four actors go to a cabin in the woods to write, direct, and act in a film that will jump-start their careers. their idea is a horror film about a man with a bag over his head, but what happens when that man mysteriously shows up?"
2017,"Red, White and Blue","a documentary about the hearings of president nixon's commission on obscenity, featuring adult-film producer david f. friedman (one of the producers of this film) testifying before congress, and involved in the production of one of his films, ""trader hornee."""
2019,Sexual Freedom in Denmark,"starting as a documentary on the sexually liberated culture of late-sixties denmark, sexual freedom in denmark winds up incorporating major elements of the marriage manual form and even manages to squeeze in a montage of beaver loops and erotic art. all narrated with earnest pronouncements concerning the social and psychological benefits of sexual liberation, the movie, is a kind of mondo film dotted with occasional glimpses of actual sex."
2032,The L.A. Riot Spectacular,"the controversial satire the la riot spectacular plays for mordent laughs the events that consumed l.a. in 1992, after the police officers on trial for beating motorist rodney king were found innocent. the city was engulfed by a massive riot, but the film plays these moments for laughs. in addition to recreating some of the images seen on television, the film skewers a variety of figures including the police, the media, and the citizens of the city."
2096,Death on the Nile: Making of Featurette,"featurette documenting the making of the film ""death on the nile""."
2098,The Making of Agatha Christie's 'Evil Under the Sun',"director guy hamilton and several of the stars of agatha christie's ""evil under the sun"" walk you through the making of the film."
2212,Harlow,"hollywood drama loosely based on the life of film actress jean harlow, with carroll baker in the title role. one of two feature film biographies, both released in 1965 and both with the same title, about the '30s platinum blonde movie star."
2220,The Crooked Hearts,"a charming but somewhat larcenous widow attempts to snare a rich bachelor through a lonely hearts club, but her scheme boomerangs into a deadly cat-and-mouse game. this marked the tv-movie debut of both rosalind russell and douglas fairbanks jr., and was sadly also russell's last film role."
2232,Van Helsing: The London Assignment,"it tells of the events before the film, in which monster hunter gabriel van helsing travels to london to investigate a series of horrific, and decidedly supernatural murders, being committed by the mad scientist dr. jekyll, in the form of his evil alter-ego, mr. hyde."
2256,The Last Lear,"the film starts with the veteran thespian harish mishra, he is gravely ill. the punishments of a film shoot have left the old man in a coma. his co-star, shabnam, is wracked with worry, but their director, siddharth, keeps strangely distant and refuses to visit his ailing star. in flashbacks, their story emerges."
2282,Tropic Thunder,"ben stiller, jack black and robert downey jr. lead an ensemble cast in 'tropic thunder,' an action comedy about a group of self-absorbed actors who set out to make the most expensive war film. after ballooning costs force the studio to cancel the movie, the frustrated director refuses to stop shooting, leading his cast into the jungles of southeast asia, where they encounter real bad guys."
2347,Mohini Bhasmasur,"the plot of the film revolves around the hindu mythological story of mohini and bhasmasur. at over five hours, it inaugurated the tradition of indian cinematic epics and was the first indian film to feature actresses."
2357,Iceberg,this film is in pre-production
2394,Diameter of the Bomb,"since the renewed intifada began in 2000, there have been over 75 palestinian suicide bombings. this is the story of 0ne-the bombing of bus 32 in jerusalem in june 2002. the film connects the stories of a group of ordinary israelis-jews and arabs. each of them holds a clue to someone who died that day."
2399,Poetic Justice,"in this film, we see the world through the eyes of main character justice, a young african-american poet. a mail carrier invites a few friends along for a long overnight delivery run."
2401,Howards End,"a saga of class relations and changing times in an edwardian england on the brink of modernity, the film centers on liberal margaret schlegel, who, along with her sister helen, becomes involved with two couples: wealthy, conservative industrialist henry wilcox and his wife ruth, and the downwardly mobile working-class leonard bast and his mistress jackie."
2404,Chapter 27,a film about mark david chapman in the days leading up to the infamous murder of beatle john lennon.
2511,Uncounted,"uncounted exposes how the election fraud that altered the outcome of the 2004 election led to even greater fraud in 2006 and now looms as an unbridled threat to the outcome of the 2008 election. the controversial film examines in factual, logical, and yet startling terms how easy it is to change election outcomes and undermine election integrity across the u.s. beyond increasing the public's awareness, uncounted inspires greater citizen involvement in fixing a broken electoral system."
2642,Living in Oblivion,"nick is the director of a low-budget indie film. he tries to keep everything together as his production is plagued with an insecure actress, a megalomaniac star, a pretentious, beret-wearing director of photography and lousy catering. divided in three acts, each representing a different scene to shoot, this film is an essential for amateur filmmakers."
2650,Waking Life,"waking life is about a young man in a persistent lucid dream-like state. the film follows its protagonist as he initially observes and later participates in philosophical discussions that weave together issues like reality, free will, our relationships with others, and the meaning of life."
2699,S1m0ne,"the career of a disillusioned producer, who is desperate for a hit, is endangered when his star walks off the film set. forced to think fast, the producer decides to digitally create an actress ""simone"" to sub for the star — the first totally believable synthetic actress."
2709,Smilla's Sense of Snow,"smilla jaspersen, half danish, half greenlander, attempts to understand the death of a small boy who falls from the roof of her apartment building. suspecting wrongdoing, smilla uncovers a trail of clues leading towards a secretive corporation that has made several mysterious expeditions to greenland. scenes from the film were shot in copenhagen and western greenland. the film was entered into the 47th berlin international film festival, where director bille august was nominated for the golden bear."
2742,Anaconda,"a ""national geographic"" film crew is taken hostage by an insane hunter, who takes them along on his quest to capture the world's largest - and deadliest - snake."
2863,Analyze This,"countless wiseguy films are spoofed in this film that centers on the neuroses and angst of a powerful mafia racketeer who suffers from panic attacks. when paul vitti needs help dealing with his role in the ""family,"" unlucky shrink dr. ben sobel is given just days to resolve vitti's emotional crisis and turn him into a happy, well-adjusted gangster."
2865,The Call,"pirelli film's first promotional short, starring john malcovich and naomi campbell."
3100,Stop! Or My Mom Will Shoot,"a tough cop's seemingly frail mother comes to stay with him and progressively interferes in his life. she buys him an illegal mac-10 machine pistol and starts poking around in his police cases. eventually, the film draws to a denouement involving the title of the film and the revelation that even though she seems frail and weak she is capable of strong actions in some circumstances, i.e. when her son is threatened by thugs and she shoots herself in the shoulder."
3115,Rat Race,"in an ensemble film about easy money, greed, manipulation and bad driving, a las vegas casino tycoon entertains his wealthiest high rollers -- a group that will bet on anything -- by pitting six ordinary people against each other in a wild dash for $2 million jammed into a locker hundreds of miles away. the tycoon and his wealthy friends monitor each racer's every move to keep track of their favorites. the only rule in this race is that there are no rules."
3164,The Brave,"a down-on-his-luck american indian recently released from jail is offered the chance to ""star"" as the victim of a snuff film, the resulting pay of which could greatly help his poverty stricken family."
3341,The Freshman,"after a film student gets his belongings stolen, he meets a mobster bearing a startling resemblance to a certain cinematic godfather. soon, he finds himself caught up in a caper involving endangered species and fine dining."
3364,Nine,"arrogant, self-centered movie director guido contini finds himself struggling to find meaning, purpose, and a script for his latest film endeavor. with only a week left before shooting begins, he desperately searches for answers and inspiration from his wife, his mistress, his muse, and his mother."
3371,Cut,"a group of film students set out to finish filming a movie that was never completed after its director was murdered. after they begin filming, they realize they're in for a bit of trouble, not unlike the late director..."
3376,A Midsummer Night's Dream,a film adaptation of shakespeare's comedy about lovers whose romantic affections are manipulated by fairy magic. the setting is updated to a tuscan hill town in the late 19th century.
3393,What Ever Happened to Baby Jane?,"two aging film actresses live as virtual recluses in an old hollywood mansion. jane hudson, a successful child star, cares for her crippled sister blanche, whose career in later years eclipsed that of jane. now the two live together, their relationship affected by simmering subconscious thoughts of mutual envy, hate and revenge."
3419,Vacancy,"a young married couple becomes stranded at an isolated motel and find hidden video cameras in their room. they realize that unless they escape, they'll be the next victims of a snuff film."
3424,Starship Troopers 2: Hero of the Federation,"in the sequel to paul verhoeven's loved/reviled sci-fi film, a group of troopers taking refuge in an abandoned outpost after fighting alien bugs, failing to realize that more danger lays in wait."
3453,Wing Commander,"the hollywood version of the popular video game series ""wing commander"". unlike other video games to feature film transitions, series creator chris roberts was heavily involved in the film's creation. this is the story of christopher blair and todd ""maniac"" marshall as they arrive at the tiger claw and are soon forced to stop a kilrathi fleet heading towards earth."
3458,Zack and Miri Make a Porno,"lifelong platonic friends zack and miri look to solve their respective cash-flow problems by making an adult film together. as the cameras roll, however, the duo begin to sense that they may have more feelings for each other than they previously thought."
3496,Hoffa,"a portrait of union leader james r. hoffa, as seen through the eyes of his friend, bobby ciaro. the film follows hoffa through his countless battles with the rta and president roosevelt."
3503,Dragon: The Bruce Lee Story,"this film is a glimpse into the life, love and the unconquerable spirit of the legendary bruce lee. from a childhod of rigorous martial arts training, lee realizes his dream of opening his own kung-fu school in america. before long, he is discovered by a hollywood producer and begins a meteroric rise to fame and an all too short reign as one the most charasmatic action heroes in cinema history."
3511,Hack!,"seven college students are picked to travel to a private island owned by the reclusive vincent king and his film-obsessed wife mary shelley to study island wildlife. but is isn't long when a mysterious killer begins killing the students one-by-one, and modeling them after gory murder scenes from numerous horror films."
3547,My Father the Hero,"a teenage girl on vacation in the bahamas with her divorced father tries to impress a potential boyfriend by saying that her father is actually her lover. remake of the 1991 french film mon père, ce héros."
3570,Cancer Vixen: A True Story,"shortly after its release, the book was optioned by working title films in conjunction with cate blanchett. in march 2013, it was announced that hbo films is set to produce a film adaptation of the book starring blanchett. hbo films is closing a deal with julie delpy to adapt the marisa acocella marchetto memoir cancer vixen: a true story as a star vehicle for cate blanchett. blanchett is an executive producer on the project alongside maven pictures partners trudie styler and celine rattray. (aug 2013)"
3587,The Crow: City of Angels,"after ashe and his little son are murdered violently for no reason by judah's men, he returns from the dead to take revenge. one after one, judah's people face the power of the dark angel. the second film based on james o'barr's cult comic."
3630,The Life and Death of Peter Sellers,"the turbulent personal and professional life of actor peter sellers (1925-1980), from his beginnings as a comic performer on bbc radio to his huge success as one of the greatest film comedians of all time; an obsessive artist so dedicated to his work that neglected his loved ones and sacrificed part of his own personality to convincingly create that of his many memorable characters."
3635,My Best Friend's Birthday,"my best friend's birthday is a partially lost black-and-white amateur film. the original cut was about 70 minutes long but due to a fire only 36 minutes of the film survived. it is about mickey, who has been dumped by his girlfriend, and clarence, who's trying to give his friend an unforgettable birthday."
3657,The Dead Pool,"dirty harry callahan returns for his final film adventure. together with his partner al quan, he must investigate the systematic murder of actors and musicians. by the time harry learns that the murders are a part of a sick game to predict the deaths of celebrities before they happen, it may be too late..."
3752,The Abandoned,"marie, a film producer, returns to her native russia to find her birth parents. she quickly learns they are dead, and she has inherited their long-empty farmhouse. at the farm, she meets nicolai, who claims to be her twin brother. events take a terrifying turn when the two spot a pair of ghastly doppelgangers and the house itself seems to propel them toward a fate they should have met 40 years earlier."
3753,The Party,"hrundi v. bakshi, an accident-prone actor from india, is accidentally put the name on the guest list for an upcoming party at the home of a hollywood film director. unfortunately, from the moment he arrives, one thing after another goes wrong with a compounding affect."
3795,Shadow of the Vampire,"director f.w. murnau makes a faustian pact with a vampire to get him to star in his 1922 film ""nosferatu."""
3813,The Little Mermaid II: Return to the Sea,"set several years after the first film, ariel and prince eric are happily married with a daughter, melody. in order to protect melody from the sea witch, morgana, they have not told her about her mermaid heritage. melody is curious and ventures into the sea, where she meets new friends. but will she become a pawn in morgana's quest to take control of the ocean from king triton?"
3853,Flight 93,"flight 93 is a 2006 made-for-tv film, directed by peter markle, which chronicles the events aboard united airlines flight 93 during the september 11 attacks. it premiered january 30, 2006 on the a&amp;e network and was re-broadcast several times throughout 2006. the film focused heavily on eight passengers, namely todd beamer, mark bingham, tom burnett, jeremy glick, lauren grandcolas, donald greene, nicole miller, and honor elizabeth wainio. it features small appearances from many other passengers, namely donald peterson and his wife, jean, and also from flight attendant sandra bradshaw."
3861,Nothing,"the film tells the story of two good friends who live together, andrew, an agoraphobic travel agent who works from his home, and dave, a loser who works in an office where he is treated with contempt. just when it seems things can't get any worse for the two, the entire world outside of their house disappears and is replaced with an endless white void."
