id,title,synopsis
5565,In the Shadow of the Moon,"archival material from the original nasa film footage – much of it seen for the first time – plus interviews with the surviving astronauts, including jim lovell, dave scott, john young, gene cernan, mike collins, buzz aldrin, alan bean, edgar mitchell, charlie duke and harrison schmitt."
5568,The Year of the Yao,the year of the yao is a documentary film telling the first year of basketball player yao ming in the united states.
5583,I Am Trying to Break Your Heart: A Film About Wilco,"a documentary by photographer sam jones documenting american rock band wilco recording their fourth album yankee hotel foxtrot. originally intended as a showcase of the band's creative process, the film crew catches unexpected complications between the band and its record label and problems among the band members themselves."
5588,Virgin Territory,"the film is set in tuscany during the black death. as in the decameron, ten young florentines take refuge from the plague. but instead of telling stories, they have lusty adventures, bawdy exchanges, romance and swordplay. there are randy nuns, saracen pirates, and a sexy cow."
5693,The Matrix Revisited,the film goes behind the scenes of the 1999 sci-fi movie the matrix.
5766,Circle One,"with a fast-paced soundtrack and some of the greatest names in surfing, circle one is sure to entertain. check out ben bourgeois, kelly slater and danny fuller as they catch one big wave after another, showing off the moves that have made them famous. filmed at various locations around the globe, this film delivers some of the best surfing footage around and has been hailed as one of the best surf"
5785,Midnight Movie,"a rarely seen slasher flick gets a midnight screening at a run-down movie theater. the film's director was supposedly driven insane by it, but that doesn't deter horror fans, including bridget and her boyfriend, josh, from attending the showing. when the lights dim and the movie starts, they'd better prepare themselves for the scare of their lives. that's because they're not just going to be watching this bloodbath -- they're going to be starring in it."
5819,Silk,"based on the best-selling novel by alessandro baricco, this visually stunning film tells the story of a french trader who finds unexpected love far away from home."
5826,Redemption: A Mile from Hell,"can one act justify a lifetime of wickedness? explore the darkest confines of the soul from robert conway's film, ""redemption."" a genre busting western where there is no law, no good guys; only the bad and worse. frank harden is no stranger to the unlawful west, he is a killer. however, because of a tragic event he must battle his own worst enemy, himself."
5830,10 MPH,"two guys quit stodgy corporate jobs, scrounged up all the savings they could, collected credit cards, and stepped - or better yet - scooted forward to follow their biggest dream: to become filmmakers. josh caldwell rode a segway from seattle to boston, while his buddy hunter weeks directed a film they both shot about the experience and about the moments leading up to this crazy twist on the americ"
5842,George Lucas in Love,"1967 film student george lucas has writer's block trying to finish his ""space wheat"" script, until a beautiful fellow student with a familiar hairstyle teaches him that the best stories are in plain sight."
5846,For Your Consideration,"three actors learn that their respective performances in the film ""home for purim,"" a drama set in the mid-1940s american south, are generating award-season buzz."
5854,Mickey's Christmas Carol,"it is an adaptation of the charles dickens classic a christmas carol, featuring scrooge mcduck as his namesake and inspiration ebenezer scrooge and mickey mouse as bob cratchit. this film was based on a 1972 audio musical entitled disney's a christmas carol. it is a twenty-four minute animated short film produced by walt disney productions as an accompaniment to a re-release of the rescuers."
5881,The Dog Problem,"in the film, solo is a down-on-his-luck writer who is encouraged by his psychiatrist to get a dog. solo meets his love interest, who he assumes to be a dog owner when meeting her at a dog play park, but dog problems stand in their way."
5901,September Dawn,"a story set against the mountain meadows massacre, the film is based upon the tragedy which occurred in utah in 1857. a group of settlers, traveling on wagons, was murdered by the native mormons. all together, about 140 souls of men, women and children, were taken."
5910,Dirty Sanchez: The Movie,"the welsh nutters, dirty sanchez are making a movie: the concept of the film is that the devil has heard about the dare devil nature of the sanchez boys so he's set them the ultimate challenge, to complete stunts based on the 7 deadly sins or be damned to the gutter forever."
5915,1776,"the film focuses on the representatives of the thirteen original colonies who participated in the second continental congress. 1776 depicts the three months of deliberation (and, oftentimes, acrimonious debate) that led up to the signing of one of the most important documents in the history of the united states, the declaration of independence."
5916,Pooh's Grand Adventure: The Search for Christopher Robin,"a full length animated film for all the family to enjoy. pooh gets confused when christopher robin leaves him a note to say that he has gone back to school after the holidays. so pooh, piglet, tigger, eeyore and rabbit go in search of christopher robin which leads to a big adventure."
5927,Dark Reel,"murder, mystery and mayhem as b movie fan, adam waltz, wins walk on role in a film featuring scream queen, cassie blue (tiffany shepis). thinking his luck had changed for the better he steps into chaos with a killer loose and no one on the production safe."
5953,His Name Was Jason: 30 Years of Friday the 13th,"a retrospective documentary about the groundbreaking horror series, friday the 13th, featuring interviews with cast and crew from the twelve films spanning 3 decades."
5961,Wah-Wah,"set at the end of the 1960s, as swaziland is about to receive independence from united kingdom, the film follows the young ralph compton, at 12, through his parents' traumatic separation, till he's 14."
5996,Show: A Night In The Life of Matchbox Twenty,"taped at the philips arena in atlanta, georgia on june 28, 2003, matchbox twenty's show depicts a hard-working rock band in its prime and in its element. the full spectacle of matchbox twenty's more than you think you are tour comes across, from the band's world-class lights to its lock-tight playing, recorded and mixed for 5.1-channel surround and shot in gloriously film-like hd video."
6022,Ready,"absinthe remains committed to documenting these amazing riders with the most timeless and stylish medium: film. following up to last year’s question ‘optimistic?’, absinthe answers with a crew of riders who overcome obstacles with spontaneity and skill in another full spectrum snowboard film that is down to have some more fun with snowboarding. ready."
6023,All Day Every Day,"sandbox “all day everyday” snowboard dvd: who is sandbox, you say? bah! obvi it’s kevin sansalone and clayton larsen, along with a team of very talented young designers, filmers and riders. “all day everyday” is all about unique footage, good riding and fun mixed with some new faces, new sponsors, and high end hd production. all together this film has a great look and might just make you want to go riding."
6026,Double Decade,"double decade marks mack dawg productions’ 20th anniversary of filmaking. it is with great pride that we present this epic snowboarding film. double decade is a look into the past, and a look into the future of freestyle snowboarding. this movie is so ill it can only be rated s for sick.  mack dawg productions, 20 years deep and still loving it. damn, times flies when you’re having fun."
6027,For Right Or Wrong,"for for right or wrong is a documentary feature made in conjunction with burton snowboards, which profiles several of the companies sponsored riders in their various snow board disciplines; pipe, street, free ride and big air. a large part of the action takes place around the snowboard wunderkind shaun white, as he prepares to compete in the 2006 winter olympic games in torino, italy. the other various narrative strands follow the different paths of the individual boarders as we see them in action and they talk about why it is they do what they do. the film also introduces burton snow board founder and ceo of burton, jake burton carpenter."
6042,Cold Fusion,"for the 52nd year, warren miller is back—with his best film ever! join cold fusion’s world-class athletes as they embark on exciting adventures to such extraordinary locations as kenya and verbier, in search of the bluest skies and deepest powder. warren miller’s films have been astounding audiences for half a century—inspiring people of all ages to keep their snowriding dream alive—and this 52nd edition is no exception. cold fusion delivers the fiercest line-up of talented athletes as they set out on the most exotic, thrilling expeditions ever. but that’s not all! witness two astounding never-before-seen world records! complementing the on-screen excitement, cold fusion features a thundering soundtrack with electrifying artists like dave matthews band and foo fighters. and of course, warren millernarratese the film, bringing you plenty of the wry humor that has made him famous.  cold fusion is one downhill ride you don’t want to miss!"
6058,Jonah: A VeggieTales Movie,"get ready as bob the tomato, larry the cucumber and the rest of the veggies set sail on a whale of an adventure in big idea's first full-length, 3-d animated feature film. this is the story of jonah and the whale as you've never seen it before - a story where we learn that one of the best gifts you can give - or get - is a second chance."
6068,Rent: Filmed Live on Broadway,"rent: filmed live on broadway is a 2008 film of the final performance of the original broadway production of the musical rent on september 7, 2008, with some footage of the closing night celebration. the film had a limited theatrical release between september 24 and 28, 2008, in more than 500 theaters with high definition digital projection systems in the us and canada. the film is assembled from footage shot at the september 7 performance as well as a day of shooting on august 20. it includes a reprise of ""seasons of love"" featuring both the final cast and cast members from past productions, including the original broadway cast following the finale of the show proper."
6070,Fully Flared,a skateboarding film featuring the lakai team filmed over the course of 4 years.
6073,Coronation Street: Out of Africa,"coronation street: out of africa is a 2008 spin-off film featuring locals from the british soap opera coronation street, who visit the luxury resort of sun city, south africa. cilla battersby-brown (wendi peters), the mother from hell, brought her son and other ""son"" over to africa to win a competition for $500,000"
6085,Antarctica,"this large format film explores the last great wilderness on earth. it takes you to the coldest, driest, windiest continent, antarctica. the film explores the life in antarctica, both for the animals that live their and the scientist that work there."
6086,Undisputed II: Last Man Standing,"sequel to the 2002 film. this time, heavyweight champ george ""iceman"" chambers (white) is sent to a russian jail on trumped-up drug charges. in order to win his freedom he must fight against the jailhouse fighting champ uri boyka (adkins) in a battle to the death. this time he is not fighting for a title, he is fighting for his life!"
6114,Twilight Zone: The Movie,"an anthology film, presenting remakes of four episodes of the popular television series ""the twilight zone,"" featuring the segments ""time out,"" ""kick the can,"" ""it's a good life"" and ""nightmare at 20,000 feet."""
6121,I.O.U.S.A.,"with the country's debt growing out of control, americans by and large are unaware of the looming financial crisis. this documentary examines several of the ways america can get its economy back on the right track. in addition to looking at the federal deficit and trade deficit, the film also closely explores the challenges of funding national entitlement programs such as social security, medicare and medicaid."
6125,Steal This Film,"steal this film focuses on pirate bay founders gottfrid svartholm, fredrik neij and peter sunde, prominent members of the swedish filesharing community. the makers claimed that 'old media' documentary crews couldn't understand the internet culture that filesharers took part in, and that they saw peer-to-peer organization as a threat to their livelihoods. because of that, they were determined to accurately represent the filesharing community from within. notably, steal this film was released and distributed, free of charge, through the same filesharing networks that the film documents."
6146,Obsession: Radical Islam's War Against the West,"obsession is a film about the threat of radical islam to western civilization. using unique footage from arab television, it reveals an 'insider's view' of the hatred the radicals are teaching, their incitement of global jihad, and their goal of world domination."
6186,Disney Princess Enchanted Tales: Follow Your Dreams,"your little princess will want to follow her dreams as she tags along on an adventure with two of disney's most popular princesses in this new animated fairy tale. aurora, star of the beloved classic sleeping beauty, and jasmine, from the academy award-winning film aladdin, journey to faraway lands and make new discoveries about themselves."
6204,Kissing a Fool,"an egotistical television personality enlists the assistance of his best friend in putting the fidelity of his fiancé to the test in this amiable comedy of the sexes. told in flashback, the film takes a familiar love-triangle scenario and gives it a bitter twist. with a bride who seems too good for either suitor, the film is sustained by one question - who will she choose?"
6227,Mission to Mir,"this film shows how far we have come since the cold-war days of the 50s and 60s. back then the russians were our ""enemies"". and to them the americans were their ""enemies"" who couldn't be trusted. somewhere in all this a young girl in oklahoma named shannon set her sights on becoming one of those space explorers, even though she was told ""girls can't do that."" but she did."
6234,Deep Winter,"maverick downhill racer, tyler crowe, reunites with best friend and renegade snowboarder, mark rider. it doesn't take long for the old friends to take on a new mission. together they head to alaska, where led by a veteran guide, the two attempt the most daring descent on snow ever caught on film. but with glory comes risk. and this challenge is no exception."
6241,Nine Inch Nails: Beside You In Time,"capturing the powerful intensity and artistry of nine inch nails' amazing live performances during the 2005-2006 “live: with teeth” tour, the beside you in time concert film showcases the band in peak form.  a visually stunning experience with an array of inventive and ingenious lighting designs that draws the viewer in while focusing the force of nin’s epic sound into visual form."
6242,Dear Zachary: A Letter to a Son About His Father,"in 2001, andrew bagby, a medical resident, is murdered not long after breaking up with his girlfriend. soon after, when she announces she's pregnant, one of andrew's many close friends, kurt kuenne, begins this film, a gift to the child."
6297,Nitro Circus 3,"nc3 is categorized as a freestyle motocross film. however, just like travis pastrana is much more than just a freestyle motocross star, the nitro circus series goes way beyond simply being a freestyle motocross film. it is a film about pushing the limits of human ability and spirit. sometimes this comes across as heroic and other times as sheer insanity."
6310,All My Friends Are Leaving Brisbane,"anthea is 25, single, hates her job – and all her friends are leaving brisbane. should she follow the herd to sydney or london? is there anything worth staying for now that her best friend michael finally has a girlfriend? this film tells a universal story about finding your place and yourself..."
6328,Love & Human Remains,"dreary urban landscape of an anonymous canadian city. dark comedy about a group of twentysomethings looking for love and meaning in the '90s. the film focuses on roommates david, a gay waiter who has has given up on his acting career, and candy, a book reviewer who is also david's ex-lover. david and candy's lives are entangled with those of david's friends and candy's dates."
6342,Hurricane on the Bayou,"the film ""hurricane on the bayou"" is about the wetlands of louisiana before and after hurricane katrina."
6501,Darkon,"darkon is an award-winning feature-length documentary film that follows the real-life adventures of the darkon wargaming club in baltimore, maryland, a group of fantasy live-action role-playing (larp) gamers."
6558,Tromeo & Juliet,"a modern, punk adaptation of shakespeare's classic. told irreverently, this film attempts to impact the viewer in the same way theatre-goers were effected in shakespeare's time. bawdy, violent, humorous, and romantic."
6583,13 Hours in a Warehouse,"as five underworld heavies settle in for an all night stay at an abandoned warehouse and former film studio, a series of bizarre and unsettling occurrences quickly lead them to believe they are not alone. it was supposed to be a simple night of babysitting a single hostage, but when a series of numbers began to appear on the walls things soon took a dark turn. later, after the hostage escapes, the perplexed thugs not only learn that there is a rat in the ranks, but also discover the unsettling nature of the films that were shot in the warehouse. now, as terror takes hold, the thieves are about to discover that they are being stalked from the shadows and that their odds of living to see daybreak are shrinking with each passing minute.written by jason buchanan, all movie guide"
6589,Jackass 3D,"jackass 3d is a 3-d film and the third movie of the jackass series. it follows the same premise as the first two movies, as well as the tv series. it is a compilation of various pranks, stunts and skits. before the movie begins, a brief introduction is made by beavis and butt-head explaining the 3d technology behind the movie. the intro features the cast lining up and then being attacked by various objects in slow-motion. the movie marks the 10th anniversary of the franchise, started in 2000."
6596,End of the Century: The Story of the Ramones,"a years-in-the-making documentary on the legendary punk band the ramones. through a mixture of archival footage, archival and new interviews with all members of the band's various lineups, and new interviews with a number of their contemporaries, the film traces the peaks and valleys the band experienced over the course of its 20-plus year career before disbanding in 1995."
6599,Sullivan's Travels,"successful movie director john l. sullivan, convinced he won't be able to film his ambitious masterpiece until he has suffered, dons a hobo disguise and sets off on a journey, aiming to ""know trouble"" first-hand. when all he finds is a train ride back to hollywood and a beautiful blonde companion, he redoubles his efforts, managing to land himself in more trouble than he bargained for when he loses his memory and ends up a prisoner on a chain gang."
6612,Hercules Returns,"when brad gets fired from his job, he goes to reopen an old cinema, he enlists his frends to help him show the last film the cinema aired before it closed... only they don't know, the film is in italian. with everyone sitting ready they begin to dub the movie... on the fly!"
6624,Vinyan,"six months after losing her only child in the southeast asia tsunami, jeanne is convinced she sees him in a film about orphans living in the jungles."
6625,Ararat,"a variety of characters, some close relatives, others distant strangers, are each affected by the making of a film about the armenian genocide of 1915."
6647,Pride,"in this uplifting film based on a true story, coach jim ellis (terrence howard) shocks the community and changes lives when, aided by a local janitor (bernie mac), he sets out to form philadelphia's first black swim team. but the odds are against them as they battle rigid rules, racism and more."
6668,Othello,the evil iago pretends to be friend of othello in order to manipulate him to serve his own end in the film version of this shakespeare classic.
6687,The Comedians of Comedy,"the comedians of comedy is an occasional stand-up comedy tour featuring patton oswalt, zach galifianakis, brian posehn and maria bamford that was documented in a 2005 film and 2005 comedy central television series of the same name, both directed by michael blieden."
6700,To Hell and Back,"the true wwii story of audie murphy, the most decorated soldier in u.s. history. based on the autobiography of audie murphy who stars as himself in the film."
6731,The Clown and His Dogs,short film of 300 individually painted images.
6741,El Cid,"epic film of the legendary spanish hero, rodrigo diaz (""el cid"" to his followers), who, without compromising his strict sense of honour, still succeeds in taking the initiative and driving the moors from spain."
6765,The Telling,"in this horror anthology film, three girls pledge the most popular - and cruelest - sorority on campus. for their final task, they must tell the scariest story they know. containing three distinct stories - one featuring a murderous doll, one a has-been actress and her run in with a film crew of the undead and, finally, a hunt-and-kill fright-fest."
6819,Truth In 24,"it's 24 hours of pure exhilaration, complete exhaustion, and it's not for the faint of heart or the ill-prepared. it is the legendary 24 hours of le mans. but before you win it, you have to master finishing it. this film chronicles the dedication, the determination and the spirit required to not just survive 3,000 grueling miles, but to be in a position to win one of the greatest races in history."
6852,The Obama Deception,"who obama works for, what lies he has told, and his real agenda. if you want to know the facts and cut through all the hype, this is the film for you."
6869,Mini Punjab,"the film pans not just through the various shades of an emotional drama, but all the spicy sprinklings of love, hate, comedy, action and tragedy. the sparkle of love at mini punjab has dimmed by the shadows of social evils, be it racial discrimination, hatred, revenge or jealousy. and the ditch between hearts of the people here seems to be only widening....."
6882,The Amateurs,sex sells in america and these guys know it. the amateurs follows a small town band of loveable losers who hit upon an idea that can make their dreams and fantasies come true. thinking they've found the road to riches and fame they decide to make the world's most innocent adult film. everyman's fantasy turns into a hilarious misadventure when they find they're in way over their heads.
6902,After Sex,"sex is a background to examine intimacy and vulnerability. looks at the complexity of modern day relationships told through eight separate couples. through dialogue and compromising situations, the film takes us from the beginning of a relationship to the aftermath of one, and examines every stage in between seeing humor within the drama, heartache and confusion of it all."
6910,Rush: A Show of Hands,"for a band with high standards, a perfect show is impossible, and an excellent show is rare. you hope that the norm is ""good"". to deliver a really exceptional, comfortable performance before a recording truck or film crew has been our unfulfilled dream of many years. always it seemed that as soon as the machines started rolling, we forgot how to play and our equipment forgot how to work.  but for these two nights, the gods smile.  and the film becomes not just a concert, but a symbol - for the band a scrapbook, an autobiography, an era frozen in glacial clarity. for the audience, it can be an enduring souvenir, and if it can't quite capture what it was like to be there, it is a way of seeing through many pairs of eyes, of shifting one's vantage-point around and above the players in a way no mortal could.  hands perform, and hands respond. hands gesture, and hands respond. a show of ears and eyes, a show of hearts and minds. a show of hands.  - neil peart"
6962,Why Did I Get Married?,"the film is about the difficulty of maintaining a solid relationship in modern times. eight married college friends plus one other non-friend (all of whom have achieved middle to upper class economic status) go to colorado for their annual week-long reunion, but the mood shifts when one couple's infidelity comes to light. secrets are revealed and each couple begins to question their own marriage"
6976,Wham! in China: Foreign Skies,"best known for their radio staples ""wake me up before you go-go"" and ""careless whisper,"" the seminal 80s pop group wham! (george michael and andrew ridgeley) shot wham! in china: foreign skies circa 1985. in the resulting film, the group performs 12 numbers, including the aforementioned hits, ""ray of sunshine,"" ""blue,"" and ""young guns (go for it!)""."
