id,title,synopsis
23,2001: A Space Odyssey,"humanity finds a mysterious object buried beneath the lunar surface and sets off to find its origins with the help of hal 9000, the world's most advanced super computer."
64,Charlie and the Chocolate Factory,"a young boy wins a tour through the most magnificent chocolate factory in the world, led by the world's most unusual candy maker."
147,King Kong,"adventurous filmmaker, carl denham, sets out to produce a motion picture unlike anything the world has seen before. alongside his leading lady ann darrow and his first mate jack driscoll, they arrive on an island and discover a legendary creature said to be neither beast nor man. denham captures the monster to displayed on broadway as kong, the eighth wonder of the world."
153,Willy Wonka & the Chocolate Factory,eccentric candy man willy wonka prompts a worldwide frenzy when he announces that golden tickets hidden inside five of his delicious candy bars will admit their lucky holders into his top-secret confectionary. but does wonka have an agenda hidden amid a world of oompa loompas and chocolate rivers?
209,Harold and Maude,the young harold lives in his own world of suicide-attempts and funeral visits to avoid the misery of his current family and home environment. harold meets an 80-year-old woman named maude who also lives in her own world yet one in which she is having the time of her life. when the two opposites meet they realize that their differences don’t matter and they become best friends and love each other.
235,The English Patient,"in the 1930s, count almásy is a hungarian map maker employed by the royal geographical society to chart the vast expanses of the sahara desert along with several other prominent explorers. as world war ii unfolds, almásy enters into a world of love, betrayal, and politics."
271,Being John Malkovich,"one day at work, unsuccessful puppeteer craig finds a portal into the head of actor john malkovich. the portal soon becomes a passion for anybody who enters its mad and controlling world of overtaking another human body."
319,Constantine,"john constantine has literally been to hell and back. when he teams up with a policewoman to solve the mysterious suicide of her twin sister, their investigation takes them through the world of demons and angels that exists beneath the landscape of contemporary los angeles."
322,The Mummy,dashing legionnaire rick o'connell stumbles upon the hidden ruins of hamunaptra while in the midst of a battle to claim the area in 1920s egypt. it has been over three thousand years since former high priest imhotep suffered a fate worse than death as a punishment for a forbidden love—along with a curse that guarantees eternal doom upon the world if he is ever awoken.
330,To Die For,"suzanne stone wants to be a world-famous news anchor and she is willing to do anything to get what she wants. what she lacks in intelligence, she makes up for in cold determination and diabolical wiles. as she pursues her goal with relentless focus, she is forced to destroy anything and anyone that may stand in her way, regardless of the ultimate cost or means necessary."
337,"Monsters, Inc.","james sullivan and mike wazowski are monsters, they earn their living scaring children and are the best in the business... even though they're more afraid of the children than they are of them. when a child accidentally enters their world, james and mike suddenly find that kids are not to be afraid of and they uncover a conspiracy that could threaten all children across the world."
367,The Ninth Gate,"an all-expenses-paid international search for a rare copy of the book, 'the nine gates of the kingdom  of shadows' brings an unscrupulous book dealer deep into a world of murder, double-dealing and satanic worship."
374,The Wizard of Oz,"young dorothy finds herself in a magical world where she makes friends with a lion, a scarecrow and a tin man as they make their way along the yellow brick road to talk with the wizard and ask for the things they miss most in their lives. the wicked witch of the west is the only thing that could stop them."
377,Bridget Jones's Diary,"a chaotic bridget jones meets a snobbish lawyer, and he soon enters her world of imperfections."
385,A.I. Artificial Intelligence,"david, a robotic boy—the first of his kind programmed to love—is adopted as a test case by a cybertronics employee and his wife. though he gradually becomes their child, a series of unexpected circumstances make this life impossible for david. without final acceptance by humans or machines, david embarks on a journey to discover where he truly belongs, uncovering a world in which the line between robot and machine is both vast and profoundly thin."
393,Goldfinger,"special agent 007 comes face to face with one of the most notorious villains of all time, and now he must outwit and outgun the powerful tycoon to prevent him from cashing in on a devious scheme to raid fort knox -- and obliterate the world's economy."
394,Thunderball,a criminal organization has obtained two nuclear bombs and are asking for a 100 million pound ransom in the form of diamonds in seven days or they will use the weapons. the secret service sends james bond to the bahamas to once again save the world.
436,Tomorrow Never Dies,a deranged media mogul is staging international incidents to pit the world's superpowers against each other. now james bond must take on this evil mastermind in an adrenaline-charged battle to end his reign of terror and prevent global pandemonium.
490,Austin Powers: The Spy Who Shagged Me,"when diabolical genius dr. evil travels back in time to steal superspy austin powers's ‘mojo,’ austin must return to the swingin' '60s himself - with the help of american agent, felicity shagwell - to stop the dastardly plan. once there, austin faces off against dr. evil's army of minions to try to save the world in his own unbelievably groovy way."
491,Austin Powers in Goldmember,"the world's most shagadelic spy continues his fight against dr. evil. this time, the diabolical doctor and his clone, mini-me, team up with a new foe—'70s kingpin goldmember. while pursuing the team of villains to stop them from world domination, austin gets help from his dad and an old girlfriend."
495,Moulin Rouge!,"a celebration of love and creative inspiration takes place in the infamous, gaudy and glamorous parisian nightclub, at the cusp of the 20th century. a young poet, who is plunged into the heady world of moulin rouge, begins a passionate affair with the club's most notorious and beautiful star."
548,Birdman of Alcatraz,"after killing a prison guard, convict robert stroud faces life imprisonment in solitary confinement. driven nearly mad by loneliness and despair, stroud's life gains new meaning when he happens upon a helpless baby sparrow in the exercise yard and nurses it back to health. despite having only a third grade education, stroud goes on to become a renowned ornithologist and achieves a greater sense of freedom and purpose behind bars than most people find in the outside world."
567,Dawn of the Dead,"a group of survivors take refuge in a shopping mall after the world is taken over by aggressive, flesh-eating zombies."
572,Godzilla,"french nuclear tests irradiate an iguana into a giant monster that viciously attacks freighter ships in the pacific ocean. a team of experts, including niko tatopoulos, conclude that the oversized reptile is the culprit. before long, the giant lizard is loose in manhattan as the us military races to destroy the monster before it reproduces and it's spawn takes over the world."
631,The Thirteenth Floor,"los angeles. a wealthy man, known as mr. fuller, discovers a shocking secret about the world he lives in. fearing for his life, he leaves a desperate message for a friend of his in the most unexpected place."
636,Catch a Fire,"the true story of anti-apartheid activists in south africa, and particularly the life of patrick chamusso, a timid foreman at secunda ctl, the largest synthetic fuel plant in the world. patrick is wrongly accused, imprisoned and tortured for an attempt to bomb the plant, with the injustice transforming the apolitical worker into a radicalised insurgent, who then carries out his own successful sabotage mission."
639,In My Father's Den,"paul (macfadyen), a prize-winning war journalist, returns to his remote new zealand hometown due to the death of his father, battle-scarred and world-weary. for the discontented sixteen-year-old celia (barclay) he opens up a world she has only dreamed of. she actively pursues a friendship with him, fascinated by his cynicism and experience of the world beyond her small-town existence. but many, including the members of both their families (otto, moy), frown upon the friendship and when celia goes missing, paul becomes the increasingly loathed and persecuted prime suspect in her disappearance. as the violent and urgent truth gradually emerges, paul is forced to confront the family tragedy and betrayal that he ran from as a youth, and to face the grievous consequences of silence and secrecy that has surrounded his entire adult life."
640,The Miracle Worker,"the true story of the frightening, lonely world of silence and darkness of 7-year-old helen keller who, since infancy, has never seen the sky, heard her mother's voice or expressed her innermost feelings. then annie sullivan, a 20-year-old teacher from boston, arrives. having just recently regained her own sight, the no-nonsense annie reaches out to helen through the power of touch, the only tool they have in common, and leads her bold pupil on a miraculous journey from fear and isolation to happiness and light."
641,The Miracle Worker,"devoted teacher anne sullivan leads deaf, blind and mute helen keller out of solitude and helps integrate her into the world."
645,The Remains of the Day,a rule bound head butler's world of manners and decorum in the household he maintains is tested by the arrival of a housekeeper who falls in love with him in post-wwi britain. the possibility of romance and his master's cultivation of ties with the nazi cause challenge his carefully maintained veneer of servitude.
661,300,"based on frank miller's graphic novel, ""300"" is very loosely based the 480 b.c. battle of thermopylae, where the king of sparta led his army against the advancing persians; the battle is said to have inspired all of greece to band together against the persians, and helped usher in the world's first democracy."
674,Rocky,"when world heavyweight boxing champion, apollo creed wants to give an unknown fighter a shot at the title as a publicity stunt, his handlers choose palooka rocky balboa, an uneducated collector for a philadelphia loan shark. rocky teams up with trainer  mickey goldmill to make the most of this once in a lifetime break."
679,Rocky III,"now the world champion, rocky balboa is living in luxury and only fighting opponents who pose no threat to him in the ring, until clubber lang challenges him to a bout. after taking a pounding from lang, the humbled champ turns to former bitter rival apollo creed for a rematch with lang."
688,The Fountain,"spanning over one thousand years, and three parallel stories, the fountain is a story of love, death, spirituality, and the fragility of our existence in this world."
709,Perfume: The Story of a Murderer,"jean-baptiste grenouille, born in the stench of 18th century paris, develops a superior olfactory sense, which he uses to create the world's finest perfumes. however, his work takes a dark turn as he tries to preserve scents in the search for the ultimate perfume."
720,Blood: The Last Vampire,"on the surface, saya is a stunning 16-year-old, but that youthful exterior hides the tormented soul of a 400-year-old ""halfling"". born to a human father and a vampire mother, she has for centuries been a loner obsessed with using her samurai skills to rid the world of vampires, all the while knowing that she herself can survive only on blood like those she hunts."
722,"Clean, Shaven","peter winter is a young schizophrenic who is desperately trying to get his daughter back from her adoptive family. he attempts to function in a world that, for him, is filled with strange voices, electrical noise, disconcerting images, and jarringly sudden emotional shifts. during his quest, he runs afoul of the law and an ongoing murder investigation."
731,1492: Conquest of Paradise,1492: conquest of paradise depicts christopher columbus’ discovery of the new world and his effect on the indigenous people.
753,Sweet Movie,"the winner of the miss world virginity contest marries, escapes from her masochistic husband and ends up involved in a world of debauchery."
761,Resident Evil,"when a virus leaks from a top-secret facility, turning all resident researchers into ravenous zombies and their lab animals into mutated hounds from hell, the government sends in an elite military task force to contain the outbreak. alice and rain are charged with leading the mission. but they only have three hours before the pathogen becomes airborne and infects the world."
803,The Net,"angela bennett is a freelance software engineer who lives in a world of computer technology. when a cyber friend asks bennett to debug a new game, she inadvertently becomes involved in a conspiracy that will soon turn her life upside down and make her the target of an assassination."
814,The Bridge,the bridge is a controversial documentary that shows people jumping to their death from the golden gate bridge in san francisco - the world's most popular suicide destination. interviews with the victims' loved ones describe their lives and mental health.
823,Escape from the Planet of the Apes,"the world is shocked by the appearance of three talking chimpanzees, who arrived mysteriously in a u.s. spacecraft. they become the toast of society—but one man believes them to be a threat to the human race."
824,Conquest of the Planet of the Apes,"in a futuristic world that has embraced ape slavery, caesar—the son of the late simians cornelius and zira—surfaces after almost twenty years of hiding out from the authorities, and prepares for a slave revolt against humanity."
833,Death Machine,"chaank armaments is experimenting with the ultimate fighting machine which is part human - part machine. so far, the hardman project has been unreliable and has killed a number of innocent people. the genius behind this project is jack who lives in a world of models, toys and magazines. when he is fired by cale for killing a few corporate officers, he unleashes the ultimate killing machine called the 'warbeast' against cale and those who would help her."
841,All the King's Men,the story of an idealist's rise to power in the world of louisiana politics and the corruption that leads to his ultimate downfall. based on the1946 pulitzer prize-winning novel written by robert penn warren.
851,Helen,"on the outside, helen has it all – a loving family and a successful career – but when her suppressed mental illness resurfaces, the world crumbles around her. crippled by depression, helen finds solace through her friendship with mathilda, a kindred spirit struggling with bipolar disorder."
867,Afterwards,"newly divorced lawyer nathan del amico is shaken up after he meets a doctor who claims that he can sense when select people are about to die. though he doesn't believe the doctor, events in nathan's life slowly make him think he's not long for this world."
906,World Trade Center,"after the terrorist attack on the world trade center on september 11, 2001, the building collapses over the rescue team from the port authority police department. will jimeno and his sergeant john mcloughlin are found alive trapped under the wreckage while the rescue teams fight to save them."
970,Lucky You,a professional poker player whose astounding luck at the table fails to translate into his lonesome love life attempts to win the world series of poker while simultaneously earning the affections of a beautiful las vegas singer.
978,Alexander,"alexander, the king of macedonia, leads his legions against the giant persian empire. after defeating the persians, he leads his army across the then known world, venturing farther than any westerner had ever gone, all the way to india."
1011,Hidalgo,"set in 1890, this is the story of a pony express courier who travels to arabia to compete with his horse, hidalgo, in a dangerous race for a massive contest prize, in an adventure that sends the pair around the world..."
1039,Cyberjack,"in the near future nassim, terrorist leader, storms computer company headquarters. his aim is deadly computer virus that could bring him world domination. nick, company janitor and ex-cop, will get in his way."
1053,Cutaway,"the successful undercover agent victor cooper is assigned for his ninth mission: to find how the loadings of drug is being brought to miami. he suspects that the drug is coming through the air and joins a team of sky diving, under the leadership of red line, a fanatic and considered the athlete number one in this sport in the world. due to his profile of winner, vic gets involved with the group and he ""disconnects"" from his position of infiltrated agent, ""connecting"" with the team."
1067,L.A. Story,"with the help of a talking freeway billboard, a ""wacky weatherman"" tries to win the heart of an english newspaper reporter, who is struggling to make sense of the strange world of early-90s los angeles."
1091,The Flickering Flame,"documentary following dockers of liverpool sacked in a labour dispute and their supporters’ group, women of the waterfront, as they receive support from around the world and seek solidarity at the tuc conference."
1101,Voyage to the Bottom of the Sea,the crew of an atomic submarine battle to save the world from global destruction.
1111,The Glass House,"after the parents of ruby and her younger brother, rhett, are killed in a car crash, their parents' best friends, erin and terry glass, become their guardians. the children hear promises of a world of opulence and california fun -- all they have to do is move into the glasses' gated house. before very long, though, ruby suspects that erin and terry may not be the ideal guardians they seemed to be."
1112,Tenacious D in The Pick of Destiny,"in venice beach, naive midwesterner jb bonds with local slacker kg and they form the rock band tenacious d. setting out to become the world's greatest band is no easy feat, so they set out to steal what could be the answer to their prayers... a magical guitar pick housed in a rock-and-roll museum some 300 miles away."
1139,The Last Mimzy,"two siblings begin to develop special talents after they find a mysterious box of toys, and soon their parents and even their teacher are drawn into a strange new world – and find a task ahead of them that is far more important than any of them could imagine."
1146,Mr. Magorium's Wonder Emporium,"molly mahoney is the awkward and insecure manager of mr. magorium's wonder emporium—the strangest, most fantastic and most wonderful toy store in the world. after mr. magorium bequeaths the store to her, a dark and ominous change begins to take over the once-remarkable emporium."
1168,The Dust Factory,"ryan is a teenager who lacks the ability to speak. one day, ryan falls off a bridge and he finds himself transported to a strange fantasy world where he encounters his grandpa randolph (armin mueller-stahl) and a pretty girl named melanie (hayden panettiere); together, ryan and melanie learn to help one another with their problems, and they both discover the wisdom they can gain from elders like grandpa randolph."
1171,Sneakers,"when shadowy u.s. intelligence agents blackmail a reformed computer hacker and his eccentric team of security experts into stealing a code-breaking 'black box' from a soviet-funded genius, they uncover a bigger conspiracy. now, he and his 'sneakers' must save themselves and the world economy by retrieving the box from their blackmailers."
1173,Local Color,"a successful artist looks back with loving memories on the summer of his defining year, 1974. a talented but troubled 18-year-old aspiring artist befriends a brilliant elderly alcoholic painter who has turned his back on not only art but life. the two form what appears to be at first a tenuous relationship. the kid wants to learn all the secrets the master has locked away inside his head and heart. time has not been kind to the old master. his life appears pointless to him until the kid rekindles his interest in his work and ultimately gives him the will to live. together, they give one another a priceless gift. the kid learns to see the world through the master's eyes. and the master learns to see life through the eyes of innocence again. this story is based on a real life experience."
1198,The Bourne Identity,"wounded to the brink of death and suffering from amnesia, jason bourne is rescued at sea by a fisherman. with nothing to go on but a swiss bank account number, he starts to reconstruct his life, but finds that many people he encounters want him dead. however, bourne realizes that he has the combat and mental skills of a world-class spy—but who does he work for?"
1228,The Mothman Prophecies,reporter john klein is plunged into a world of impossible terror and unthinkable chaos when fate draws him to a sleepy west virginia town whose residents are being visited by a great winged shape that sows hideous nightmares and fevered visions.
1236,Pleasantville,"geeky teenager david and his popular twin sister, jennifer, get sucked into the black-and-white world of a 1950s tv sitcom called ""pleasantville,"" and find a world where everything is peachy keen all the time. but when jennifer's modern attitude disrupts pleasantville's peaceful but boring routine, she literally brings color into its life."
1237,Batman,the dynamic duo faces four super-villains who plan to hold the world for ransom with the help of a secret invention that instantly dehydrates people.
1247,Evan Almighty,"junior congressman evan baxter, whose wish is to ""change the world"" is heard by none other than god. when god appears with the perplexing request to build an ark, evan is sure he is losing it."
1261,The Abyss,"a civilian oil rig crew is recruited to conduct a search and rescue effort when a nuclear submarine mysteriously sinks. one diver soon finds himself on a spectacular odyssey 25,000 feet below the ocean's surface where he confronts a mysterious force that has the power to change the world or destroy it."
1291,Around the World in Eighty Days,"based on the famous book by jules verne the movie follows phileas fogg on his journey around the world. which has to be completed within 80 days, a very short period for those days."
1320,The Lost World,"arthur conan doyle's ""lost world"" performed live as a filmed audio drama."
1352,Doctor Dolittle,"a successful physician and devoted family man, john dolittle seems to have the world by the tail, until a long suppressed talent he possessed as a child, the ability to communicate with animals is suddenly reawakened with a vengeance! now every creature within squawking distance wants the good doctor's advice, unleashing an outrageous chain of events that turns his world upside down!"
1356,The Wrecking Crew,"when count contini attempts to destroy the world's economy by masterminding the theft of $1 billion in u.s. gold, ice chief macdonald summons secret agent matt helm to stop him."
1367,Frankenstein,"a scientist obsessed with creating life steals body parts to put together his ""creation."" released as a feature on video, this was originally shown on in two installments on tv as part of the wide world of entertainment series."
1392,"The Tulse Luper Suitcases, Part 1: The Moab Story","the tulse luper suitcases reconstructs the life of tulse luper, a professional writer and project-maker, caught up in a life of prisons. he was born in 1911 in newport, south wales and presumably last heard of in 1989. his life is reconstructed from the evidence of 92 suitcases found around the world - 92 being the atomic number of the element uranium. the project includes three feature films, a tv series, 92 dvds, cd-roms, and books."
1393,"The Tulse Luper Suitcases, Part 2: Vaux to the Sea","the tulse luper suitcases reconstructs the life of tulse luper, a professional writer and project-maker, caught up in a life of prisons. he was born in 1911 in newport, south wales and presumably last heard of in 1989. his life is reconstructed from the evidence of 92 suitcases found around the world - 92 being the atomic number of the element uranium. the project includes three feature films, a tv series, 92 dvds, cd-roms, and books."
1394,"The Tulse Luper Suitcases, Part 3: From Sark to the Finish","the tulse luper suitcases reconstructs the life of tulse luper, a professional writer and project-maker, caught up in a life of prisons. he was born in 1911 in newport, south wales and presumably last heard of in 1989. his life is reconstructed from the evidence of 92 suitcases found around the world - 92 being the atomic number of the element uranium. the project includes three feature films, a tv series, 92 dvds, cd-roms, and books."
1433,Barcode,a play of light and shadow in a virtual world.
1452,Pirates of Silicon Valley,"the story about the men who made the world of technology what it is today, their struggles during college, the founding of their companies, and the ingenious actions they took to build up the global corporate empires of apple computer inc. and microsoft corporation."
1460,The Yes Men,"a comic, biting and revelatory documentary following a small group of prankster activists as they gain worldwide notoriety for impersonating the world trade organization (wto) on television and at business conferences around the world."
