id,title,synopsis4434,Look Who's Talking Now!,"When Samantha LeBon hatches a scheme to spend a romantic Christmas with her new employee -- the unsuspecting, blithesome James -- his wife, their kids and their two dogs, Rocks and Daphne, must rescue him before he makes a terrible mistake."
4455,Body of Lies,"The CIA’s hunt is on for the mastermind of a wave of terrorist attacks. Roger Ferris is the agency’s man on the ground, moving from place to place, scrambling to stay ahead of ever-shifting events. An eye in the sky – a satellite link – watches Ferris.  At the other end of that real-time link is the CIA’s Ed Hoffman, strategizing events from thousands of miles away. And as Ferris nears the target, he discovers trust can be just as dangerous as it is necessary for survival."
4461,Village of the Damned,"An American village is visited by some unknown life form which leaves the women of the village pregnant. Nine months later, the babies are born, and they all look normal, but it doesn't take the ""parents"" long to realize that the kids are not human or humane."
4465,Step Brothers,"Brennan Huff and Dale Doback might be grown men. But that doesn't stop them from living at home and turning into jealous, competitive stepbrothers when their single parents marry. Brennan's constant competition with Dale strains his mom's marriage to Dale's dad, leaving everyone to wonder whether they'll ever see eye to eye."
4477,3 Men and a Baby,Three bachelors find themselves forced to take care of a baby left by one of the guy's girlfriends.
4497,The Wendell Baker Story,Luke Wilson plays a good-hearted ex-con who gets a job in a retirement hotel. Three elderly residents help him win back his girlfriend as he lends them a hand in fighting hotel corruption.
4503,Four Christmases,"Brad and Kate have made something of an art form out of avoiding their families during the holidays, but this year their foolproof plan is about go bust -- big time. Stuck at the city airport after all departing flights are canceled, the couple is embarrassed to see their ruse exposed to the world by an overzealous television reporter. Now, Brad and Kate are left with precious little choice other than to swallow their pride and suffer the rounds."
4510,The Story of Us,Ben and Katie Jordan are a married couple who go through hard times in fifteen years of marriage.
4565,Vegas: Based on a True Story,"The film takes place away from the glittering strip of mega casinos, but the greed of Sin City is just as pervasive on the desert outskirts. This is where a happy family learns of a forgotten fortune that may be buried beneath their home. Their lives are turned upside down. A sophisticated study of just how far people are able and willing to go if faced with the tempting prospect of easily acquired wealth."
4570,Harry Potter and the Deathly Hallows: Part 2,"Harry, Ron and Hermione continue their quest to vanquish the evil Voldemort once and for all. Just as things begin to look hopeless for the young wizards, Harry discovers a trio of magical objects that endow him with powers to rival Voldemort's formidable skills."
4576,In the Army Now,"Bones Conway and Jack Kaufman didn't really know what they were in for when they enlisted in the U.S. Army; they just wanted to get a job and make some money. But these new recruits are so hapless, they run the risk of getting kicked out before their military careers even begin. Soon, though, they're sent to the Middle East to fight for their country -- which they manage to do in their own wacky ways."
4588,Fathers' Day,"Smart aleck lawyer, Jack Lawrence is one day visited by an ex-girlfriend who tells him her child is his. Enter Dale Putley. A depressed goofball who is also a writer, Dale meets with the same ex-girlfriend who also tells him her child is his. One day Jack and Dale meet and discover they've been told the same story—and there is now a question of who the real father is. They learn their son is following a rock band around Sacramento, so Jack and Dale must use teamwork to find him—and then find out which one of them is the real father."
4603,Critters 4,"Just before bounty hunter Charile triggers his gun to destroy the last two Critter-eggs, he gets a message that it would be illegal to extinguish the race from the galaxy. He's sent a transporter where he puts the eggs - unfortunately the transporter takes him with it and then gets lost in space."
4609,Home Alone 4,"Kevin McCallister's parents have split up. Now living with his mom, he decides to spend Christmas with his dad at the mansion of his father's rich girlfriend, Natalie. Meanwhile robber Marv Merchants, one of the villains from the first two movies, partners up with a new criminal named Vera to hit Natalie's mansion."
4625,A Serious Man,"It is 1967, and Larry Gopnik, a physics professor at a quiet Midwestern university, has just been informed by his wife Judith that she is leaving him. She has fallen in love with one of his more pompous acquaintances Sy Ableman."
4636,Santa's Slay,"Santa Claus is actually a demon who lost a bet with an angel, so he became the giver of toys and happiness. But this year the bet is off, and Santa is about to return to his evil ways."
4644,Freeze Frame,"Sean Veil is an ultra paranoid murder suspect who takes to filming himself round the clock to provide an alibi, just in case he's ever accused of another crime. Problems arise however when the police do come calling and the one tape that can prove his innocence has mysteriously disappeared."
4669,Viol@,"Viola is a girl who has just cut off a love affair and lives alone with her dog. One day he decides to browse the world of erotic chats and meets the mysterious Mittler, who begins to advance more and more audacious requests, until they decide to discover their respective identities."
4702,She's Having a Baby,"Jake and Kristy Briggs are newlyweds. Being young, they are perhaps a bit unprepared for the full reality of marriage and all that it (and their parents) expect from them. Do they want babies? Their parents certainly want them to. Is married life all that there is? Things certainly aren't helped by Jake's friend Davis, who always seems to turn up just in time to put a spanner in the works."
4739,Everybody Wants to Be Italian,"Are all relationships based on lies? Jake Bianski runs a fish market in north Boston, surrounded by Italians. For years, he's carried a torch for Isabella, an ex-girlfriend now married with three children and no interest in Jake. Yet, he tells everyone she's his girlfriend, including Marisa, a veterinarian his employees set him up with at the Italian singles club. She's interested in him until he tells her about his girlfriend, then he's persistent in asking her to be his friend. As the friendship bumps along, Jake realizes that reality may be better than fantasy, but what if Isabella changes her mind about Jake, and what if it comes out that Marisa, like Jake, isn't Italian?"
4759,Can't Buy Me Love,"Nerdy high schooler Ronald Miller rescues cheerleader Cindy Mancini from parental punishment after she accidentally destroys her mother's designer clothes. Ronald agrees to pay for the $1,000 outfit on one condition: that she will act as though they're a couple for an entire month. As the days pass, however, Cindy grows fond of Ronald, making him popular. But when Ronald's former best friend gets left behind, he realizes that social success isn't everything."
4781,Young People Fucking,"On a Tuesday night, five couples have separate sexual adventures. Matt and Kris, friends for years, want to have an only-once, no-strings good time. Abby and Andrew, married, celebrate his birthday, but it's marred by angst and miscommunication. Mia and Eric are exes, making sure they are over each other. Jaime and Ken work together and this is a first date. Inez and Gord invite his roommate, Dave, to join them. By the time each couple has gone through a prelude, foreplay, sex, an interlude, orgasm, and afterglow, they've answered basic questions: can sex be anonymous, are we bored, is our marriage really finished, does anyone tell the truth, and how do we make someone happy?"
4791,The Price to Pay,"Jean-Pierre, a wealthy businessman, is lonely. He still desires his wife but she only seems interested in shopping and the beauty salon. Tired of lunching alone every day, one day he decides to invite his chauffeur to join him, and a relationship quickly develops as the two find they have much in common. Are they just cash machines for their wives? Don't they deserve some love (i.e. sex) in return? Jean-Pierre confiscates his wife's credit card, but things don't turn out exactly the way he'd hoped..."
4804,Your Friend the Rat,"Let's face it, rats are not the most beloved creatures on earth. However, maybe this little tale about the history of human and rat interaction will change the world's tune. At least that is the hope of Remy, the star of Ratatouille, and his reluctant brother Emile as they guide us through world history from a rat's perspective. Why can't we all just get along?"
4837,Mr. Mom,"Jack and Caroline are a couple making a decent living When Jack suddenly loses his job. They agree that he should stay at home and look after the house while Caroline works. It's just that he's never done it before, and really doesn't have a clue..."
4872,Scooby-Doo on Zombie Island,"The Mystery Gang reunite and visit Moonscar Island, a remote island with a dark secret. Daphne wants more than just a villain in a costume, and they get more than they ever expected."
4902,A Charlie Brown Christmas,"When Charlie Brown complains about the overwhelming materialism that he sees amongst everyone during the Christmas season, Lucy suggests that he become director of the school Christmas pageant. Charlie Brown accepts, but is a frustrating struggle. When an attempt to restore the proper spirit with a forlorn little fir Christmas tree fails, he needs Linus' help to learn the meaning of Christmas."
4903,Scrooge,"Ebenezer Scrooge malcontentedly shuffles through life as a cruel miserly businessman until one fateful Christmas Eve when he is visited by three spirits, sent show him how his unhappy childhood and maladaptive adult behavior over has let him a selfish, lonely, bitter old man."
4904,A Christmas Carol,An old bitter miser who makes excuses for his uncaring nature learns real compassion when three ghosts visit him on Christmas Eve.
4913,Wristcutters: A Love Story,"Zia, distraught over breaking up with his girlfriend, decides to end it all. Unfortunately, he discovers that there is no real ending, only a run-down afterlife that is strikingly similar to his old one, just a bit worse. Discovering that his ex-girlfriend has also ""offed"" herself, he sets out on a road trip, with his Russian rocker friend, to find her. Their journey takes them through an absurd purgatory where they discover that being dead doesn't mean you have to stop livin'!"
4934,A Garfield Christmas Special,"Garfield, Jon and Odie go to Jon's family farm for Christmas, where Garfield finds a present for Grandma."
4935,A Muppet Family Christmas,"In this one-hour Christmas special, Fozzie Bear surprises his mother Emily on Christmas Eve by bringing the entire Muppet gang to her farm to celebrate the holidays. Doc and his dog Sprocket, who had planned a quiet Christmas, end up joining the Muppets in their holiday activities and preparations.The Sesame Street regulars, including Big Bird, Bert, Ernie and others, join the festivities, but to Kermit's dismay, the only one missing is Miss Piggy, who has been caught in a snowstorm."
4936,"Bah, Humduck!: A Looney Tunes Christmas","In this adaptation of Charles Dickens' A Christmas Carol, Daffy Duck is the greedy proprietor of the Lucky Duck Mega-Mart and all he can think about is the money to be made during the holiday season."
4952,Lakeview Terrace,"A young interracial couple has just moved into their California dream home when they become the target of their next-door neighbor, who disapproves of their relationship. A tightly wound LAPD officer has appointed himself the watchdog of the neighborhood. His nightly foot patrols and overly watchful eyes bring comfort to some, but he becomes increasingly aggressive to the newlyweds. These persistent intrusions into their lives cause the couple to fight back."
4962,Beauty and the Beast: The Enchanted Christmas,"Astonished to find the Beast has a deep-seeded hatred for the Christmas season, Belle endeavors to change his mind on the matter."
4967,Sione's Wedding,"Meet best friends Michael, Albert, Stanley and Sefa; the ladies' man, the good boy, the weird one and the party boy. They're staring down the barrel of their thirtieth birthdays, but still act as if they're sixteen; they get drunk, they chase the wrong women and they have a remarkable record of misbehaving and causing chaos at every wedding they attend. But now Michael's younger brother Sione is getting married, and everything is about to change. Sione is their boy, the kid they used to look after, who grew up while they were still partying. And to ensure his big day isn't spoiled by his boys and their idiot antics, Sione has issued an ultimatum; the guys all have to bring dates to the wedding. And not just any dates; real girlfriends, someone they've made a commitment to. They have one month. So just how hard can it be to get a date for your best boy's wedding?"
4977,It's a Very Merry Muppet Christmas Movie,"The owner of a bank (Miss Bitterman) wants to own the Muppet Theatre so she can build a nightclub over it. After she tricks Pepe into giving her the only copy of the contract between her father and the Muppets, she changes it so the Muppets have very little time to pay a debt they owe. Meanwhile, the Muppets are trying to put on a Christmas show. After the Muppets are confronted by Bitterman, they make a lot of sacrifices to save up so they can keep the Theatre."
4982,A Dennis the Menace Christmas,"A Dennis The Menace version of A Christmas Carol where Mr. Wilson plays his own version of Scrooge. While Dennis has problems of his own with the neighborhood bully, he does his best to try and give Mr. Wilson the Christmas Spirit. Dennis causes his usual damage and Mr. Wilson ends up breaking Dennis' spirit. An Angel of Christmas Past Present and Future steps in to help save Christmas for the Mitchells, the Wilsons, and everyone else."
4998,How the Grinch Stole Christmas!,"Bitter and hateful, the Grinch is irritated at the thought of a nearby village having a happy time celebrating Christmas. Disguised as Santa Claus, with his dog made to look like a reindeer, he decides to raid the village to steal all the Christmas things."
4999,Mickey's Twice Upon a Christmas,"Santa Claus, Mickey Mouse and all his Disney pals star in an original movie about the importance of opening your heart to the true spirit of Christmas. Stubborn old Donald tries in vain to resist the joys of the season, and Mickey and Pluto learn a great lesson about the power of friendship."
5000,"Olive, the Other Reindeer","After mis-hearing a radio broadcast about Santa canceling his Christmas trip due to an injured reindeer, Olive the dog decides to travel to the North Pole and volunteer to be a replacement. Unfortunately, Olive must deal with an evil postman who's tired of handling all the extra Christmas mail. Will Martini the penguin be able to help Olive realize her dream?"
5002,Rudolph the Red-Nosed Reindeer,"Sam the snowman tells us the story of a young red-nosed reindeer who, after being ousted from the reindeer games because of his glowing nose, teams up with Hermey, an elf who wants to be a dentist, and Yukon Cornelius, the prospector. They run into the Abominable Snowman and find a whole island of misfit toys. Rudoph vows to see if he can get Santa to help the toys, and he goes back to the North Pole on Christmas Eve. But Santa's sleigh is fogged in. But when Santa looks over Rudolph, he gets a very bright idea..."
5008,Shrek the Halls,"The Christmas tree isn't the only thing green in this new holiday classic. Shrek is back and trying to get into the spirit of the season. After promising Fiona and the kids a Christmas they'll remember, he is forced to take a crash course in the holiday. But just when he thinks he has everything for their quiet family Christmas just right, there is a knock at the door."
5009,The Snowman,"A young boy makes a snowman one Christmas Eve, which comes to life at midnight and takes the boy on a magical adventure to the North Pole to meet Santa Claus."
5010,The Year Without a Santa Claus,"Feeling forgotten by the children of the world, old St. Nick decides to skip his gift-giving journey and take a vacation. Mrs. Claus and two spunky little elves, Jingle and Jangle, set out to see to where all the season's cheer has disappeared. Aided by a magical snowfall, they reawaken the spirit of Christmas in children's hearts and put Santa back in action."
5011,Robbie the Reindeer: Hooves of Fire,"Robbie the Reindeer (voiced by Ardal O'Hanlon) arrives at the North Pole, ready to take his place as navigator on Santa's Christmas sleigh team. However, Robbie is soon plagued by doubt regarding his ability, and sets out to regain his self-respect and the admiration of his team-mates. This festive animated tale also features the voices of Jane Horrocks, Steve Coogan, Caroline Quentin and Harry Enfield, and features a script co-written by 'Blackadder' writer Richard Curtis."
5012,Santa Claus Is Comin' to Town,"A postman, S.D. Kluger, decides to answer some of the most common questions about Santa Claus, and tells us about a small baby named Kris who is raised by a family of elf toymakers named Kringle. When Kris grew up, he wanted to deliver toys to the children of Sombertown. But its Mayor is too mean to let that happen. And to make things worse, the Winter Warlock who lives between the Kringles and Sombertown, but Kris manages to melt the Warlock's heart and deliver his toys."
5034,Roger Dodger,"A smooth-talking ad executive attributes his remarkable success with women to his ability to manipulate their emotions from the moment he first meets them. When his teenage nephew drops in for a visit, he soon learns that his approach isn't as foolproof as he thought when he attempts to teach the boy how to pick up women."
5046,Barbie in 'A Christmas Carol',"On Christmas Eve, Kelly is reluctant to go to a Christmas Eve ball, so Barbie tells her the story of Eden Starling, a glamourous singing diva in the Victorian England and the owner of a theatre house. However, Eden is self-centred and loves only herself. She is frequently accompanied by her snooty cat, Chuzzlewit. She does not believe in Christmas and orders all her employees to work on Christmas."
5051,Bury My Heart at Wounded Knee,"Beginning just after the bloody Sioux victory over General Custer at Little Big Horn, the story is told through two unique perspectives: Charles Eastman, a young, white-educated Sioux doctor held up as living proof of the alleged success of assimilation, and Sitting Bull the proud Lakota chief whose tribe won the American Indians’ last major victory at Little Big Horn."
5053,P2,"Angela, a corporate climber, gets stuck working late on Christmas Eve and finds herself the target of an unhinged security guard. With no help in sight, the woman must overcome physical and psychological challenges to survive."
5057,A Charlie Brown Thanksgiving,"Turkey, cranberries, pumpkin pie... and the Peanuts gang to share them with. This is going to be the greatest Thanksgiving ever! The fun begins when Peppermint Patty invites herself and her pals to Charlie Brown's house for a REALLY big turkey party. Good grief! All our hero can cook is cold cereal and maybe toast. Is Charlie Brown doomed? Not when Linus, Snoopy and Woodstock chip in to save the (Thanksgiving) Day. With such good friends, Charlie Brown - and all of us - have so many reasons to be thankful."
5065,Lost Boys: The Tribe,"The sequel to the 1987 cult hit The Lost Boys takes us to the shady surf city of Luna Bay, California, where vampires quickly dispatch anyone who crosses their path. Into this dark world arrive Chris Emerson (Hilgenbrink) and his younger sister, Nicole (Reeser). Having just lost their parents in a car accident, the siblings move in with their eccentric Aunt Jillian and become new prey..."
5078,Eden Lake,"Eden Lake is a relentlessly tense and immaculately paced horror-thriller about modern youth gone wild. When a young couple goes to a remote wooded lake for a romantic getaway, their quiet weekend is shattered by an aggressive group of local kids. Rowdiness quickly turns to rage as the teens terrorize the couple in unimaginable ways, and a weekend outing becomes a bloody battle for survival."
5112,H.H. Holmes: America's First Serial Killer,"Torture chambers, acid vats, greased chutes and gassing rooms were just some of the devices of death designed by the Torture Doctor, H.H. Holmes in his castle of horrors. Follows Holmes' entire life as a criminal mastermind."
5144,Labyrinth,"When teen Sarah is forced to babysit Toby, her baby stepbrother, she summons Jareth the Goblin King to take him away. When he is actually kidnapped, Sarah is given just thirteen hours to solve a labyrinth and rescue him."
5171,101 Dalmatians II: Patch's London Adventure,"Being one of 101 takes its toll on Patch, who doesn't feel unique. When he's accidentally left behind on moving day, he meets his idol, Thunderbolt, who enlists him on a publicity campaign."
5172,Camp Rock,"When Mitchie gets a chance to attend Camp Rock, her life takes an unpredictable twist, and she learns just how important it is to be true to yourself."
5174,Annabelle's Wish,"Annabelle - a calf who has a special wish for Christmas - wants to be a reindeer and help Santa Claus drive his sleigh as he delivers his presents! Annabelle's friends tell her not to get her hopes up, but to everyone's surprise, Santa does indeed meet up with Annabelle, and the calf gets to help Santa make the holiday special for one young boy."
5178,Catch and Release,"Gray Wheeler just lost everything. But it could be the best thing that ever happened to her. After the death of her fiancé, Gray moves in with her late love's best friends. While Sam and Dennis do their best to cheer Gray up, Fritz doesn't seem to care. Once Gray breaks through Fritz's defenses, however, she finally sees why her fiancé thought so highly of him. As they spend more time together, Gray learns that her chances for love have not died out with her fiancé. But when some surprise guests show up on their doorstep, it'll take the love of all of her new friends to help Gray learn that life may be messy, but love is messier."
5179,Christmas in Connecticut,"Journalist Elizabeth Lane is one of the country's most famous food writers. In her columns, she describes herself as a hard working farm woman, taking care of her children, and being an excellent cook. But this is all lies. In reality, she is an unmarried New Yorker who can't even boil an egg. The recipes come from her good friend Felix. The owner of the magazine she works for has decided that a heroic sailor will spend his Christmas on *her* farm. Miss Lane knows that her career is over if the truth comes out, but what can she do?"
5182,Christmas with the Kranks,"Luther Krank is fed up with the commerciality of Christmas; he decides to skip the holiday and go on a vacation with his wife instead. But when his daughter decides at the last minute to come home, he must put together a holiday celebration."
5187,Pooh's Heffalump Movie,"Who or what exactly is a Heffalump? The lovable residents of the Hundred Acre Wood -- Winnie the Pooh, Rabbit, Tigger, Eeyore, Kanga and the rest of the pack -- embark on a journey of discovery in search of the elusive Heffalump. But as is always the case, this unusual road trip opens their eyes to so much more than just the creature they're seeking."
5204,Less than Zero,"A college freshman returns to Los Angeles for Christmas at his ex-girlfriend's request, but discovers that his former best friend has an out-of-control drug habit."
5206,The Christmas Star,"Horace McNickle (Edward Asner) is a two-time felon serving prison time for counterfeiting. On the week before Christmas, he escapes from prison dressed as Santa Claus due to his uncanny resemblence to St. Nick resulting from his long white beard and heavyset features. McNickle hides out from the police in a nearby suburban neighborhood where he is befriended and helped by two local children who think he is the real Santa Claus. McNickle takes advantage of the kids naive ness to help him get his counterfeit money hidden somewhere in a local department store while he develops kind-hearted feelings for his two con victims that make him slowly understand the true nature of Christmas."
5207,Winnie the Pooh: A Very Merry Pooh Year,It's Christmastime in the Hundred Acre Wood and all of the gang is getting ready with presents and decorations. The gang makes a list of what they want for Christmas and send it to Santa Claus - except that Pooh forgot to ask for something. So he heads out to retrieve the letter and get it to Santa by Christmas...which happens to be tomorrow!
