id,title,synopsis3202,Mona Lisa,"George is a small-time crook just out of prison who discovers his tough-guy image is out of date. Reduced to working as a minder/driver for high class call girl Simone, he has to agree when she asks him to find a young colleague from her King's Cross days. That's when George's troubles just start."
3284,13 Going on 30,"After total humiliation at her thirteenth birthday party, Jenna Rink wants to just hide until she's thirty. With a little magic, her wish is granted, but it turns out that being thirty isn't as always as awesome as she thought it would be!"
3308,Talk Radio,"A rude, contemptuous talk show host becomes overwhelmed by the hatred that surrounds his program just before it goes national."
3321,Bad Santa,A miserable conman and his partner pose as Santa and his Little Helper to rob department stores on Christmas Eve. But they run into problems when the conman befriends a troubled kid.
3337,Cadillac Man,"Joe's a car salesman with a problem—he has two days to sell 12 cars or he loses his job. This would be a difficult task at the best of times but Joe has to contend with his girlfriends (he's two-timing), a missing teenage daughter and an ex-wife."
3344,Are We Done Yet?,Newlyweds Nick and Suzanne decide to move to the suburbs to provide a better life for their two kids. But their idea of a dream home is disturbed by a contractor with a bizarre approach to business.
3345,Marked for Death,"Just retired from the Drug Enforcement Agency, John Hatcher returns to his hometown and quickly discovers that drugs have infiltrated his old neighborhood. Determined to drive the dealers out, Hatcher crosses paths with a ferocious Jamaican drug lord who vows that Hatcher and his family are now marked for death."
3352,He's Just Not That Into You,"Remember that really cute girl/guy who said they'd call – and didn't? Maybe they lost your number. Maybe they're in the hospital. Maybe they're awed by your looks, brains or success. Or maybe... They're just not that into you."
3379,Son of the Mask,"Tim Avery, an aspiring cartoonist, finds himself in a predicament when his dog stumbles upon the mask of Loki. Then after conceiving an infant son ""born of the mask"", he discovers just how looney child raising can be."
3381,Species II,"Having just returned from a mission to Mars, Commander Ross isn't exactly himself. He's slowly becoming a terrifying alien entity with one goal -- to procreate with human women! When countless women suffer gruesome deaths after bearing half-alien offspring, scientist Laura Baker and hired assassin Press Lennox use Eve, a more tempered alien clone, to find Ross and his brood. Before long Eve escapes to mate with Ross."
3402,The Madagascar Penguins in a Christmas Caper,"During the holiday season, when the animals of the Central Park Zoo are preparing for Christmas, Private, the youngest of the penguins notices that the Polar Bear is all alone. Assured that nobody should have to spend Christmas alone, Private goes into the city for some last-minute Christmas shopping. Along the way, he gets stuffed into a stocking"
3420,The Football Factory,"The Football Factory is more than just a study of the English obsession with football violence, it's about men looking for armies to join, wars to fight and places to belong. A forgotten culture of Anglo Saxon males fed up with being told they're not good enough and using their fists as a drug they describe as being more potent than sex and drugs put together."
3423,The Jewel of the Nile,"Joan Wilder is thrust back into a world of murder, chases, foreign intrigue... and love. This time out she's duped by a duplicitous Arab dignitary who brings her to the Middle East, ostensibly to write a book about his life. Of course he's up to no good, and Joan is just another pawn in his wicked game. But Jack Colton and his sidekick Ralph show up to help our intrepid heroine save the day."
3427,Patch Adams,"The true story of Dr. Hunter ""Patch"" Adams, who in the 1970s found that humor is the best medicine, and was willing to do just anything to make his patients laugh—even if it meant risking his own career."
3437,Forever Young,A 1939 test pilot asks his best friend to use him as a guinea pig for a cryogenics experiment. Daniel McCormick wants to be frozen for a year so that he doesn't have to watch his love lying in a coma. The next thing Daniel knows is that he's been awoken in 1992.
3471,My Cousin Vinny,"Two carefree pals traveling through Alabama are mistakenly arrested, and charged with murder. Fortunately, one of them has a cousin who's a lawyer - Vincent Gambini, a former auto mechanic from Brooklyn who just passed his bar exam after his sixth try. When he arrives with his leather-clad girlfriend , to try his first case, it's a real shock - for him and the Deep South!"
3483,The Replacements,"Maverick old-guard coach Jimmy McGinty is hired in the wake of a players' strike to help the Washington Sentinels advance to the playoffs. But that impossible dream hinges on whether his replacements can hunker down and do the job. So, McGinty dusts off his secret dossier of ex-players who never got a chance (or screwed up the one they were given) and knits together a bad-dream team of guys who just may give the Sentinels their title shot."
3494,Housesitter,"After building his dream house, architect Newton Davis proposes marriage to his girlfriend, only to be summarily rejected. He seeks solace in a one-night stand with a waitress, never imagining that a woman he slept with once would end up posing as his wife. Gwen's ruse is so effective that by the time Newton learns of his ""marriage,"" the entire town feels like they know him."
3497,The Distinguished Gentleman,"A Florida con man uses the passing of the long time Congressman from his district who he just happens to share a name with, to get elected to his version of paradise, Congress, where the money flows from lobbyists. But soon he learns the nature of the game and decides to fight back the only way he knows how, with a con."
3506,Friday After Next,"Craig and his cousin Day Day have finally moved out of their parents' houses and into their own crib, working nights at a local mall as security guards. When their house is robbed on Christmas Eve they set out to track down the culprit."
3509,Takedown,"Kevin Mitnick is quite possibly the best hacker in the world. Hunting for more and more information, seeking more and more cyber-trophies every day, he constantly looks for bigger challenges. When he breaks into the computer of a security expert and an ex-hacker, he finds one - and much more than that..."
3515,The Muppet Christmas Carol,"A retelling of the classic Dickens tale of Ebenezer Scrooge, miser extraordinaire. He is held accountable for his dastardly ways during night-time visitations by the Ghosts of Christmas Past, Present, and future."
3516,Beethoven's 2nd,"Beethoven is back -- and this time, he has a whole brood with him now that he's met his canine match, Missy, and fathered a family. The only problem is that Missy's owner, Regina, wants to sell the puppies and tear the clan apart. It's up to Beethoven and the Newton kids to save the day and keep everyone together."
3518,Manhattan Murder Mystery,A middle-aged couple suspects foul play when their neighbor's wife suddenly drops dead.
3532,28 Days,"After getting into a car accident while drunk on the day of her sister's wedding, Gwen Cummings is given a choice between prison or a rehab center. She chooses rehab, but is extremely resistant to taking part in any of the treatment programs they have to offer, refusing to admit that she has an alcohol addiction."
3561,Miracle on 34th Street,"Six-year-old Susan Walker has doubts about childhood's most enduring miracle—Santa Claus. Her mother told her the secret about Santa a long time ago, but, after meeting a special department store Santa who's convinced he's the real thing, Susan is given the most precious gift of all—something to believe in."
3571,Madagascar: Escape 2 Africa,"Alex, Marty, and other zoo animals find a way to escape from Madagascar when the penguins reassemble a wrecked airplane. The precariously repaired craft stays airborne just long enough to make it to the African continent. There the New Yorkers encounter members of their own species for the first time. Africa proves to be a wild place, but Alex and company wonder if it is better than their Central Park home."
3579,The Italian Job,"Charlie's got a 'job' to do. Having just left prison he finds one his of friends has attempted a high risk job in Torino, Italy, right under the nose of the mafia. Charlie's friend doesn't get very far, so Charlie takes over the 'job'. Using three Mini Coopers, a couple of Jaguars and a bus, he hopes to bring Torino to a standstill, steal a fortune in gold and escape in the chaos."
3592,Family Business,"Jessie is an aging career criminal who has been in more jails, fights, schemes, and lineups than just about anyone else. His son Vito, while currently on the straight and narrow, has had a fairly shady past and is indeed no stranger to illegal activity. They both have great hope for Adam, Vito's son and Jessie's grandson, who is bright, good-looking, and without a criminal past."
3622,Kevin & Perry Go Large,"When stubborn, spotty Kevin and his equally hopeless best friend Perry go on holiday to the party island Ibiza, they see it as their big chance to become superstar club DJs and, more importantly, to lose their virginities. But they aren't prepared for the interference of top DJ Eyeball Paul, not to mention the embarrassment factor of Kevin's long-suffering parents."
3632,Barbershop,"A day in the life of a barbershop on the south side of Chicago. Calvin, who inherited the struggling business from his deceased father, views the shop as nothing but a burden and waste of his time. After selling the shop to a local loan shark, Calvin slowly begins to see his father's vision and legacy and struggles with the notion that he just sold it out."
3642,All of Me,"Just before stubborn millionaire Edwina Cutwater dies, she asks her uptight lawyer, Roger Cobb to amend her will so that her soul will pass to the young, vibrant Terry Hoskins – but the spiritual transference goes awry. Edwina enters Roger's body instead, forcing him to battle Edwina for control of his own being."
3648,Futureworld,"Two years after the Westworld tragedy in the Delos amusement park, the corporate owners have reopened the park following over $1 billion in safety and other improvements. For publicity purposes, reporters Chuck Browning and Tracy Ballard are invited to review the park. Just prior to arriving at the park, however, Browning is given a clue by a dying man that something is amiss."
3650,Loser,"On a university scholarship, a good natured student from the midwest gets a crash course in city life while dealing with three evil roommates. He befriends a virtually homeless college student whom he falls for, but she's dating a nasty professor."
3667,The Strangers,"After returning from a wedding reception, a couple staying in an isolated vacation house receive a knock on the door in the mid-hours of the night. What ensues is a violent invasion by three strangers, their faces hidden behind masks. The couple find themselves in a violent struggle, in which they go beyond what either of them thought capable in order to survive."
3690,The Chase,"Jack Hammond is sentenced to life in prison, but manages to escape. To get away from the police he takes a girl as hostage and drives off in her car. The girl happens to be the only daughter of one of the richest men in the state. In a while the car chase is being broadcast live on every TV-channel."
3692,Hero,"Bernie Laplante is having a rough time. He's divorced, his ex-wife hates him and has custody of their son, the cops are setting a trap for him, then to top it all, he loses a shoe whilst rescuing passengers of a crashed jet. Being a thief who is down on his luck, Bernie takes advantage of the crash, but then someone else claims credit for the rescue."
3705,Elf,"When young Buddy falls into Santa's gift sack on Christmas Eve, he's transported back to the North Pole and raised as a toy-making elf by Santa's helpers. But as he grows into adulthood, he can't shake the nagging feeling that he doesn't belong. Buddy vows to visit Manhattan and find his real dad, a workaholic publisher."
3712,Quick Change,"With the aid of his girlfriend, Phyllis Potter, and best friend, Loomis, Grimm enters a Manhattan bank dressed as a clown, creates a hostage situation and executes a flawless robbery. The only thing left for the trio to do is make their getaway out of the city and to the airport. It sounds simple enough, but it seems that fate deserts them immediately after the bank heist. One mishap after another conspires to keep these robbers from reaching freedom."
3722,Confidence,"What Jake Vig doesn't know just might get him killed. A sharp and polished grifter, Jake has just swindled thousands of dollars from the unsuspecting Lionel Dolby with the help of his crew. It becomes clear that Lionel wasn't just any mark, he was an accountant for eccentric crime boss Winston King. Jake and his crew will have to stay one step ahead of both the criminals and the cops to finally settle their debt."
3731,Made of Honor,"Tom and Hannah have been platonic friends for 10 years. He's a serial dater, while she wants marriage but hasn't found Mr. Right. Just as Tom is starting to think that he is relationship material after all, Hannah gets engaged. When she asks Tom to be her 'maid' of honor, he reluctantly agrees just so he can attempt to stop the wedding and woo her."
3760,Dr. Dolittle 2,"A group of beavers ask Dr. Dolittle to save their habitat from loggers. The only hope is to get the forest preserved because it's the home of a protected bear, but there's a problem: the bear's the only bear in the forest, so she can't reproduce. Undaunted, Dolittle persuades a circus bear to help out, but he has to teach him not just the ways of the wild, but the wiles of lady bears too."
3774,Breakthrough,"Starting in late May 1944, during the German retreat on the Eastern Front, Captain Stransky (Helmut Griem) orders Sergeant Steiner (Richard Burton) to blow up a railway tunnel to prevent Russian forces from using it. Steiner's platoon fails in its mission by coming up against a Russian tank. Steiner then takes a furlough to Paris just as the Allies launch their invasion of Normandy."
3784,Stakeout,"Two cops are given the 'dirty' job of staking out the home of an escaped convict's ex-girlfriend. Chris and the beautiful girlfriend accidentally meet and fall in love. Just as Chris confesses, the convict appears, but will she betray him ?"
3794,The Ref,"Caroline and Lloyd are a married couple constantly at each other's throats, masters at crafting acid-tongued barbs at the other's expense. Indeed, they are so obsessed with belittling each other that they never stop -- not even at gunpoint. The gunman is Gus, a thief on the run from the police, who kidnaps the couple as an insurance policy, planning to use their home as a hideout. But their incessant bickering proves more than Gus bargained for, forcing him -- for the sake of his own sanity -- into the unenviable role of peacemaker. To make things even worse for Gus, he discovers that he has taken the couple hostage the night of their big Christmas party, and the guests are already on the way. Not wanting to leave Lloyd and Caroline unattended, Gus opts to attend the party, pretending to be the couple's marriage counselor. This naturally leads to a series of comic confusions, as the hostage crisis and marital tensions head towards their inevitable conclusion."
3802,Sleeping Beauty,"A beautiful princess born in a faraway kingdom is destined by a terrible curse to prick her finger on the spindle of a spinning wheel and fall into a deep sleep that can only be awakened by true love's first kiss. Determined to protect her, her parents ask three fairies to raise her in hiding. But the evil Maleficent is just as determined to seal the princess's fate."
3861,Nothing,"The film tells the story of two good friends who live together, Andrew, an agoraphobic travel agent who works from his home, and Dave, a loser who works in an office where he is treated with contempt. Just when it seems things can't get any worse for the two, the entire world outside of their house disappears and is replaced with an endless white void."
3874,Blue Streak,"Miles Logan is a jewel thief who just hit the big time by stealing a huge diamond. However, after two years in jail, he comes to find out that he hid the diamond in a police building that was being built at the time of the robbery. In an attempt to regain his diamond, he poses as an LAPD detective."
3880,Cheaper by the Dozen,"The Baker brood moves to Chicago after patriarch Tom gets a job coaching football at Northwestern University, forcing his writer wife, Mary, and the couple's 12 children to make a major adjustment. The transition works well until work demands pull the parents away from home, leaving the kids bored -- and increasingly mischievous."
3882,Saturday Night Fever,Tony spends his Saturdays at a disco where his stylish moves raise his popularity among the patrons. But his life outside the disco is not easy and things change when he gets attracted to Stephanie.
3916,Godsend,"A couple agree to have their deceased son cloned under the supervision of an enigmatic doctor, but bizarre things start to happen years after his rebirth."
3949,The Associate,Laurel Ayres is a businesswoman trying to make it but unfortunately she works at a investment firm where she does all the work but all the senior investors like Frank Peterson grab all the credit. She then leaves and starts her own firm. While trying to find clients Laurel pretends that she has a male partner named Robert Cutty. And when she starts to do well all of her clients wants to meet Cutty which is difficult since he doesn't exist.
4003,Baby's Day Out,"Baby Bink couldn't ask for more; he has adoring (if somewhat sickly-sweet) parents, he lives in a huge mansion, and he's just about to appear in the social pages of the paper. Unfortunately, not everyone in the world is as nice as Baby Bink's parents; especially the three enterprising kidnapers who pretend to be photographers from the newspaper. Successfully kidnaping Baby Bink, they have a harder time keeping hold of the rascal, who not only keeps one step ahead of them, but seems to be more than a little bit smarter than the three bumbling criminals."
4021,The Care Bears Movie,"The Care Bears have their work cut out for them, because Nicolas, a lonely magician's assistant, is about to fall under the evil influence of a bad spirit who lives in an ancient magic book -- it seems Nicolas will do just about anything for friends. Aside from Nicolas, Kim and Jason are in trouble because they are starting not to trust people after suffering many disappointments."
4036,Freddy's Dead: The Final Nightmare,"Just when you thought it was safe to sleep, Freddy Krueger returns in this sixth installment of the Nightmare on Elm Street films, as psychologist Maggie Burroughs, tormented by recurring nightmares, meets a patient with the same horrific dreams. Their quest for answers leads to a certain house on Elm Street -- where the nightmares become reality."
4050,Hardware,"Mark 13 is a government-built killing machine programmed with artificial intelligence, able to repair and recharge itself from any energy source. Through a series of coincidences, the cyborg's head ends up in the home of a sculptress as a bizarre Christmas present from her boyfriend. Once inside its new home, the cyborg promptly reconstructs the rest of its body using a variety of household utensils and proceeds to go on a murderous rampage."
4074,Fragile,"Haunted by memories of a patient's death, a nurse  takes a job at an antiquated hospital for children. Soon she learns that the kids fear a ghost that prowls the floors and will not allow anyone to leave. Amy tries to protect them and convince the other staffers of the evil that lurks there."
4110,The Santa Clause,"Scott Calvin is an ordinary man, who accidentally causes Santa Claus to fall from his roof on Christmas Eve and is knocked unconscious. When he and his young son finish Santa's trip and deliveries, they go to the North Pole, where Scott learns he must become the new Santa and convince those he loves that he is indeed, Father Christmas."
4120,Employee of the Month,"""Employee of the Month"" is about a guy whose day spirals from bad to worse when he gets fired from his dream job at the bank and is dumped by his fiancée Sara. David's best friend Jack tries to convince him it's for the best, but the opposite occurs when bank robberies and millions of dollars become part of his day from hell."
4124,National Lampoon's European Vacation,"The Griswalds win a vacation to Europe on a game show, and so pack their bags for the continent. They do their best to catch the flavor of Europe, but they just don't know how to be be good tourists. Besides, they have trouble taking holidays in countries where they CAN speak the language."
4129,"Honey, We Shrunk Ourselves","The joke's on absent-minded scientist Wayne Szalinski when his troublesome invention shrinks him, his brother and their wives so effectively that their children think they've completely disappeared. Of course, this gives the kids free rein to do anything they want, unaware that their parents are watching every move."
4131,Dead End,"Christmas Eve. On his way to his in-laws with his family, Frank Harrington decides to try a shortcut, for the first time in 20 years. It turns out to be the biggest mistake of his life."
4161,Nine Months,"When he finds out his longtime girlfriend is pregnant, a commitment-phobe realizes he might have to change his lifestyle for better or much, much worse."
4212,St. Elmo's Fire,"A group of friends graduate from the halls of Georgetown University into lives that revolve around sex, paychecks, and career aspirations. Kirby waits tables to pay for law school. His roommate Kevin struggles at a D.C. newspaper as he lusts after the stylish Jules. Jules may be an object of adoration and envy, but secretly she has problems of her own. Demure Wendy is in love with Billy—a sax player and an irresponsible drunk. Alex wants it all: a career in politics and the appearance of a traditional home life. Alex's girlfriend, Leslie, is an ambitious architect who doesn't know about his infidelity, but his new allegiance to the Republican Party is already enough to put her off marriage."
4263,Are We There Yet?,"The fledgling romance between Nick, a playboy bachelor, and Suzanne, a divorced mother of two, is threatened by a particularly harrowing New Years Eve. When Suzanne's work keeps her in Vancouver for the holiday, Nick offers to bring her kids to the city from Portland, Oregon. The kids, who have never liked any of the men their mom dates, are determined to turn the trip into a nightmare for Nick."
4275,The Commitments,"Jimmy Rabbitte, just a tick out of school, gets a brilliant idea: to put a soul band together in Barrytown, his slum home in north Dublin. First he needs musicians and singers: things slowly start to click when he finds three fine-voiced females virtually in his back yard, a lead singer (Deco) at a wedding, and, responding to his ad, an aging trumpet player, Joey ""The Lips"" Fagan."
4289,The Adventures of Pluto Nash,"The year is 2087, the setting is the moon. Pluto Nash, the high-flying successful owner of the hottest nightclub in the universe, finds himself in trouble when he refuses to sell his club to lunar gangster Mogan, who just happens to be helping the mysterious Rex Crater mastermind a plan to take over the entire moon."
4330,The Fly,"Industrialist François Delambre is called late at night by his sister-in-law, Helene Delambre, who tells him that she has just killed her husband, André. Reluctant at first, she eventually explains to the police that André invented a matter transportation apparatus and, while experimenting on himself, a fly entered the chamber during the matter transference."
4344,The SpongeBob SquarePants Movie,"There's trouble brewing in Bikini Bottom. Someone has stolen King Neptune's crown, and it looks like Mr. Krab, SpongeBob's boss, is the culprit. Though he's just been passed over for the promotion of his dreams, SpongeBob stands by his boss, and along with his best pal Patrick, sets out on a treacherous mission to Shell City to reclaim the crown and save Mr. Krab's life."
4364,Father of the Bride Part II,"Just when George Banks has recovered from his daughter's wedding, he receives the news that she's pregnant ... and that George's wife is expecting too. He was planning on selling their home, but that's a plan that—like George—will have to change with the arrival of both a grandchild and a kid of his own."
4374,Miracle on 34th Street,"Kris Kringle, seemingly the embodiment of Santa Claus, is asked to portray the jolly old fellow at Macy's following his performance in the Thanksgiving Day parade. His portrayal is so complete that many begin to question if he truly is Santa Claus, while others question his sanity."
4375,The Last Starfighter,A video game expert Alex Rogan finds himself transported to another planet after conquering The Last Starfighter video game only to find out it was just a test. He was recruited to join the team of best Starfighters to defend their world from the attack.
