id,title,synopsis5212,Half Past Dead 2,"Long time inmate Twitch (Kurupt) gets himself transfered to a tougher prison than the re-opened Alcatraz. He claims it's to be closer to his lady but his real motives are a bit more grandiose. There he crosses paths with Burke (Bill Goldberg) a bulky prisoner who can take care of himself. Twitch, despite being less muscular, is just as mouthy and is pretty much the same. But there is a gang war brewing between the black and hispanic inmates that explodes into a hostile takeover of the prison when the black's gang leader is shot dead and the finger points at Burke. But the sh!t really hits the fan when the real killer and leader of the hispanics, Cortez (Robert Madrid) takes Twitch's girlfriend and Burke's daughter hostage."
5215,Modern Love,"Marianne gets off to a bad start with gallery director and Brad Pitt look alike Vincent but everything works out ""just like in the movies"" in the end."
5220,The Nutcracker Prince,"After young Clara receives a wooden nutcracker as a Christmas gift, she dreams about a fantastical battle between her Nutcracker Prince and the evil Mouse King. At stake is the Nutcracker's freedom - and Clara's future happiness."
5225,Santa Claus: The Movie,"The first half of this film, set hundreds of years ago, shows how the old man who eventually became Santa Claus was given immortality and chosen to deliver toys to all the children of the world. The second half moves into the modern era, in which Patch, the head elf, strikes out on his own and falls in with an evil toy manufacturer who wants to corner the market and eliminate Santa Claus."
5226,Scrooge,The classic Charles Dickens' Christmas ghost tale told in musical form.
5228,The Santa Clause 3: The Escape Clause,"Now that Santa and Mrs. Claus have the North Pole running smoothly, the Counsel of Legendary Figures has called an emergency meeting on Christmas Eve! The evil Jack Frost has been making trouble, looking to take over the holiday! So he launches a plan to sabotage the toy factory and compel Scott to invoke the little-known Escape Clause and wish he'd never become Santa."
5230,Backroads,"Two strangers - one white, one black - steal a car in western NSW and head for the coast. Jack is abrasive, cunning and disparaging about Aborigines. Gary doesn’t really care – he just wants to escape. En route, they pick up Gary’s Uncle Joe, a French hitchhiker and a young woman who’s running away. Their petty crimes escalate as they go, heading towards disaster."
5267,Laurel Canyon,"Laurel Canyon focuses on Sam and Alex, a pair of upper-middle class lovebirds from the East Coast who relocate to Los Angeles. Enter Jane, Sam's estranged mother, a successful record producer, who's more than willing to put the couple up in her lavish digs. As Sam and Alex settle in at Jane's, they gradually lose their straight-and-narrow approach to life and begin to experiment."
5302,Baby Einstein: Baby Noah - Animal Expedition,"As little ones become better acquainted with the world, they grow curious about animals of all kinds, beyond just the family pet. And as their communication skills continue to develop, they enjoy imitating animal sounds as well. Baby Noah™ Animal Expedition takes your little explorer across the globe to meet animals -- two-by-two -- from the savannah, the rainforest and tropics, the Outback, the ocean and the Polar Regions. With its unique video ""lift-the-flap"" format, adorable puppet shows and delightful music, this exciting program invites parents and babies on a fun-filled safari that encourages vocal participation and interactive play. Get ready to meet lions, tigers, dolphins, koalas, penguins and more. It's a wide, wonderful world out there, and there's nothing more rewarding than discovering it together!"
5303,Baby Einstein: Baby Santa's Music Box,"Baby Santa's Music Box, the stimulation is similar, yet the learning is not quite so intentional--a relief for those of us a bit intimidated with the Russian, Japanese, and French introduced in the original film. No human words are spoken here. Rather, the sights and sounds of Christmas are presented in a visual feast of whimsical, happy scenes accompanied by seasonal music. From sledding and snowmen to glowing candles and shimmering ornaments, dozens of animated and live-action settings communicate the beauty and wonder of the holiday season. Penguin puppets unwrap presents, ring bells, and toss tinsel. Santa's sleigh in a gentle snowfall segues smoothly into a playful group of Christmas-clad youngsters dancing to Tchaikovsky's ""Nutcracker."""
5330,Animal Crackers,"The well-known explorer and hunter Captain Spaulding has just returned from Africa, and is being welcomed home with a lavish party at the estate of influential society matron Mrs. Rittenhouse when a valuable painting goes missing. The intrepid Captain Spaulding attempts to solve the crime with the help of his silly secretary Horatio Jamison, while sparring with the anarchic Signor Emanuel Ravelli and his nutty sidekick The Professor."
5335,The Chumscrubber,"The Chumscrubber is a dark comedy about the lives of people who live in upper-class suburbia. It all begins when Dean Stiffle finds the body of his friend, Troy. He doesn't bother telling any of the adults because he knows they won't care. Everyone in town is too self consumed to worry about anything else than themselves. And everybody is on some form of drug just to get through their days."
5339,Luxo Jr.,"A baby lamp finds a ball to play with and it's all fun and games until the ball bursts. Just when the elder Luxo thinks his kid will settle down for a bit, Luxo Jr. finds a ball ten times bigger."
5341,Tin Toy,"Babies are hardly monster-like, unless you're a toy. After escaping a drooling baby, Tinny realizes that he wants to be played with after all. But in the amount of time it takes him to discover this, the baby's attention moves on to other things only an infant could find interesting."
5343,Geri's Game,"An aging codger named Geri plays a daylong game of chess in the park against himself. Somehow, he begins losing to his livelier opponent. But just when the game's nearly over, Geri manages to turn the tables."
5346,Jack-Jack Attack,"The Parrs' baby Jack-Jack is thought to be normal, not having any super-powers like his parents or siblings. But when an outsider is hired to watch him, Jack-Jack shows his true potential."
5364,Alien Raiders,"It's the end of yet another night at Hastings Supermarket, a grocery store in Buck Lake, Arizona. But just before closing, a group of masked and armed to the teeth militants invades the store and take everyone hostage"
5373,Maybe Baby,"Sam and Lucie Bell are a married couple who seem to have it all: good looks, succesful careers, matching motorikes, and an enthusiastic love life. The only thing they lack is the one thing they want more—a baby."
5449,Christmas in Wonderland,"Three kids and their Dad move from L.A to Edmonton. When they go shopping at West Edmonton Mall they find counterfeit cash. They inadvertently help catch the crooks, and later make a discovery about Santa"
5470,Bad Boy Bubby,"Bad Boy Bubby is just that: a bad boy. So bad, in fact, that his mother has kept him locked in their house for his entire thirty years, convincing him that the air outside is poisonous. After a visit from his estranged father, circumstances force Bubby into the waiting world, a place which is just as unusual to him as he is to the world."
5533,The Sweet Hand of the White Rose,"How many times have you had a bad day? How many times have you thought you would run away from everyone and everything? That is exactly what happens to Mark. In order to forget about a heated discussion with his girlfriend, he decides to get in the car and go far away. But a little mistake will change his reality forever..."
5543,Revenge,"Michael ‘Jay’ Cochran has just left the Navy after 12 years and he's not quite sure what he's going to do, except that he knows he wants a holiday. He decides to visit Tiburon Mendez, a powerful but shady Mexican businessman who he once flew to Alaska for a hunting trip. Arriving at the Mendez mansion in Mexico, he is immediately surprised by the beauty and youth of Mendez’s wife, Miryea."
5552,Female Trouble,"The life and times of Dawn Davenport, showing her progression from bratty schoolgirl to crazed mass murderer - all of which stems from her parents' refusal to buy her cha-cha heels for Christmas."
5596,Gamers,"Gamers is a comedy about the lives of four slacker friends (and one obsessive interloper) living at home, -""with my parents... it's just temporary... 'til they die""- working in the real world but playing in a fantasy world. Obsessed with a role playing game called Demons, Nymphs and Dragons these ""gamers"" are the subject of this hilarious comedy."
5603,The Wiggles: You Make Me Feel Like Dancing,"'We sincerely hope this new music from us to you makes you feel like dancing! Putting the songs together wasn't so hard, criteria…well, the music had to make you start tapping your feet, start nodding your head and make you start smiling like you had just eaten your grandmother’s homemade biscuits, you know what I mean…joy! So let's get dancing everyone, happy wiggling!' – Anthony Wiggle The Wiggl"
5622,Double Whammy,"Ray Pluto has many problems. He is satirized in the tabloids as the ""loser cop."" His partner is starting to seem suspiciously attracted to him. A pair of screenwriters across the hall keep bugging him for help. The superintendent of his building is stabbed by hoodlums hired by his own rebellious daughter. To top it off, a sexually aggressive chiropractor may just be Ray's undoing."
5644,I Think I Love My Wife,"Richard Cooper is a married man and father of two who is just plain bored with married life. Not getting any sex from his wife, he resorts to ogling random women on the street to the point that he takes lunch late to look at them. When old crush Nikki Tru visits his office to get a reference letter, she becomes obsessed with Cooper and they begin a complicated relationship."
5664,Bullet,"A tough, Jewish ex-con just released from prison crosses a powerful drug dealer and former prison rival in his return to a life of crime."
5666,The Oh in Ohio,"Priscilla and Jack appear to be the perfect couple, but they have a secret: She is sexually frustrated. They separate in the hope of resolving the situation. While Jack moves into a bachelor pad and begins an affair with a student, Priscilla discovers the joys of self-pleasuring and finds an unusual bed-mate."
5684,Foolproof,"Kevin, Sam and Rob have an unusual hobby: planning foolproof heists, without intending to actually perform them. The game goes wrong when their latest plan is stolen and carried out. Things get even worse when a mysterious man approaches them with an offer: plan a heist for him, or go to jail. As the clock ticks, they find that the risk might be higher than just their freedom."
5685,American Crude,"Quite a bit can happen over the course of a single day in L.A., and when smooth-talking scam artist Johnny decides to throw a bachelor party for his best friend Bill the events of the day take a bizarre turn. As the festivities get underway, the appearance of a transvestite prostitute, a trigger-happy ex-con, and a notorious porn king signal that this isn't going to be a typical night out."
5744,All the Good Ones Are Married,"Ben Gold gets the break of his life as aspiring author, but must stay home with his kids, Luke and Madison, to make his 5 months deadline. His feminist wife, workaholic fashion executive Alex, selfishly decides to take in promising rebel designer Zoe Miller, who left her boyfriend Trey. The teenager soon wins the family's hearts. Written by KGF Vissers"
5762,Homo Erectus,"Ishbo is a caveman living in the prehistoric age who thinks there's more to life than hunting and gathering. He tries to better the lives of those in his tribe by inventing things like spoons and the toothbrush, which leave everyone, including his parents, unimpressed. He also has a thing for cavewoman Fardart, but she only has eyes for his brother Thudnik. Can Ishbo prove his worth when a rival clan attacks?"
5797,Getaway in Stockholm 1,"At dawn a black Porsche 911 is pulled over by police just south of Stockholm. This marks the beginning of one of the most brutal car chases ever-past the Stockholm Globe Arena, through the alleys of Old Town, past the Royal Castle and the Royal guards, right through downtown and the harbor to run from the law."
5801,Getaway in Stockholm 5,"Mr X, the worlds most famous traffic violator is back in town! This time in a car well known from the movie The Fast and the Furious, a supertuned Mazda Rx-7 pushed to the limit. Together with a friend in a just as fast supercar they show that after sunset in Stockholm another life begins where they own the streets, sometimes at speeds up to 300 km/h."
5814,The Haunting of Molly Hartley,"When teenage Molly Hartley moves to a new town, she's haunted by terrifying visions that may have to do with dark secrets from her past. Something evil lurks just beneath the lush surfaces of her private-school world, and it holds the rights to her very soul. On the eve of her 18th birthday, Molly is about to discover the truth of just who or what she is destined to become."
5820,The Deadly Affair,"Charles Dobbs is a British secret agent investigating the apparent suicide of Foreign Office official Samuel Fennan. Dobbs suspects that Fennan's wife, Elsa, a survivor of a Nazi Germany extermination camp, might have some clues, but other officials want Dobbs to drop the case. So Dobbs hires a retiring inspector, Mendel, to quietly make inquiries. Dobbs isn't at all sure as there are a number of anomalies that simply can't be explained away. Dobbs is also having trouble at home with his errant wife, whom he very much loves, having frequent affairs. He's also pleased to see an old friend, Dieter Frey, who he recruited after the war. With the assistance of a colleague and a retired policeman, Dobbs tries to piece together just who is the spy and who in fact assassinated Fennan."
5858,Heavyweights,"Camp Hope is a summer retreat for overweight boys run by a kindly couple who make the campers feel comfortable with their extra pounds. But when tyrannical fitness guru Tony buys the camp, he puts the kids on a cruel regimen that goes too far. Sick of the endless weeks of ""all work and no play,"" the kids stage a coup and reclaim their summer of fun."
5868,Not Easily Broken,A car accident and shifting affections test the bond between a married couple.
5894,Farm House,"Stranded in the remote countryside after wrecking their car, a couple seeking to start over discovers that there's no escape from the sins of their past."
5900,Try Seventeen,"Teenager Jones has opted not to go to college and is instead renting a room in a boarding house to work on his writing skills. Soon, Jones finds himself dividing his time between two women: a young actress named Lisa and a photographer named Jane. After Jane's ex-boyfriend arrives to help her recover from a car accident, Jones begins to understand just how much he cares for her."
5913,Three Dollars,"Eddie is a principled man, with a wife, a daughter and a mortgage and leads a seemingly stable and happy life as a government land assessor. Yet when the forces of economic and social change threaten this, he realises just how fragile his reality and security is. After losing his job, he checks his bank balance and finds he has only 'three dollars' to his name."
5976,Can't Hardly Wait,"It's graduation day at Huntington Hills High, and you know what that means - time to party. And not just any party, either. This one will be a night to remember, as the nerds become studs, the jocks are humiliated, and freshman crushes blossom into grown-up romance."
5989,Suspension,"Daniel loses his wife and son in a car accident. While slowly recovering from his injuries, he rebuilds his son's video camera that was destroyed in the crash. Infused with power from the moment of the crash, the camera develops the ability to stop time when Daniel presses the pause button."
5998,80 Minutes,80 minutes to live or die. Alex got injected with a high tech poison by his creditor and put on a time clock to pay his debt back in 1 hour and 20 minutes. Will he make it or even further will he stay loyal to his friends and relatives under a pressure like running out of time?
6018,Still Waiting...,After Shenaniganz loses all its hottest waitresses to new competitor Ta-Ta's Wing Shack -- where the scantily clad wait staff earns bigger tips -- the Shenaniganz staff aims to give Ta-Ta's its just desserts.
6023,All Day Every Day,"Sandbox “All Day Everyday” Snowboard DVD: Who is Sandbox, you say? Bah! Obvi it’s Kevin Sansalone and Clayton Larsen, along with a team of very talented young designers, filmers and riders. “All Day Everyday” is all about unique footage, good riding and fun mixed with some new faces, new sponsors, and high end HD production. All together this film has a great look and might just make you want to go riding."
6031,Love Stinks,"A movie about a relationship...that's worse than yours. Seth (Stewart), a sitcom writer-producer, meets Chelsea (Wilson), an interior decorator, at his best friend's (Bellamy) wedding. He's immediately sexually attracted to her while she's instantly attracted to his single-ness. They both ditch their wedding dates and start their own date that same night. The two become a couple, appearing very happy until after a couple of years of postponing a marriage proposal. When Chelsea realizes that Seth wants to remain single and together, she becomes quite bitter. In the next hour of the movie, the two engage in behavior that makes the War of the Roses look like child's play."
6055,Barbie in the Nutcracker,"""Barbie"" stars as Clara in this animated retelling of the classic Christmas ballet, complete with Tchaikovsky soundtrack and ballet choreography."
6072,Eight Days a Week,"Peter loves his next door neighbour Erica and, on the advice of his grandfather, decides to camp out on her front lawn for the entire summer, or until she agrees to go out with him. His father is none too happy about the idea and refuses to let his son back in the house, even to get a change of clothes."
6077,Midnight Clear,"On Christmas Eve in the Arizona desert, a middle-aged man (Stephen Baldwin) and an old woman (K Callan) contemplate suicide. But through chance run-ins with strangers and perhaps some divine intervention, they cross paths and change each other's life forever."
6083,This Christmas,"This year Christmas with the Whitfields promises to be one they will never forget. All the siblings have come home for the first time in years and they've brought plenty of baggage with them. As the Christmas tree is trimmed and the lights are hung, secrets are revealed and family bonds are tested. As their lives converge, they join together and help each other discover the true meaning of family."
6137,Jimmy Carr: Comedian,"Recorded live at London's Bloomsbury theatre, the posh-suited gagster unleashes his rapid-fire wit upon his audience, with jokes that are just too rude for TV."
6138,Role Models,"Two salesmen trash a company truck on an energy drink-fueled bender. Upon their arrest, the court gives them a choice: do hard time or spend 150 service hours with a mentorship program. After one day with the kids, however, jail doesn't look half bad."
6152,Inside,"Alex has a disturbing hobby of following strangers...until one night he gets caught. Instead of calling the police, the couple--fascinated by Alex's resemblance to their dead son--asks him to stay, and Alex finds himself trapped in a horrifying existence of desperation, despair, and insanity."
6153,Mickey's Once Upon a Christmas,"Mickey, Minnie, and their famous friends Goofy, Donald, Daisy and Pluto gather together to reminisce about the love, magic and surprises in three wonder-filled stories of Christmas past."
6161,First Born,"Laura's expecting. Her husband, Steven's a loving guy but has little time for her. Her mom lives thousands of miles away. Forced to give up on her dreams, she's always been a bit edgy. A C-section drives her over the edge, making her see things in a different light. A creepy babysitter doesn't make things any better. She begins seeing things, trusts no one, as she goes into self-destruct mode."
6175,Car Wash,"This day-in-the-life cult comedy focuses on a group of friends working at Sully Boyar's Car Wash in the Los Angeles ghetto. The team meets dozens of eccentric customers -- including a smooth-talking preacher, a wacky cab driver and an ex-convict -- while cracking politically incorrect jokes to a constant soundtrack of disco and funk. Some of the workers find romance as the day moves along, but most are just happy to get through another shift."
6236,Roy Jones Jr's Greatest Knockouts,Roy Jones Jr's Host a look back on some of his knockout wins. More the most part this is Jones just beat the hell out of people I don't remember it once show Jones even getting hit back with good shots. A good watch if you like Jones style.
6244,The Prince & Me 2: The Royal Wedding,"With just weeks before their royal wedding, Paige and Edvard find their relationship and the Danish monarchy in jeopardy when an old law is brought to light, stating that an unmarried heir to the throne may marry only a woman of noble blood or else he must relinquish his crown."
6274,The Tigger Movie,"Winnie the Pooh, Piglet, Owl, Kanga, Roo, and Rabbit are preparing a suitable winter home for Eeyore, the perennially dejected donkey, but Tigger's continual bouncing interrupts their efforts. Rabbit suggests that Tigger go find others of his kind to bounce with, but Tigger thinks ""the most wonderful thing about tiggers is"" he's ""the only one!"" Just in case though, the joyously jouncy feline sets out to see if he can find relatives."
6276,Flowers in the Attic,"After the death of her husband, a mother takes her kids off to live with their grandparents in a huge, decrepit old mansion. However, the kids are kept hidden in a room just below the attic, visited only by their mother who becomes less and less concerned about them and their failing health, and more concerned about herself and the inheritence she plans to win back from her dying father."
6296,Nitro Circus 4 Lock'n Load,"Look ma! No hands! It's loud. It's loose. It's the Nitro Circus. We've rounded up the crew packed the powder now it's time to 'Lock and Load' , and put the fire in the hole. Erratic, random chaos is the flavor. Straight doses of ADHD players is the source. It's our beloved Travis just being Travis. Anyone who is involved with this movie is freakin' nuts! You in? Caution idiots ahead."
6329,Libera,"This high-energy three part comedy has a strong undercurrent of melancholy, as it shows three different women coping with difficult situations which are usually sexual in origin, even if the moment of romance is long past. In the first tale, Aurora has gotten used to a cozy, wealthy life, but begins to see her world destroyed when her husband is caught in bed with his secretary. Later, he flees the country to avoid getting arrested for something else he has done. Carmela is just welcoming her wayward son back to their slum home after he has spent a stint in ""reform"" school. Not only has he just confessed to her that he's gay, but he has become a heroin addict.Finally, Libera works at a newsstand outside of Naples as the sole breadwinner for her family. She is tired of her husband lounging in their house when he is not out tomcatting around with prostitutes, and decides to do something about it. So she secretly has him filmed in bed, and is marketing the tapes at her newsstand."
6347,A Colbert Christmas: The Greatest Gift of All!,"Hark! The Herald Pundit Sings! America’s favorite Christmas tradition is now on DVD! Families have gathered around the TV to enjoy Stephen Colbert’s Christmas specials every year since 2008. Now, you can experience the joy over and over! Join Stephen and his friends—Toby Keith, Elvis Costello, John Legend, Feist, Willie Nelson, and Jon Stewart —for a yuletide evening of song, dance and nog-induced dementia. (Parental discretion is advised.) Remember, every time you buy a copy of Stephen Colbert’s Christmas Special, an angel gets his wings."
6418,The Shaggy D.A.,"Wilby Daniels, a successful lawyer running for District Attorney, suddenly finds himself being transformed into an English sheepdog. Somehow he has to keep his change a secret and find just what is causing it, all the while eluding the local dog catcher."
6441,Taoism Drunkard,"A Taoist priest is ordered to find a Cherry Boy to appease his temple's ancestors. The boy in question is a young man who lives with his grandmother, trying to protect a sacred writ from a bright red, snarling bad guy. And let's just say insanity follows!"
6445,All About Anna,"Anna is a young costume designer, focused on her job and wary of getting caught in romantic relationships. She has just found a new apartment, and is tempted to let her latest boyfriend, Frank, move in with her. Instead, she finds a tenant: The flamboyant, fun-loving Camilla, who shares Anna’s views on love and commitment. For both of them, it’s all about fun."
