id,title,synopsis
8,Dancer in the Dark,"Selma, a Czech immigrant on the verge of blindness, struggles to make ends meet for herself and her son, who has inherited the same genetic disorder and will suffer the same fate without an expensive operation. When life gets too difficult, Selma learns to cope through her love of musicals, escaping life's troubles - even if just for a moment - by dreaming up little numbers to the rhythmic beats of her surroundings."
41,Raiders of the Lost Ark,"When Dr. Indiana Jones – the tweed-suited professor who just happens to be a celebrated archaeologist – is hired by the government to locate the legendary Ark of the Covenant, he finds himself up against the entire Nazi regime."
106,A Clockwork Orange,"In a near-future Britain, young Alexander DeLarge and his pals get their kicks beating and raping anyone they please. When not destroying the lives of others, Alex swoons to the music of Beethoven. The state, eager to crack down on juvenile crime, gives an incarcerated Alex the option to undergo an invasive procedure that'll rob him of all personal agency. In a time when conscience is a commodity, can Alex change his tune?"
126,Saw II,"When a new murder victim is discovered with all the signs of Jigsaw's hand, Detective Eric Matthews begins a full investigation and apprehends Jigsaw with little effort. But for Jigsaw, getting caught is just another part of his plan. Eight more of his victims are already fighting for their lives and now it's time for Matthews to join the game."
146,High Fidelity,"When record store owner Rob Gordon gets dumped by his girlfriend, Laura, because he hasn't changed since they met, he revisits his top five breakups of all time in an attempt to figure out what went wrong. As Rob seeks out his former lovers to find out why they left, he keeps up his efforts to win Laura back."
151,The War of the Roses,"The Roses, Barbara and Oliver, live happily as a married couple. Then she starts to wonder what life would be like without Oliver, and likes what she sees. Both want to stay in the house, and so they begin a campaign to force each other to leave. In the middle of the fighting is D'Amato, the divorce lawyer. He gets to see how far both will go to get rid of the other, and boy do they go far."
179,Terminator 3: Rise of the Machines,"It's been 10 years since John Connor saved Earth from Judgment Day, and he's now living under the radar, steering clear of using anything Skynet can trace. That is, until he encounters T-X, a robotic assassin ordered to finish what T-1000 started. Good thing Connor's former nemesis, the Terminator, is back to aid the now-adult Connor … just like he promised."
233,The Straight Story,"A retired farmer and widower in his 70s, Alvin Straight learns one day that his distant brother Lyle has suffered a stroke and may not recover. Alvin is determined to make things right with Lyle while he still can, but his brother lives in Wisconsin, while Alvin is stuck in Iowa with no car and no driver's license. Then he hits on the idea of making the trip on his old lawnmower, thus beginning a picturesque and at times deeply spiritual odyssey."
284,Love Actually,"'Love Actually' follows the lives of eight very different couples dealing with their love lives, in various loosely and interrelated tales, all set during a frantic month before Christmas in London, England."
292,The Blues Brothers,"Jake Blues, just released from prison, puts his old band back togther to save the Catholic home where he and his brother Elwood were raised."
314,Absolut,Two guys against globalization want to plant a virus in the network of a finance corporation. On the day of the attack Alex has an accident and cannot remember anything.
323,The Ring,"It sounded like just another urban legend: A videotape filled with nightmarish images, leading to a phone call foretelling the viewer's death in exactly seven days. As a newspaper reporter, Rachel Keller was naturally skeptical of the story, until four teenagers all met with mysterious deaths exactly one week after watching just such a tape. Allowing her investigative curiosity to get the better of her, Rachel tracks down the video... and watches it. Now she has just seven days to unravel the mystery of the Ring."
358,Poltergeist,"Steve Freeling lives with his wife, Diane, and their three children, Dana, Robbie, and Carol Anne, in Southern California where he sells houses for the company that built the neighborhood. It starts with just a few odd occurrences, such as broken dishes and furniture moving around by itself. However, when he realizes that something truly evil haunts his home, Steve calls in a team of parapsychologists led by Dr. Lesh to help before it's too late."
376,Stalag 17,"It's a dreary Christmas 1944 for the American POWs in Stalag 17 and the men in Barracks 4, all sergeants, have to deal with a grave problem—there seems to be a security leak."
428,All About Eve,"From the moment she glimpses her idol at the stage door, Eve Harrington is determined to take the reins of power away from the great actress Margo Channing. Eve maneuvers her way into Margo's Broadway role, becomes a sensation and even causes turmoil in the lives of Margo's director boyfriend, her playwright and his wife. Only the cynical drama critic sees through Eve, admiring her audacity and perfect pattern of deceit."
439,The Last Emperor,"A dramatic history of Pu Yi, the last of the Emperors of China, from his lofty birth and brief reign in the Forbidden City, the object of worship by half a billion people; through his abdication, his decline and dissolute lifestyle; his exploitation by the invading Japanese, and finally to his obscure existence as just another peasant worker in the People's Republic."
446,From Dusk Till Dawn,"Seth Gecko and his younger brother Richard are on the run after a bloody bank robbery in Texas. They escape across the border into Mexico and will be home-free the next morning, when they pay off the local kingpin. They just have to survive 'from dusk till dawn' at the rendezvous point, which turns out to be a Hell of a strip joint."
449,Murder Ahoy,"During an annual board of trustees meeting, one of the trustees dies. Miss Marple thinks he’s been poisoned after finding a chemical on him. She sets off to investigate at the ship where he had just come from. The fourth and final film from the Miss Marple series starring Margaret Rutherford as the quirky amateur detective."
450,Gentlemen Prefer Blondes,"Lorelei Lee is a beautiful showgirl engaged to be married to the wealthy Gus Esmond, much to the disapproval of Gus' rich father, Esmond Sr., who thinks that Lorelei is just after his money. When Lorelei goes on a cruise accompanied only by her best friend, Dorothy Shaw, Esmond Sr. hires Ernie Malone, a private detective, to follow her and report any questionable behavior that would disqualify her from the marriage."
460,Home Alone,"Eight-year-old Kevin McCallister makes the most of the situation after his family unwittingly leaves him behind when they go on Christmas vacation. But when a pair of bungling burglars set their sights on Kevin's house, the plucky kid stands ready to defend his territory. By planting booby traps galore, adorably mischievous Kevin stands his ground as his frantic mother attempts to race home before Christmas Day."
461,Home Alone 2: Lost in New York,"Instead of flying to Florida with his folks, Kevin ends up alone in New York, where he gets a hotel room with his dad's credit card—despite problems from a clerk and meddling bellboy. But when Kevin runs into his old nemeses, the Wet Bandits, he's determined to foil their plans to rob a toy store on Christmas eve."
467,Mrs. Doubtfire,"Loving but irresponsible dad Daniel Hillard, estranged from his exasperated spouse, is crushed by a court order allowing only weekly visits with his kids. When Daniel learns his ex needs a housekeeper, he gets the job -- disguised as an English nanny. Soon he becomes not only his children's best pal but the kind of parent he should have been from the start."
489,Austin Powers: International Man of Mystery,"As a swingin' fashion photographer by day and a groovy British superagent by night, Austin Powers is the '60s' most shagadelic spy, baby! But can he stop megalomaniac Dr. Evil after the bald villain freezes himself and unthaws in the '90s? With the help of sexy sidekick Vanessa Kensington, he just might."
508,The Assassination of Richard Nixon,"It’s 1974 and Sam Bicke has lost everything. His wife leaves him with his three kids, his boss fires him, his brother turns away from him, and the bank won’t give him any money to start anew. He tries to find someone to blame for his misfortunes and comes up with the President of the United States who he plans to murder."
514,A Christmas Story,"The comic mishaps and adventures of a young boy named Ralph, trying to convince his parents, teachers, and Santa that a Red Ryder B.B. gun really is the perfect Christmas gift for the 1940s."
538,Hook,"The boy who wasn't supposed grow up—Peter Pan—does just that, becoming a soulless corporate lawyer whose workaholism could cost him his wife and kids. During his trip to see Granny Wendy in London, the vengeful Capt. Hook kidnaps Peter's kids and forces Peter to return to Neverland."
541,Crash,"After getting into a serious car accident, a TV director discovers an underground sub-culture of scarred, omnisexual car-crash victims who use car accidents and the raw sexual energy they produce to try to rejuvenate his sex life with his wife."
606,The Philadelphia Story,"When a rich woman's ex-husband and a tabloid-type reporter turn up just before her planned remarriage, she begins to learn the truth about herself."
612,The Front Page,A journalist suffering from burn-out wants to finally say goodbye to his office – but his boss doesn’t like the idea one bit.
616,The Man Who Fell to Earth,"Thomas Jerome Newton is an alien who has come to Earth in search of water to save his home planet. Aided by lawyer Oliver Farnsworth, Thomas uses his knowledge of advanced technology to create profitable inventions. While developing a method to transport water, Thomas meets Mary-Lou, a quiet hotel clerk, and begins to fall in love with her. Just as he is ready to leave Earth, Thomas is intercepted by the U.S. government, and his entire plan is threatened."
622,Mulholland Drive,"Blonde Betty Elms has only just arrived in Hollywood to become a movie star when she meets an enigmatic brunette with amnesia. Meanwhile, as the two set off to solve the second woman's identity, filmmaker Adam Kesher runs into ominous trouble while casting his latest project."
628,Arlington Road,Threats from sinister foreign nationals aren't the only thing to fear. Bedraggled college professor Michael Faraday has been vexed (and increasingly paranoid) since his wife's accidental death in a botched FBI operation. But all that takes a backseat when a seemingly all-American couple set up house next door.
671,The Hobbit,"Bilbo Baggins the Hobbit was just minding his own business, when his occasional visitor Gandalf the Wizard drops in one night. One by one, a whole group of dwarves drop in, and before he knows it, Bilbo has joined their quest to reclaim their kingdom, taken from them by the evil dragon Smaug. The only problem is that Gandalf has told the dwarves that Bilbo is an expert burglar, but he isn't..."
692,Out of Sight,"Meet Jack Foley, a smooth criminal who bends the law and is determined to make one last heist. Karen Sisco is a federal marshal who chooses all the right moves … and all the wrong guys. Now they're willing to risk it all to find out if there's more between them than just the law."
708,November,"Sophie Jacobs is going through the most difficult time of her life. Now, she just has to find out if it's real."
759,Die Hard 2,"Off-duty cop John McClane is gripped with a feeling of déjà vu when, on a snowy Christmas Eve in the nation’s capital, terrorists seize a major international airport, holding thousands of holiday travelers hostage. Renegade military commandos led by a murderous rogue officer plot to rescue a drug lord from justice and are prepared for every contingency except one: McClane’s smart-mouthed heroics."
768,It's a Wonderful Life,"A holiday favourite for generations...  George Bailey has spent his entire life giving to the people of Bedford Falls.  All that prevents rich skinflint Mr. Potter from taking over the entire town is George's modest building and loan company.  But on Christmas Eve the business's $8,000 is lost and George's troubles begin."
769,Secret Window,"Mort Rainey, a writer just emerging from a painful divorce with his ex-wife, is stalked at his remote lake house by a psychotic stranger and would-be scribe who claims Rainey swiped his best story idea. But as Rainey endeavors to prove his innocence, he begins to question his own sanity."
792,Liar Liar,"Fletcher Reede is a fast-talking attorney and habitual liar. When his son Max blows out the candles on his fifth birthday he has just one wish - that his dad will stop lying for 24 hours. When Max's wish comes true, Fletcher discovers that his mouth has suddenly become his biggest liability."
802,Forces of Nature,"Ben Holmes, a professional book-jacket blurbologist, is trying to get to Savannah for his wedding. He just barely catches the last plane, but a seagull flies into the engine as the plane is taking off. All later flights are cancelled because of an approaching hurricane, so he is forced to hitch a ride in a Geo Metro with an attractive but eccentric woman named Sara."
817,Will Penny,"Will Penny, an aging cowpoke, takes a job on a ranch which requires him to ride the line of the property looking for trespassers or, worse, squatters. He finds that his cabin in the high mountains has been appropriated by a woman whose guide to Oregon has deserted her and her son. Too ashamed to kick mother and child out just as the bitter winter of the mountains sets in, he agrees to share the cabin until the spring thaw. But it isn't just the snow that slowly thaws; the lonely man and woman soon forget their mutual hostility and start developing a deep love for one another."
832,Con Air,"When the government puts all its rotten criminal eggs in one airborne basket, it's asking for trouble. Before you can say, ""Pass the barf bag,"" the crooks control the plane, led by creepy Cyrus ""The Virus"" Grissom. Watching his every move is the just-released Cameron Poe, who'd rather reunite with his family."
871,Heaven with a Gun,"Glenn Ford plays Jim Killian, a preacher who arrives in a town divided between cattlemen and sheep herders. But Killian isn't just any preacher. He is a former fast gun who has set upon a different path."
899,2 Days in Paris,"Adam Goldberg delivers ""an uproarious study in transatlantic culture panic"" as Jack, an anxious, hypochondriac-prone New Yorker vacationing throughout Europe with his breezy, free-spirited Parisian girlfriend, Marion. But when they make a two-day stop in Marion's hometown, the couple's romantic trip takes a turn as Jack is exposed to Marion's sexually perverse and emotionally unstable family."
917,Beyond Rangoon,"Patricia Arquette stars as American widow Laura Bowman, a young doctor who's unwittingly drawn into political turmoil while vacationing in Burma in the late 1980s, in this fictionalized drama based on actual events. Bowman initially left San Francisco with her sister (Frances McDormand) in an attempt to escape painful memories of her husband and son's violent deaths. But her fight to escape to Thailand could prove just as harrowing."
938,Vanilla Sky,"David Aames has it all: wealth, good looks and gorgeous women on his arm. But just as he begins falling for the warmhearted Sofia, his face is horribly disfigured in a car accident. That's just the beginning of his troubles as the lines between illusion and reality, between life and death, are blurred."
980,Fools Rush In,"After a one night stand with Alex, Isabel realizes that she is pregnant and they decide to get married. However, along with the marriage comes compromise of one's own cultural traditions."
992,My Blueberry Nights,"Elizabeth has just been through a particularly nasty breakup, and now she's ready to leave her friends and memories behind as she chases her dreams across the country. In order to support herself on her journey, Elizabeth picks up a series of waitress jobs along the way. As Elizabeth crosses paths with a series of lost souls whose yearnings are even greater than her own, their emotional turmoil ultimately helps her gain a greater understanding of her own problems..."
993,Paranoid Park,"Alex, a teenaged skateboarder, is interviewed by Detective Richard Lu about the death of a security guard severed by a train who was apparently hit by a skateboard. While dealing with the separation process of his parents and the sexual heat of his virgin girlfriend Jennifer, Alex writes his last experiences in Paranoid Park with his new acquaintances and how the guard was killed, trying to relieve his feeling of guilty from his conscience."
994,Death Proof,"Austin's hottest DJ, Jungle Julia, sets out into the night to unwind with her two friends Shanna and Arlene. Covertly tracking their moves is Stuntman Mike, a scarred rebel leering from behind the wheel of his muscle car, revving just feet away."
1008,The Bachelor,"Jimmie is seeing his single friends get married one by one. He isn't too worried until his girlfriend Anne catches the bouquet at his friend Marco's wedding. Suddenly, his wild mustang days are numbered. He finally decides to propose to her, but he sticks his foot in his mouth and botches the proposal. Being insulted by the defeatist proposal, Anne leaves town on an assignment. After she's gone, he finds out that his recently-deceased grandfather's will stipulates that he gets nothing of a multi-million dollar fortune unless he's married by 6:05pm on his 30th birthday: tomorrow! Not being able to find Anne, Jimmie begins backtracking through his past girlfriends to find a wife."
1021,Along Came a Spider,"After the harrowing death of his partner, detective and best-selling author Alex Cross has retreated to the peace of retirement. But when a brilliant criminal kidnaps a senator's young daughter, Alex is lured back into action. Teamed with the Secret Service agent assigned to protect the missing girl, Alex follows a serpentine trail of clues that leads him to a stunning discovery - the kidnapper wants more than just ransom."
1038,Shattered,Dan Merrick comes out from a shattering car accident with amnesia. He finds that he is married to Judith who is trying to help him start his life again. He keeps getting flashbacks about events and places that he can't remember. He meets pet shop owner and part time private detective Gus Klein who is supposedly done some work for him prior to the accident. Klein helps Merrick to find out more...
1075,Days of Thunder,"Talented but unproven stock car driver Cole Trickle gets a break and with the guidance of veteran Harry Hogge turns heads on the track. The young hotshot develops a rivalry with a fellow racer that threatens his career when the two smash their cars. But with the help of his doctor, Cole just might overcome his injuries-- and his fear."
1081,Totally Blonde,"Meg Peters just can't seem to find Mr. Right, she bleaches her hair blonde and we answer the age old question ""Do blondes really have more fun?"""
1116,Alles nur Tarnung,"Harry manages to get into Willi's cell - Marlies is quartered with the ageing prostitute Jutta. Quite a tension between the generations  comes up when Harry realises that his father is not the big bank robber, but a small day thief who does not want to flee at all, but only breaks a blanket to celebrate Christmas with his beloved Jutta in her cell to celebrate..."
1128,Malice,"A tale about a happily married couple who would like to have children. Tracy teaches infants, Andy's a college professor. Things are never the same after she is taken to hospital and operated upon by Jed, a ""know all"" doctor."
1195,Firetrap,"Master burglar Max Hopper is released early after three years and soon gets an exceptional job: stealing an advanced computer-chip from the IQ Industries headquarters. His first attempt fails; when he enters in cop uniform during an emergency board meeting, a fire quickly spreads- he considers it a godsend opportunity and stays, but soon has his hands too full saving other lives and just surviving to concentrate on the chip; only the owner, his wife who just filed for divorce and a few employees remain, but it soon turns out one of them stole company secrets but the arsonist and/or another chip-thieves are among them."
1220,Uncle Buck,"Buck Russell, a lovable but slovenly bachelor, suddenly becomes the temporary caretaker of his nephew and nieces after a family emergency. His freewheeling attitude soon causes tension with his older niece Tia, loyal girlfriend Chanice and just about everyone else who crosses his path."
1317,Pacific Heights,A couple works hard to renovate their dream house and become landlords to pay for it. Unfortunately one of their tenants has plans of his own.
1364,Chances Are,"Louie Jeffries is happily married to Corinne. On their first anniversary, Louie is killed crossing the road. Louie is reincarnated as Alex Finch, and twenty years later, fate brings Alex and Louie's daughter, Miranda, together. It's not until Alex is invited to Louie's home that he begins to remember his former life, wife and best friend. Of course, there's also the problem that he's attracted to Louie's/his own daughter."
1383,His Girl Friday,"Hildy, the journalist former wife of newspaper editor Walter Burns, visits his office to inform him that she's engaged and will be getting remarried the next day. Walter can't let that happen and frames the fiancé, Bruce Baldwin, for one thing after another, to keep him temporarily held in prison, while trying to steer Hildy into returning to her old job as his employee."
1439,Tales of Frankenstein,"In this pilot for a series that was never picked up, Dr. Frankenstein has just finished rebuilding his creation, but the monster is unresponsive. He needs to try something different to make it work, perhaps some new parts. Enter a terminally ill sculptor and his assertive wife…"
1464,Robot Wrecks,"Spanky and the gang discover a demonstration of a ""human-like"" robot named Volto and are inspired to create a robot themselves to do their chores for them. Slicker Walburn convinces them they will need ""invisible rays"" to bring it to life which he just happens to have to sell to them. As they rush off to get their money, Slicker gets Boxcar Smith to wear the robot's outer body so when he ""brings"" the robot to life, it will be Boxcar bringing it to life. The gang unsuspectedly gets their robot to mow the lawn at Froggy's house, but with a signal from Slicker, Boxcar runs amok and mows down everything in his path. Froggy gets to explain what happened to his parents who bust up the fraud and get the miscreants to work with the gang to clean up the mess."
1504,I Now Pronounce You Chuck & Larry,"Firefighters Chuck Ford and Larry Valentine are guy's guys, loyal to the core—which is why when widower Larry asks Chuck to pose as his gay lover so that he can get domestic partner benefits for his kids, his buddy agrees. However, things get dicey when a bureaucrat comes calling, and the boys are forced to present a picture of domestic bliss."
1534,No Reservations,"Master chef Kate Armstrong runs her life and her kitchen with intimidating intensity. However, a recipe for disaster may be in the works when she becomes the guardian of her young niece while crossing forks with the brash sous-chef who just joined her staff. Though romance blooms in the face of rivalry, Kate needs to look outside the kitchen to find true happiness."
1608,Under Capricorn,"In 1831, Irishman Charles Adare travels to Australia to start a new life with the help of his cousin who has just been appointed governor. When he arrives he meets powerful landowner and ex-convict, Sam Flusky, who wants to do a business deal with him. Whilst attending a dinner party at Flusky's house, Charles meets Flusky's wife Henrietta who he had known as a child back in Ireland. Henrietta is an alcoholic and seems to be on the verge of madness."
1642,Eat the Rich,"Alex is a disgruntled waiter at a snobby exclusive restaurant who falls on hard times. Forced to deal with the contempt and disgust of the upper class, Alex & cohorts attempt to go on a rampage. Meanwhile, General Karprov and Spider plot to involve the inept anarchists into their plans to derail the prime-minister-to-be's campaign."
1753,Five Moons Plaza,Just the night before his retirement District Attorney Saracini is given a film showing the kidnapping of Aldo Moro.  As the District Attorney takes on the case he along with his team finds more compelling and secretive evidences.  Too many secrets are found that should stayed as secrets.
1789,The Borgia Stick,"A suburban couple discovers that they are pawns for a powerful crime syndicate. They try to break away from the cartel and go legitimate, but the syndicate doesn't want to give them up so easily."
