id,title,synopsis
4299,Tightrope,"wes block is a detective who's put on the case of a serial killer. his victims are young and pretty women, which he rapes and murders. the murders are getting personal when the killer chooses victims who are acquaintances of block. even his daughters are threatened."
4330,The Fly,"industrialist françois delambre is called late at night by his sister-in-law, helene delambre, who tells him that she has just killed her husband, andré. reluctant at first, she eventually explains to the police that andré invented a matter transportation apparatus and, while experimenting on himself, a fly entered the chamber during the matter transference."
4337,Police Academy 5: Assignment Miami Beach,the police academy misfits travel to miami beach for commandant lassard to be honored with a prestigious lifetime award pending his retirement. things take a turn when lassard unknowingly ends up in possession of stolen diamonds from a jewel heist.
4347,The Return of the Pink Panther,the famous pink panther jewel has once again been stolen and inspector clouseau is called in to catch the thief. the inspector is convinced that 'the phantom' has returned and utilises all of his resources – himself and his asian manservant – to reveal the identity of 'the phantom'.
4354,The Presidio,jay austin is now a civilian police detective. colonel caldwell was his commanding officer years before when he left the military police over a disagreement over the handling of a drunk driver. now a series of murders that cross jurisdictions force them to work together again. that austin is now dating caldwell's daughter is not helping their relationship.
4361,Fair Game,"max kirkpatrick is a cop who protects kate mcquean, a civil law attorney, from a renegade kgb team out to terminate her"
4382,Murder by Numbers,"tenacious homicide detective cassie mayweather and her still-green partner are working a murder case, attempting to profile two malevolently brilliant young men: cold, calculating killers whose dark secrets might explain their crimes."
4385,Police Academy 6: City Under Siege,"our favourite police men are called together to deal with a gang who rob banks and jewelers. using their various talents as well as their extraordinary luck, the crooks stand no chance against our men and women in blue."
4396,Saw V,"detective hoffman is seemingly the last person alive to carry on the jigsaw legacy. but when his secret is threatened, he must go on the hunt to eliminate all the loose ends."
4400,Dolores Claiborne,"dolores claiborne was accused of killing her abusive husband twenty years ago, but the court's findings were inconclusive and she was allowed to walk free. now she has been accused of killing her employer, vera donovan, and this time there is a witness who can place her at the scene of the crime. things look bad for dolores when her daughter selena, a successful manhattan magazine writer, returns to cover the story."
4402,Bride of Chucky,"chucky hooks up with another murderous doll, the bridal gown-clad tiffany, for a route 66 murder spree with their unwitting hosts."
4444,The Pink Panther,"when the coach of the france soccer team is killed by a poisoned dart in the stadium in the end of a game, and his expensive and huge ring with the diamond pink panther disappears, the ambitious chief inspector dreyfus assigns the worst police inspector jacques clouseau to the case."
4458,Police Academy 3: Back in Training,"when police funding is cut, the governor announces he must close one of the academies. to make it fair, the two police academies must compete against each other to stay in operation. mauser persuades two officers in lassard's academy to better his odds, but things don't quite turn out as expected..."
4462,Chain Reaction,two researchers in a green alternative energy project forced on the run when they are framed for murder and treason.
4476,White Chicks,"two fbi agent brothers, marcus and kevin copeland, accidentally foil a drug bust. as punishment, they are forced to escort a pair of socialites to the hamptons, where they're going to be used as bait for a kidnapper. but when the girls realize the fbi's plan, they refuse to go. left without options, marcus and kevin decide to pose as the sisters, transforming themselves from african-american men into a pair of blonde, white women."
4502,Pathology,"medical student ted grey graduates at the top of his class and quickly joins an elite pathology program, whose top students invite him into their circle. there he uncovers a gruesome secret: they play a game in which one tries to commit the perfect, undetectable murder, then the others compete to determine the victim's cause of death."
4505,Casino Royale,"sir james bond is called back out of retirement to stop smersh. in order to trick smersh, james thinks up the ultimate plan - that every agent will be named 'james bond'. one of the bonds, whose real name is evelyn tremble is sent to take on le chiffre in a game of baccarat, but all the bonds get more than they can handle."
4520,Jagged Edge,"san francisco heiress page forrester is brutally murdered in her remote beach house. her husband jack is devastated by the crime but soon finds himself accused of her murder. he hires lawyer teddy barnes to defend him, despite the fact she hasn't handled a criminal case for many years. there's a certain chemistry between them and teddy soon finds herself defending the man she loves."
4523,The Night Flier,"two investigative reporters for a tabloid magazine track down across country ""the night flier"", a serial killer who travels by private plane stalking victims in rural airports. one of the reporters, richard dees, begins to suspect that ""the night flier could perhaps be a vampire"""
4525,Curdled,"gabriela, a columbian immigrant, is obsessed with understanding violent crime. the current string of murders by ""the blue blood killer"" of affluent miami socialites provides her with fodder for her scrapbook of death. she lands a job with a post-murder cleaning service and during a blue-blood clean-up job, discovers evidence that police have overlooked."
4538,The Pink Panther Strikes Again,"charles dreyfus, who has finally cracked over inspector clouseau's antics, escapes from a mental institution and launches an elaborate plan to get rid of clouseau once and for all."
4577,The Hidden,"when average, law-abiding citizens suddenly turn to a life of hedonistic behavior and violent crime, detective tom beck (michael nouri) is tasked with helping young fbi agent lloyd gallagher (kyle maclachlan) determine the cause in this tense, sci-fi thriller."
4584,The Gingerbread Man,"savannah lawyer rick magruder is at a party celebrating his courtroom victory defending a cop killer when a member of the catering staff, mallory doss, discovers her car has been stolen. having had a few drinks, magruder offers to give her a lift home, a decision that turns into a one night stand. rick soon learns that her nut-case father, dixon, seems to have begun threatening her again. rick puts the force of his law firm behind mallory, who he barely knows, has dixon picked up by the police, and subpoenas the girl's belligerent ex-husband, pete, to testify against the old man. dixon is put away in an asylum. however, he soon escapes, putting the lives of everyone who conspired against him in jeopardy."
4585,Gridlock'd,"after a friend overdoses, spoon and stretch decide to kick their drug habits and attempt to enroll in a government detox program. their efforts are hampered by seemingly endless red tape, as they are shuffled from one office to another while being chased by drug dealers and the police."
4586,Ordinary Decent Criminal,"michael lynch is a notorious criminal with two wives and a flair for showmanship. he's also a huge embarrassment to the local police, who are determined to bring him down once and for all."
4593,Little Nikita,"roy parmenter is an fbi agent in san diego; 20 years ago his partner was killed by a soviet spy, nicknamed scuba, still at large. scuba is now trying to extort the soviets; to prove he's serious, he's killing their agents one by one, including ""sleepers,"" agents under deep cover awaiting orders. roy interviews a high school lad, jeff grant, an applicant to the air force academy. in a routine background check, roy discovers that jeff's parents are sleepers. he must see if jeff is also a spy, confront the parents yet protect them, and catch his nemesis. meanwhile, the soviets have sent their own spy-catcher, the loner karpov, to reel in scuba. alliances shift; it's cat and mouse."
4601,Shocker,"after being sent to the electric chair, a serial killer uses electricity to come back from the dead and carry out his vengeance on the football player who turned him in to the police."
4608,High Anxiety,"a psychiatrist with intense acrophobia (fear of heights) goes to work for a mental institution run by doctors who appear to be crazier than their patients, and have secrets that they are willing to commit murder to keep."
4611,Senseless,a student gets his senses enhanced by an experimental drug. but abuse is not an option.
4616,Citizen X,"based on the true story of a russian serial killer who, over many years, claimed victim to over 50 people. his victims were mostly under the age of 17. in what was then a communists state, the police investigations were hampered by bureaucracy, incompetence and those in power. the story is told from the viewpoint of the detective in charge of the case."
4618,First Kid,"some say that to be the leader of a country is one of the loneliest jobs in the world. but being the child of a world leader can be doubly so. constantly surrounded by security officers, restricted in movements and having almost every waking moment carefully monitored makes normalcy an impossibility. no one knows this better than young luke davenport, the son of u.s. president davenport. he vents his loneliness, frustration and feelings of isolation from family and friends by being a brat to his private secret service agent. when the agent snaps from the strain in front of the first lady, a new agent is assigned to luke. he turns out to be the enormous sam simms, a bit of a rogue who managed to rise through the ranks by sheer determination rather than strict adherence to secret-service protocol. at first, luke tries all his old tricks upon sam. but instead of getting angry, sam seems to actually understand."
4628,Riders,"an entrepreneurial criminal, slim (dorff) is as smart as they come. cocky and confident, he assembles a team of risk-taking rush-seekers to pull off a series of five bank heists, each time using a different extreme sport to make the getaway. following an unexpected windfall on only their second job, the gang nets $20 million in untraceable bonds. having scored enough money to retire on, slim and his crew decide to call the robbery game quits. but both the mob and the police have other plans in mind for slim: they want him to keep working, for them."
4640,Hellraiser: Inferno,"a shady police detective becomes embroiled in a strange world of murder, sadism and madness after being assigned a murder investigation against a madman known only as ""the engineer""."
4643,The Fury,"a government agent is determined to come to his son's rescue, when a sinister official kidnaps him to harness his extremely powerful psychic abilities."
4644,Freeze Frame,"sean veil is an ultra paranoid murder suspect who takes to filming himself round the clock to provide an alibi, just in case he's ever accused of another crime. problems arise however when the police do come calling and the one tape that can prove his innocence has mysteriously disappeared."
4648,Midnight Lace,kit preston begins to unravel when she receives threatening telephone calls informing her she's soon to be murdered.
4650,Cherry Falls,"cherry falls is a quiet little town - until the night that a serial killer begins preying on its youth. after a third teen is found slain, the killer's modus operandi emerges: the victims were all virgins. sheriff marken is concerned for the safety of the teens in general and in particular his own daughter jody, who is still a virgin..."
4653,Suspect,"when a supreme court judge commits suicide and his secretary is found murdered, all fingers point to carl anderson (liam neeson), a homeless veteran who's deaf and mute. but when public defender kathleen riley (cher) is assigned to his case, she begins to believe that anderson may actually be innocent. juror eddie sanger (dennis quaid), a washington lobbyist, agrees, and together the pair begins their own investigation of events."
4657,Live Wire,"danny o'neill is a bomb disposal expert assigned to a case where terrorists have developed an ""invisible"" liquid explosive which is activated within the human body."
4699,Orca,"after witnessing the killing of his mate and offspring at captain nolan's hands, a vengeful killer whale goes on a rampage in the fisherman's newfoundland harbor. under pressure from the villagers, nolan, rachel and umilak sail after the great beast, who will meet them on its own turf."
4744,Leaves of Grass,"an ivy league professor returns home, where his pot-growing twin brother has concocted a plan to take down a local drug lord."
4750,Belly,"tommy bundy and sincere are best friends as well as infamous and ruthless criminals and shot-callers in the hood. respected by many but feared by all.  as the police are closing in on them and new players are looking for a come up, will their reign last?"
4769,Split Second,"in a flooded future london, detective harley stone (rutger hauer) hunts a serial killer who murdered his partner and has haunted him ever since. he soon discovers what he is hunting might not be human."
4874,Rapid Fire,"college student jake lo is pursued by smugglers, mobsters and crooked federal agents after he witnesses a murder by a mafia kingpin."
4875,Showdown in Little Tokyo,"an american with a japanese upbringing, chris kenner is a police officer assigned to the little tokyo section of los angeles. kenner is partnered with johnny murata, a japanese-american who isn't in touch with his roots. despite their differences, both men excel at martial arts, and utilize their formidable skills when they go up against yoshida, a vicious yakuza drug dealer with ties to kenner's past."
4898,Watchmen,"in a gritty and alternate 1985 the glory days of costumed vigilantes have been brought to a close by a government crackdown, but after one of the masked veterans is brutally murdered, an investigation into the killer is initiated. the reunited heroes set out to prevent their own destruction, but in doing so uncover a sinister plot that puts all of humanity in grave danger."
4912,10th & Wolf,"a former street tough returns to his philadelphia home after a stint in the military. back on his home turf, he once again finds himself tangling with the mob boss who was instrumental in his going off to be a soldier."
4939,The Walker,an escort who caters to washington d.c.'s society ladies becomes involved in a murder case.
4940,Cleaner,"single father and former cop tom cutler has an unusual occupation: he cleans up death scenes. but when he's called in to sterilize a wealthy suburban residence after a brutal shooting, cutler is shocked to learn he may have unknowingly erased crucial evidence, entangling himself in a dirty criminal cover-up."
4958,Traitor,"when straight arrow fbi agent roy clayton heads up the investigation into a dangerous international conspiracy, all clues seem to lead back to former u.s. special operations officer, samir horn."
4991,Empire,a big time drug dealer victor rosa is looking to get out of the game and sees his chance with a big deal with a new friend who happens to be a wall st. stockbroker. thinking this will be his chance to go out on top victor soon finds out that he has been double crossed and his last option is to get revenge.
5007,Tortured,a mobster orders an undercover fbi agent to torture an accountant.
5033,The Truth About Charlie,"when regina lambert returns from a vacation to paris, she finds not only her apartment, but also her bank account completely empty. a visit to the police headquarters reveals that charlie has been murdered and a lot of people are after his money. regina now begins a dangerous search for the truth."
5044,Push,"after his father, an assassin, is brutally murdered, nick gant vows revenge on division, the covert government agency that dabbles in psychic warfare and experimental drugs. hiding in hong kong's underworld, nick assembles a band of rogue psychics dedicated to destroying division. together with cassie, a teenage clairvoyant, nick goes in search of a missing girl and a stolen suitcase that could be the key to accomplishing their mutual goal."
5071,Man of the House,texas ranger roland sharp is assigned to protect the only witnesses to the murder of a key figure in the prosecution of a drug kingpin -- a group of university of texas cheerleaders. sharp must now go undercover as an assistant cheerleading coach and move in with the young women.
5089,The Weight of Water,"a newspaper photographer, jean, researches the lurid and sensational axe murder of two women in 1873 as an editorial tie-in with a brutal modern double murder. she discovers a cache of papers that appear to give an account of the murders by an eyewitness."
5101,American Nightmare,a deranged female serial killer stalks seven young people whom phone a radio call-in show to discuss their darkest fears and a night-long game of cat-and-mouse is put into motion by the darkly sinister-looking murderess.
5121,Thr3e,innocent lives hang on the whim of an elusive psychopathic murderer whose strange riddles and impossible timelines force three people into a mission to end the game before one or all of them die.
5124,Twisted,"recently promoted and transferred to the homicide division, inspector jessica shepard feels pressure to prove herself -- and what better way than by solving san francisco's latest murder? however, as shepard and her partner, mike delmarco, soon discover, the victim shared a romantic connection to her. as more of shepard's ex-lovers turn up dead, her mind starts to become unstable, and she begins to wonder if she could be the very killer she's trying to track down."
5125,The United States of Leland,"a withdrawn young man, leland fitzgerald is imprisoned for the murder of a mentally disabled boy, who also happened to be the brother of his girlfriend, becky. as the community struggles to deal with the killing, pearl madison, a teacher at the prison, decides to write about leland's case. meanwhile, others affected by the murder, including becky and her sister, julie, must contend with their own problems."
5209,L'amour aux trousses,"franck and paul are working as team buddies in their paris police unit. they are sent on a mission in toulon to solve a drug traffic mystery, but things get out of hand when paul learns that franck has an affair with valeria, his wife, who also happens to work in the police forces..."
5210,At Close Range,"based upon the true story of bruce johnston sr., his son, and his brothers; together, they constituted one of suburban philadelphia's most notorious crime families during the 1970s. their criminal activities ranged from burglary, theft... and ultimately, murder."
5212,Half Past Dead 2,"long time inmate twitch (kurupt) gets himself transfered to a tougher prison than the re-opened alcatraz. he claims it's to be closer to his lady but his real motives are a bit more grandiose. there he crosses paths with burke (bill goldberg) a bulky prisoner who can take care of himself. twitch, despite being less muscular, is just as mouthy and is pretty much the same. but there is a gang war brewing between the black and hispanic inmates that explodes into a hostile takeover of the prison when the black's gang leader is shot dead and the finger points at burke. but the sh!t really hits the fan when the real killer and leader of the hispanics, cortez (robert madrid) takes twitch's girlfriend and burke's daughter hostage."
5223,The Private Eyes,"the lord and lady of a capacious manor are killed, and the lord's ghost seems to have returned to knock off the staff one by one, causing inspector winship and dr. tart to investigate the wacky house and its inhabitants."
5233,Macbeth,"macbeth, loyal to his crime boss, duncan, is told by witches that he will one day take over. driven by their prophecy, he and his wife plot to kill duncan, and takes the leadership of the gang for himself. maintaining his power will require more murder and violence, finally driving his surviving enemies to unite and destroy him. a sexy, high octane retelling of this classic story."
5255,Amusement,"while being interrogated by a police psychiatrist, the near-catatonic tabitha tries to explain why she and two of her childhood friends are being hunted by a serial killer. the truth that's dying to come out weaves together three tragic secrets from their past. two of the girls' boyfriends become unwitting targets in their deadly game."
5256,Fast & Furious,"when a crime brings them back to l.a., fugitive ex-con dom toretto reignites his feud with agent brian o'conner. but as they are forced to confront a shared enemy, dom and brian must give in to an uncertain new trust if they hope to outmaneuver him. and the two men will find the best way to get revenge: push the limits of what's possible behind the wheel."
5282,Alibi,"chick williams, a prohibition gangster, rejoins his mob soon after being released from prison. when a policeman is murdered during a robbery, he falls under suspicion. the gangster took joan, a policeman's daughter, to the theater, sneaked out during the intermission to commit the crime, then used her to support his alibi. the detective squad employs its most sophisticated and barbaric techniques, including planting an undercover agent in the gang, to bring him to justice."
5322,Toxic,"the lives of a nightclub owner, a crime boss, a stripper, a bartender, two hitmen, a prostitute and a psychic take a turn for the worse when they are trapped in an escaped mental patient's sinister path of madness and destruction."
5332,Shooting Gallery,"a street-smart pool player falls in with a pack of hustlers. as he rises in the underground circuit, he lands in the middle of a match between his boss and a crooked cop."
5355,The Alphabet Killer,"based on the true story of double killings occurring in rochester, ny during the 80’s and the troubled police officer determined to solve them, with or without the help of her department"
5386,The Art of War II: Betrayal,agent neil shaw is called out of retirement and finds himself in the midst of a plot to assassinate several leading senators with himself set-up to take the rap for a recent killing
5434,Ten 'til Noon,"between 11:50 and 12:00 noon, a crime is commited. in the same ten minute period, we follow the lives of the ten people, all connected to this crime. as we see each person's point of view, we are propelled closer and closer to the truth of what exactly happened...and why."
5439,Shoot on Sight,"tariq ali, a muslim police officer of scotland yard, is asked to hunt-down suspected suicide-bombers against the backdrop of july 7 bombings in london. tariq's task gets complicated as an innocent muslim is killed by the commando shooters of scotland yard. on the other hand, tariq - a british citizen is himself a suspect in the eyes of his boss, despite his long service in the scotland yard"
5496,Wake of Death,"ben archer, an ex-mob enforcer, seeks revenge against a ruthless chinese kingpin responsible for his wife's brutal murder. when archer joins forces with his old underworld friends, an all-out war is waged against the chinese triad."
5528,Do You Like Hitchcock?,"in 1990, as a boy, giulio was chased through the woods by two women after spying on them practicing witchcraft. now a young film student in turin, he watches his neighbors in the flats across from his third floor apartment, especially sasha when she's naked or arguing with her mother. giulio's girlfriend is disgusted with his voyeurism, but, after a murder occurs, giulio is convinced that two relative strangers, just as in hitchcock and highsmith's ""strangers in a train,"" have agreed to murder each other's bête noir. he follows his suspects, ends up with an intruder and a broken foot, and may be in real danger. is he more than a peeping tom?"
5532,Brainscan,a lonely teenage horror-movie fan discovers a mysterious computer game that uses hypnosis to custom-tailor the game into the most terrifying experience imaginable. when he emerges from the hypnotic trance he is horrified to find evidence that the brutal murder depicted in the game actually happened -- and he's the killer.
5535,Maniac Cop,"in new york, people are slain and strangled to death brutally on the open street. all witnesses agree that the murderer was in a cop's uniform. soon the police search and find a suspect in its own ranks: jack forrest, suspected of murdering his own wife and the rest of the unfortunate individuals to die by the maniac cop’s reign of terror. to prove his innocence, he investigates the case with his partner, theresa mallory."
5545,Vice,"michael madsen stars as max walker, a down-and-out cop who becomes the target of a bloodthirsty drug cartel after he leads a narcotics bust to intercept a large shipment of heroin. when someone starts picking off his team members -- and the drugs seized in the raid suddenly disappear -- walker pairs up with one of his detectives (daryl hannah) to uncover a conspiracy that may go straight up the chain of command."
5549,Desperate Living,"a rich housewife enlists her maid's help to murder her husband; they go on the lam and end up in mortville, a homeless community built into a garbage dump."
