id,title,synopsis
1,Judgment Night,"while racing to a boxing match, frank, mike, john and rey get more than they bargained for. a wrong turn lands them directly in the path of fallon, a vicious, wise-cracking drug lord. after accidentally witnessing fallon murder a disloyal henchman, the four become his unwilling prey in a savage game of cat & mouse as they are mercilessly stalked through the urban jungle in this taut suspense drama"
18,Unforgiven,"william munny is a retired, once-ruthless killer turned gentle widower and hog farmer. to help support his two motherless children, he accepts one last bounty-hunter mission to find the men who brutalized a prostitute. joined by his former partner and a cocky greenhorn, he takes on a corrupt sheriff."
24,Twelve Monkeys,"in the year 2035, convict james cole reluctantly volunteers to be sent back in time to discover the origin of a deadly virus that wiped out nearly all of the earth's population and forced the survivors into underground communities. but when cole is mistakenly sent to 1990 instead of 1996, he's arrested and locked up in a mental hospital. there he meets psychiatrist dr. kathryn railly, and patient jeffrey goines, the son of a famous virus expert, who may hold the key to the mysterious rogue group, the army of the 12 monkeys, thought to be responsible for unleashing the killer disease."
26,Absolute Power,"a master thief coincidentally is robbing a house where a murder—in which the president of the united states is involved—occurs in front of his eyes. he is forced to run, while holding evidence that could convict the president."
32,American History X,"derek vineyard is paroled after serving 3 years in prison for killing two african-american men. through his brother, danny vineyard's narration, we learn that before going to prison, derek was a skinhead and the leader of a violent white supremacist gang that committed acts of racial crime throughout l.a. and his actions greatly influenced danny. reformed and fresh out of prison, derek severs contact with the gang and becomes determined to keep danny from going down the same violent path as he did."
39,Miami Vice,"a case involving drug lords and murder in south florida takes a personal turn for undercover detectives sonny crockett and ricardo tubbs. unorthodox crockett gets involved romantically with the chinese-cuban wife of a trafficker of arms and drugs, while tubbs deals with an assault on those he loves."
45,Beverly Hills Cop,"the heat is on in this fast paced action-comedy starring eddie murphy as axel foley, a street smart detroit cop tracking down his best friend's killer in beverly hills. axel quickly learns that his wild style doesn't fit in with the beverly hills police department, which assigns two officers (judge reinhold & john ashton) to make sure things don't get out of hand. dragging the stuffy detectives along for the ride, axel smashes through a huge culture clash in his hilarious, high-speed pursuit of justice. featuring cameos by paul reiser, bronson pinchot and damon wayans, beverly hills cop is an exhilarating, sidesplitting adventure."
47,Anatomy of a Murder,"semi-retired michigan lawyer paul biegler takes the case of army lt. manion, who murdered a local innkeeper after his wife claimed that he raped her. over the course of an extensive trial, biegler parries with district attorney lodwick and out-of-town prosecutor claude dancer to set his client free, but his case rests on the victim's mysterious business partner, who's hiding a dark secret."
50,Beverly Hills Cop II,"axel heads for the land of sunshine and palm trees to find out who shot police captain andrew bogomil. thanks to a couple of old friends, axel's investigation uncovers a series of robberies masterminded by a heartless weapons kingpin—and the chase is on."
59,Scarface,"after getting a green card in exchange for assassinating a cuban government official, tony montana stakes a claim on the drug trade in miami. viciously murdering anyone who stands in his way, tony eventually becomes the biggest drug lord in the state, controlling nearly all the cocaine that comes through miami. but increased pressure from the police, wars with colombian drug cartels and his own drug-fueled paranoia serve to fuel the flames of his eventual downfall."
63,The Untouchables,"young treasury agent elliot ness arrives in chicago and is determined to take down al capone, but it's not going to be easy because capone has the police in his pocket. ness meets jimmy malone, a veteran patrolman and probably the most honorable one on the force. he asks malone to help him get capone, but malone warns him that if he goes after capone, he is going to war."
80,48 Hrs.,"a hard-nosed cop reluctantly teams up with a wise-cracking criminal temporarily paroled to him, in order to track down a killer."
84,The Dark Knight,"batman raises the stakes in his war on crime. with the help of lt. jim gordon and district attorney harvey dent, batman sets out to dismantle the remaining criminal organizations that plague the streets. the partnership proves to be effective, but they soon find themselves prey to a reign of chaos unleashed by a rising criminal mastermind known to the terrified citizens of gotham as the joker."
93,Predator 2,"ten years after a band of mercenaries first battled a vicious alien, the invisible creature from another world has returned to earth—and this time, it’s drawn to the gang-ruled and ravaged city of los angeles. when it starts murdering drug dealers, detective-lieutenant mike harrigan and his police force set out to capture the creature, ignoring warnings from a mysterious government agent to stay away."
94,28 Days Later,"twenty-eight days after a killer virus was accidentally unleashed from a british research facility, a small group of london survivors are caught in a desperate struggle to protect themselves from the infected. carried by animals and humans, the virus turns those it infects into homicidal maniacs -- and it's absolutely impossible to contain."
98,Saw,"obsessed with teaching his victims the value of life, a deranged, sadistic serial killer abducts the morally wayward. once captured, they must face impossible choices in a horrific game of survival. the victims must fight to win their lives back, or die trying..."
101,The Interpreter,"after silvia broome, an interpreter at united nations headquarters, overhears plans of an assassination, an american secret service agent is sent to investigate."
102,Minority Report,"john anderton is a top 'precrime' cop in the late-21st century, when technology can predict crimes before they're committed. but anderton becomes the quarry when another investigator targets him for a murder charge."
125,Saw III,"jigsaw has disappeared. along with his new apprentice amanda, the puppet-master behind the cruel, intricate games that have terrified a community and baffled police has once again eluded capture and vanished. while city detective scramble to locate him, doctor lynn denlon and jeff reinhart are unaware that they are about to become the latest pawns on his vicious chessboard."
126,Saw II,"when a new murder victim is discovered with all the signs of jigsaw's hand, detective eric matthews begins a full investigation and apprehends jigsaw with little effort. but for jigsaw, getting caught is just another part of his plan. eight more of his victims are already fighting for their lives and now it's time for matthews to join the game."
144,Natural Born Killers,two victims of traumatized childhoods become lovers and psychopathic serial murderers irresponsibly glorified by the mass media.
154,Live and Let Die,james bond must investigate a mysterious murder case of a british agent in new orleans. soon he finds himself up against a gangster boss named mr. big.
186,Beverly Hills Cop III,"back in sunny southern california and on the trail of two murderers, axel foley again teams up with la cop billy rosewood. soon, they discover that an amusement park is being used as a front for a massive counterfeiting ring – and it's run by the same gang that shot billy's boss."
198,Snakes on a Plane,"america is on the search for the murderer eddie kim. sean jones must fly to l.a. to testify in a hearing against kim. accompanied by fbi agent neville flynn, the flight receives some unexpected visitors."
199,Brother,"a japanese yakuza gangster’s deadly existence in his homeland gets him exiled to los angeles, where he is taken in by his little brother and his brother’s gang."
220,Inside Man,"when an armed, masked gang enter a manhattan bank, lock the doors and take hostages, the detective assigned to effect their release enters negotiations preoccupied with corruption charges he is facing."
231,Basic Instinct,"a police detective is in charge of the investigation of a brutal murder, in which a beautiful and seductive woman could be involved."
267,Shaft,cool black private eye john shaft is hired by a crime lord to find and retrieve his kidnapped daughter.
270,Good Will Hunting,"will hunting has a genius-level iq but chooses to work as a janitor at mit. when he solves a difficult graduate-level math problem, his talents are discovered by professor gerald lambeau, who decides to help the misguided youth reach his potential. when will is arrested for attacking a police officer, professor lambeau makes a deal to get leniency for him if he will get treatment from therapist sean maguire."
272,Shaft's Big Score!,john shaft is back as the lady-loved black detective cop on the search for the murderer of a client.
273,Shaft in Africa,"detective john shaft travels incognito to ethiopia, then france, to bust a human trafficking ring."
276,Reservoir Dogs,"a botched robbery indicates a police informant, and the pressure mounts in the aftermath at a warehouse. crime begets violence as the survivors -- veteran mr. white, newcomer mr. orange, psychopathic parolee mr. blonde, bickering weasel mr. pink and nice guy eddie -- unravel."
280,Monster,"an emotionally scarred highway drifter shoots a sadistic trick who rapes her, and ultimately becomes the united states' first female serial killer."
319,Constantine,"john constantine has literally been to hell and back. when he teams up with a policewoman to solve the mysterious suicide of her twin sister, their investigation takes them through the world of demons and angels that exists beneath the landscape of contemporary los angeles."
324,Rear Window,a wheelchair-bound photographer spies on his neighbors from his apartment window and becomes convinced one of them has committed murder.
327,Frenzy,"after a serial killer strangles several women with a necktie, london police identify a suspect—but he's the wrong man."
331,Jaws,"when an insatiable great white shark terrorizes the townspeople of amity island, the police chief, an oceanographer and a grizzled shark hunter seek to destroy the blood-thirsty beast."
332,Jaws 2,police chief brody must protect the citizens of amity after a second monstrous shark begins terrorizing the waters.
336,2 Fast 2 Furious,"it's a major double-cross when former police officer brian o'conner teams up with his ex-con buddy roman pearce to transport a shipment of ""dirty"" money for shady miami-based import-export dealer carter verone. but the guys are actually working with undercover agent monica fuentes to bring verone down."
342,The Da Vinci Code,"a murder in paris’ louvre museum and cryptic clues in some of leonardo da vinci’s most famous paintings lead to the discovery of a religious mystery. for 2,000 years a secret society closely guards information that — should it come to light — could rock the very foundations of christianity."
367,The Ninth Gate,"an all-expenses-paid international search for a rare copy of the book, 'the nine gates of the kingdom  of shadows' brings an unscrupulous book dealer deep into a world of murder, double-dealing and satanic worship."
373,The Usual Suspects,"held in an l.a. interrogation room, verbal kint attempts to convince the feds that a mythic crime lord, keyser soze, not only exists, but was also responsible for drawing him and his four partners into a multi-million dollar heist that ended with an explosion in san pedro harbor – leaving few survivors. verbal lures his interrogators with an incredible story of the crime lord's almost supernatural prowess."
378,Angel Heart,"down-and-out private detective harry angel is ordered by the mysterious louis cyphre to go on a mission to find a missing person. his routine failure soon leads to a bloody spar with himself, as he goes on a supernatural journey into his own soul."
380,Lost Highway,"a tormented jazz musician finds himself lost in an enigmatic story involving murder, surveillance, gangsters, doppelgangers, and an impossible transformation inside a prison cell."
382,Catch Me If You Can,"a true story about frank abagnale jr. who, before his 19th birthday, successfully conned millions of dollars worth of checks as a pan am pilot, doctor, and legal prosecutor. an fbi agent makes it his mission to put him behind bars. but frank not only eludes capture, he revels in the pursuit."
392,From Russia with Love,"agent 007 is back in the second installment of the james bond series, this time battling a secret crime organization known as spectre. russians rosa klebb and kronsteen are out to snatch a decoding device known as the lektor, using the ravishing tatiana to lure bond into helping them. bond willingly travels to meet tatiana in istanbul, where he must rely on his wits to escape with his life in a series of deadly encounters with the enemy"
395,Saw IV,"jigsaw and his apprentice amanda are dead. now, upon the news of detective kerry's murder, two seasoned fbi profilers, agent strahm and agent perez, arrive in the terrified community to assist the veteran detective hoffman in sifting through jigsaw's latest grisly remains and piecing together the puzzle. however, when swat commander rigg is abducted and thrust into a game, the last officer untouched by jigsaw has but ninety minutes to overcome a series of demented traps and save an old friend...or face the deadly consequences."
411,The Man with the Golden Gun,"cool government operative james bond searches for a stolen invention that can turn the sun's heat into a destructive weapon. he soon crosses paths with the menacing francisco scaramanga, a hit man so skilled he has a seven-figure working fee. bond then joins forces with the swimsuit-clad mary goodnight, and together they track scaramanga to a tropical isle hideout where the killer-for-hire lures the slick spy into a deadly maze for a final duel."
415,The Spy Who Loved Me,russian and british submarines with nuclear missiles on board both vanish from sight without a trace. england and russia both blame each other as james bond tries to solve the riddle of the disappearing ships. but the kgb also has an agent on the case.
431,Licence to Kill,"after capturing the notorious drug lord franz sanchez, bond's close friend and former cia agent felix leiter is left for dead and his wife is murdered. bond goes rogue and seeks vengeance on those responsible, as he infiltrates sanchez's organization from the inside."
441,Murder She Said,"miss marple believes she's seen a murder in a passing-by train, yet when the police find no evidence she decides to investigate it on her own."
442,Murder at the Gallop,"miss marple and mr. stringer are witnesses to the death by heart attack of elderly, rich mr. enderby. yet they have their doubts about what happened. the police don't believe them, thus leading miss marple to yet again investigate by herself."
445,Face/Off,"sean archer, a very tough, rugged fbi agent. who is still grieving for his dead son michael. archer believes that his son's killer is his sworn enemy, a very powerful criminal, castor troy. one day, archer has finally cornered castor, however, their fight has knocked out troy cold. as archer finally breathes easy over the capture of his enemy, he finds out that troy has planted a bomb that will destroy the entire city of los angeles and all of its inhabitants. unfortunately the only other person who knows its location is castor's brother pollux, and he refuses to talk. the solution, a special operation doctor that can cut off people's faces, and can place a person's face onto another person. archer undergoes one of those surgeries to talk to pollux. however, castor troy somehow regains consciousness and now wants revenge on archer for taking his face. not only is troy ruining archer's mission, but his personal life as well. archer must stop troy again. this time, it's personal."
448,Murder Most Foul,a murderer is brought to court and only miss marple is unconvinced of his innocence. once again she begins her own investigation.
480,Se7en,"two homicide detectives are on a desperate hunt for a serial killer whose crimes are based on the ""seven deadly sins"" in this dark and haunting film that takes viewers from the tortured remains of one victim to the next. the seasoned det. sommerset researches each sin in an effort to get inside the killer's mind, while his novice partner, mills, scoffs at his efforts to unravel the case."
539,A Few Good Men,"when cocky military lawyer lt. daniel kaffee and his co-counsel, lt. cmdr. joanne galloway, are assigned to a murder case, they uncover a hazing ritual that could implicate high-ranking officials such as shady col. nathan jessep."
558,The Thomas Crown Affair,"a very rich and successful playboy amuses himself by stealing artwork, but may have met his match in a seductive detective."
560,Bullitt,"senator walter chalmers is aiming to take down mob boss pete ross with the help of testimony from the criminal's hothead brother johnny, who is in protective custody in san francisco under the watch of police lieutenant frank bullitt. when a pair of mob hitmen enter the scene, bullitt follows their trail through a maze of complications and double-crosses. this thriller includes one of the most famous car chases ever filmed."
575,The Pink Panther,"the trademark of the phantom, a renowned jewel thief, is a glove left at the scene of the crime. inspector clouseau, an expert on the phantom's exploits, feels sure that he knows where the phantom will strike next and leaves paris for the tyrolean alps, where the famous lugashi jewel 'the pink panther' is going to be. however, he does not know who the phantom really is, or for that matter who anyone else really is..."
580,Lethal Weapon 3,"archetypal buddy cops riggs and murtaugh are back for another round of high-stakes action, this time setting their collective sights on bringing down a former los angeles police lieutenant turned black market weapons dealer. lorna cole joins as the beautiful yet hardnosed internal affairs sergeant who catches riggs's eye."
581,Lethal Weapon 4,"in the combustible action franchise's final installment, maverick detectives martin riggs and roger murtaugh square off against asian mobster wah sing ku, who's up to his neck in slave trading and counterfeit currency. with help from gumshoe leo getz and smart-aleck rookie cop lee butters, riggs and murtaugh aim to take down ku and his gang."
585,Heat,"obsessive master thief, neil mccauley leads a top-notch crew on various daring heists throughout los angeles while determined detective, vincent hanna pursues him without rest. each man recognizes and respects the ability and the dedication of the other even though they are aware their cat-and-mouse game may end in violence."
589,Mission: Impossible,"when ethan hunt, the leader of a crack espionage team whose perilous operation has gone awry with no explanation, discovers that a mole has penetrated the cia, he's surprised to learn that he's the no. 1 suspect. to clear his name, hunt now must ferret out the real double agent and, in the process, even the score."
590,Mission: Impossible II,"with computer genius luther stickell at his side and a beautiful thief on his mind, agent ethan hunt races across australia and spain to stop a former imf agent from unleashing a genetically engineered biological weapon called chimera. this mission, should hunt choose to accept it, plunges him into the center of an international crisis of terrifying magnitude."
595,The Maltese Falcon,"a private detective takes on a case that involves him with three eccentric criminals, a beautiful liar, and their quest for a priceless statuette."
600,Dog Day Afternoon,"based on the true story of would-be brooklyn bank robbers john wojtowicz and salvatore naturale. sonny and sal attempt a bank heist which quickly turns sour and escalates into a hostage situation and stand-off with the police. as sonny's motives for the robbery are slowly revealed and things become more complicated, the heist turns into a media circus."
609,Dirty Harry,"when a madman dubbed 'scorpio' terrorizes san francisco, hard-nosed cop, harry callahan – famous for his take-no-prisoners approach to law enforcement – is tasked with hunting down the psychopath. harry eventually collars scorpio in the process of rescuing a kidnap victim, only to see him walk on technicalities. now, the maverick detective is determined to nail the maniac himself."
621,Double Indemnity,"a rich woman and a calculating insurance agent plot to kill her unsuspecting husband after he signs a double indemnity policy. against a backdrop of distinctly californian settings, the partners in crime plan the perfect murder to collect the insurance, which pays double if the death is accidental."
625,The French Connection,tough narcotics detective 'popeye' doyle is in hot pursuit of a suave french drug dealer who may be the key to a huge heroin-smuggling operation.
630,Point Break,"in los angeles, a gang of bank robbers who call themselves the ex-presidents commit their crimes while wearing masks of reagan, carter, nixon and johnson. believing that the members of the gang could be surfers, the f.b.i. sends young agent johnny utah to the beach undercover to mix with the surfers and gather information."
648,Hannibal Rising,"the story of the early, murderous roots of the cannibalistic killer, hannibal lecter – from his hard-scrabble lithuanian childhood, where he witnesses the repulsive lengths to which hungry soldiers will go to satiate themselves, through his sojourn in france, where as a med student he hones his appetite for the kill."
649,Hollywoodland,"the complicated life and controversial suicide of george reeves is investigated by a fictional private detective who finds that there are reasons to suspect that reeves may not have killed himself after all. the detective also finds that there is a little of george reeves in himself, and maybe, each of us."
658,Street Kings,"tom ludlow is a disillusioned l.a. police officer, rarely playing by the rules and haunted by the death of his wife. when evidence implicates him in the execution of a fellow officer, he is forced to go up against the cop culture he's been a part of his entire career, ultimately leading him to question the loyalties of everyone around him."
706,The Departed,"to take down south boston's irish mafia, the police send in one of their own to infiltrate the underworld, not realizing the syndicate has done likewise. while an undercover cop curries favor with the mob kingpin, a career criminal rises through the police ranks. but both sides soon discover there's a mole among them."
710,Once Upon a Time in Mexico,"hitman ""el mariachi"" becomes involved in international espionage involving a psychotic cia agent and a corrupt mexican general."
715,Little Children,"the lives of two lovelorn spouses from separate marriages, a registered sex offender, and a disgraced ex-police officer intersect as they struggle to resist their vulnerabilities and temptations."
723,Touch of Evil,"when a car bomb explodes on the american side of the u.s./mexico border, mexican drug enforcement agent miguel vargas begins his investigation, along with american police captain hank quinlan. when vargas begins to suspect that quinlan and his shady partner, menzies, are planting evidence to frame an innocent man, his investigations into their possible corruption quickly put himself and his new bride, susie, in jeopardy."
727,Get Carter,"jack carter is a small-time hood working in london. when word reaches him of his brothers death, he travels to newcastle to attend the funeral. refusing to accept the police report of suicide, carter seeks out his brother’s friends and acquaintances to learn who murdered his sibling and why."
732,Miss Congeniality,"when the local fbi office receives a letter from a terrorist known only as 'the citizen', it's quickly determined that he's planning his next act at the miss america beauty pageant. because tough-as-nails gracie hart is the only female agent at the office, she's chosen to go undercover as the contestant from new jersey."
740,Spy Game,"on the day of his retirement, a veteran cia agent learns that his former protégé has been arrested in china, is sentenced to die the next morning in beijing, and that the cia is considering letting that happen to avoid an international scandal."
759,Die Hard 2,"off-duty cop john mcclane is gripped with a feeling of déjà vu when, on a snowy christmas eve in the nation’s capital, terrorists seize a major international airport, holding thousands of holiday travelers hostage. renegade military commandos led by a murderous rogue officer plot to rescue a drug lord from justice and are prepared for every contingency except one: mcclane’s smart-mouthed heroics."
765,Rope,two men attempt to prove they committed the perfect crime by hosting a dinner party after strangling their former classmate to death.
